City,State,Institution,Transfer Course ID,Transfer Course Name,RPI Course ID,RPI Course Name,Note,Begin,End,Transfer Catalog
Queensbury,NY,Adirondack Community College,COM 151,Multi - Media Communications,COMM 1000,Communication Elective,,,,SUNY Adirondack Community College
Queensbury,NY,Adirondack Community College,COM 172,Introduction To Telecommunications,COMM 1000,Communication Elective,,,,SUNY Adirondack Community College
Queensbury,NY,Adirondack Community College,COM 183,Mass Communications,COMM 1000,Communication Elective,,,,SUNY Adirondack Community College
Queensbury,NY,Adirondack Community College,SPH 111,Introduction To Public Speaking,COMM 1000,Communication Elective,,,,SUNY Adirondack Community College
Adrian,MI,Adrian College,COMM102,Principles & Practices Of Public Speaking,COMM 1000,Communication Elective,,,,Adrian College Undergraduate
Albany,NY,Albany College Of Pharmacy And Health Sciences,COM 101,Academic Reading And Writing,COMM 1000,Communication Elective,,,,Albany College Of Pharmacy And Health Sciences
Albany,NY,Albany College Of Pharmacy And Health Sciences,COM 115,Principles Of Communication,COMM 1000,Communication Elective,,,,Albany College Of Pharmacy And Health Sciences
Washington,DC,American University,COMM-105,Visual Literacy Fa1,COMM 1000,Communication Elective,,,,American University
Washington,DC,American University,OGIS-130,Intercultural Understanding,COMM 1000,Communication Elective,,,,American University
Cairo, ,American University In Cairo,RHET 2220,Public Speaking,COMM 1000,Communication Elective,,,,American University In Cairo
Clarksville,TN,Austin Peay State University,COMM 1010,Fundamentals Of Public Speaking,COMM 1000,Communication Elective,,,,Austin Peay State University Undergraduate
Bakersfield,CA,Bakersfield College,SPCH 1,Speech Communication,COMM 1000,Communication Elective,,,,Bakersfield College
Waco,TX,Baylor University,BIC 1323,World Of Rhetoric II: Rhetoric In Context,COMM 1000,Communication Elective,,,,Baylor University Undergraduate
Waco,TX,Baylor University,BIC 1413,World Of Rhetoric I,COMM 1000,Communication Elective,,,,Baylor University Undergraduate
Bellevue,WA,Bellevue College,ENGL 109,Information Resources,COMM 1000,Communication Elective,,,,Bellevue College
Paramus,NJ,Bergen Community College,COM-100,Speech Communication,COMM 1000,Communication Elective,,,,Bergen Community College
Paramus,NJ,Bergen Community College,SPE-111,Speech Communication,COMM 1000,Communication Elective,,,,Bergen Community College
Pittsfield,MA,Berkshire Community College,COM 104,Introduction To Interpersonal Communication,COMM 1000,Communication Elective,,,,Berkshire Community College
Pittsfield,MA,Berkshire Community College,COM 105,Introduction To Oral Communication,COMM 1000,Communication Elective,,,,Berkshire Community College
Pittsfield,MA,Berkshire Community College,COM 106,Introduction To Oral Interpretation Of Literature,COMM 1000,Communication Elective,,,,Berkshire Community College
Pittsfield,MA,Berkshire Community College,COM 107,Introduction To Oral Communication In Business,COMM 1000,Communication Elective,,,,Berkshire Community College
Greenville,SC,Bob Jones University,SP 101,Fundamentals Of Speech,COMM 1000,Communication Elective,,,,Bob Jones University Undergraduate
Waltham,MA,Brandeis University,AMST 166b,American Political Satire,COMM 1000,Communication Elective,,,,Brandeis University
Lincroft,NJ,Brookdale Community College,JOUR101,Introduction To Journalism,COMM 1000,Communication Elective,,,,Brookdale Community College
Lincroft,NJ,Brookdale Community College,SPCH115,Public Speaking,COMM 1000,Communication Elective,,,,Brookdale Community College
Fort Lauderdale,FL,Broward College,SPC1608,Introduction To Public Speaking,COMM 1000,Communication Elective,,,,Broward College
Newtown,PA,Bucks County Community College,COMG110,Effective Speaking,COMM 1000,Communication Elective,,,,Bucks County Community College
Newtown,PA,Bucks County Community College,COMM 110,Effective Speaking,COMM 1000,Communication Elective,,,,Bucks County Community College
Bristol,PA,Bucks County Community College-Lower Bucks Campus,COMG110,Effective Speaking,COMM 1000,Communication Elective,,,,Bucks County Community College
Bristol,PA,Bucks County Community College-Lower Bucks Campus,COMM 110,Effective Speaking,COMM 1000,Communication Elective,,,,Bucks County Community College
Perkasie,PA,Bucks County Community College-Upper Bucks Campus,COMG110,Effective Speaking,COMM 1000,Communication Elective,,,,Bucks County Community College
Perkasie,PA,Bucks County Community College-Upper Bucks Campus,COMM 110,Effective Speaking,COMM 1000,Communication Elective,,,,Bucks County Community College
Boston,MA,Bunker Hill Community College,ENG-171,Oral Communication,COMM 1000,Communication Elective,,,,Bunker Hill Community College
Aptos,CA,Cabrillo College,COMM-2,Group Discussion,COMM 1000,Communication Elective,,,,Cabrillo College Course Descriptions
Aptos,CA,Cabrillo College,COMM-6,Listening,COMM 1000,Communication Elective,,,,Cabrillo College Course Descriptions
San Luis Obispo,CA,California Polytechnic State University-San Luis Obispo,COMS 101,Public Speaking,COMM 1000,Communication Elective,,,,California Polytechnic State University San Luis Obispo
San Luis Obispo,CA,California Polytechnic State University-San Luis Obispo,GRC 101,Introduction To Graphic Communication,COMM 1000,Communication Elective,COMM 1000 (3cr),05/01/2023,05/01/2026,California Polytechnic State University San Luis Obispo
Long Beach,CA,California State University-Long Beach,COMM 130,Essentials Of Public Speaking,COMM 1000,Communication Elective,,,,California State University Long Beach
West Barnstable,MA,Cape Cod Community College,COM103,Human Communication,COMM 1000,Communication Elective,,,,Cape Cod Community College
West Barnstable,MA,Cape Cod Community College,EN103,Oral Communication,COMM 1000,Communication Elective,,,,Cape Cod Community College
Castleton,VT,Castleton University,ENG 1070,Effective Speaking,COMM 1000,Communication Elective,,,,Castleton University Undergraduate
Auburn,NY,Cayuga Community College,ENGL 222,Effective Speech: Group Discussion,COMM 1000,Communication Elective,,,,Cayuga Community College
Cazenovia,NY,Cazenovia College,CM 121,Effective Speaking,COMM 1000,Communication Elective,,,,Cazenovia College
Cazenovia,NY,Cazenovia College,EN 121,Effective Speaking,COMM 1000,Communication Elective,,,,Cazenovia College
Mcpherson,KS,Central Christian College Of Kansas,CO-CO 211,Principles Of Speech,COMM 1000,Communication Elective,,,,Central Christian College Of Kansas
Norwalk,CA,Cerritos College,SPCH 100,Fundamentals Of Oral Communication,COMM 1000,Communication Elective,,,,Cerritos College
Burlington,VT,Champlain College,COM 100,Foundations Of Human Communication,COMM 1000,Communication Elective,,,,Champlain College Undergraduate
Burlington,VT,Champlain College,COR 115,Rhetoric Of Self,COMM 1000,Communication Elective,,,,Champlain College Undergraduate
Burlington,VT,Champlain College,COR 120,Concepts Of Community,COMM 1000,Communication Elective,,,,Champlain College Undergraduate
Burlington,VT,Champlain College,COR 125,The Rhetoric Of Community,COMM 1000,Communication Elective,,,,Champlain College Undergraduate
Atlanta,GA,Clark Atlanta University,CSTA 101,Fundamentals Of Speech,COMM 1000,Communication Elective,,,,Clark Atlanta University Undergraduate
Vancouver,WA,Clark College,CMST& 210,Interpersonal Communication,COMM 1000,Communication Elective,,,,Clark College
Vancouver,WA,Clark College,CMST& 220,Public Speaking,COMM 1000,Communication Elective,,,,Clark College
Kentfield,CA,College Of Marin,SPCH 122,Public Speaking,COMM 1000,Communication Elective,,,,College Of Marin
San Mateo,CA,College Of San Mateo,SPCH 100,Public Speaking,COMM 1000,Communication Elective,,,,College Of San Mateo
San Mateo,CA,College Of San Mateo,SPCH 111,Oral Interpretation I,COMM 1000,Communication Elective,,,,College Of San Mateo
San Mateo,CA,College Of San Mateo,SPCH 120,Interpersonal Communication,COMM 1000,Communication Elective,,,,College Of San Mateo
La Plata,MD,College Of Southern Maryland,COM-1010,Basic Principles Of Speech Communication,COMM 1000,Communication Elective,,,,College Of Southern Maryland
La Plata,MD,College Of Southern Maryland,COM-1250,Introduction To Interpersonal Communication,COMM 1000,Communication Elective,,,,College Of Southern Maryland
Santa Clarita,CA,College Of The Canyons,COMS 105,Fundamentals Of Public Speaking,COMM 1000,Communication Elective,,,,College Of The Canyons
Santa Clarita,CA,College Of The Canyons,ENGL 103,"Critical Reading, Writing And Thinking",COMM 1000,Communication Elective,,,,College Of The Canyons
Santa Clarita,CA,College Of The Canyons,GMD 120,History Of Graphic Design,COMM 1000,Communication Elective,COMM 1000 (3cr),05/01/2023,05/01/2026,College Of The Canyons
Texas City,TX,College Of The Mainland,SPCH 1318,Interpersonal Communication,COMM 1000,Communication Elective,,,,College Of The Mainland
Grand Junction,CO,Colorado Mesa University,SPCH 101,Interpersonal Communications,COMM 1000,Communication Elective,,,,Colorado Mesa University
Hudson,NY,Columbia-Greene Community College,CO 104,Public Communication,COMM 1000,Communication Elective,,,,Columbia-Greene Community College
Baltimore,MD,Community College Of Baltimore County,SPCM 101,Fundamentals Of Communication,COMM 1000,Communication Elective,,,,Community College Of Baltimore County
Warwick,RI,Community College Of Rhode Island,SPCH 1100,Oral Communication 1,COMM 1000,Communication Elective,,,,Community College Of Rhode Island
Montpelier,VT,Community College Of Vermont,CIS 1151,Website Development,COMM 1000,Communication Elective,,,,Community College Of Vermont
Montpelier,VT,Community College Of Vermont,CIS 2410,Digital Image Manipulation,COMM 1000,Communication Elective,,,,Community College Of Vermont
Montpelier,VT,Community College Of Vermont,COM 1030,Intercultural Communication,COMM 1000,Communication Elective,COMM 1000 (3cr),05/01/2023,05/01/2026,Community College Of Vermont
Montpelier,VT,Community College Of Vermont,ENG 1070,Effective Speaking,COMM 1000,Communication Elective,,,,Community College Of Vermont
Bridgeport,CT,Connecticut State Community College Housatonic Campus,COM* E173,Public Speaking,COMM 1000,Communication Elective,,,,Housatonic Community College
Waterbury,CT,Connecticut State Community College Naugatuck Campus,COM* H100,Introduction To Communication,COMM 1000,Communication Elective,,,,Naugatuck Valley Community College
Waterbury,CT,Connecticut State Community College Naugatuck Campus,COM* H173,Public Speaking,COMM 1000,Communication Elective,,,,Naugatuck Valley Community College
Ithaca,NY,Cornell University-Endowed Colleges,ROMS 1102,Fws: The Craft Of Storytelling,COMM 1000,Communication Elective,,,,Cornell University
Corning,NY,Corning Community College,SPCH 1080,Public Speaking,COMM 1000,Communication Elective,,,,Corning Community College
Randolph,NJ,County College Of Morris,COM-109,Speech Fundamentals,COMM 1000,Communication Elective,,,,County College Of Morris
New Bern,NC,Craven Community College,COM 231,Public Speaking,COMM 1000,Communication Elective,,,,Craven Community College
San Luis Obispo,CA,Cuesta College,COMM 201A,Public Address,COMM 1000,Communication Elective,,,,Cuesta College
New York,NY,Cuny Bernard M Baruch College,COM 1010,Speech Communication,COMM 1000,Communication Elective,,,,CUNY Baruch College Undergraduate
New York,NY,Cuny Borough Of Manhattan Community College,ANT 115,Language And Culture,COMM 1000,Communication Elective,,,,CUNY Borough Of Manhattan Community College
New York,NY,Cuny Borough Of Manhattan Community College,LIN 110,The Structure Of English,COMM 1000,Communication Elective,,,,CUNY Borough Of Manhattan Community College
New York,NY,Cuny Borough Of Manhattan Community College,MMA 100,Foundations Of Digital Graphic Design,COMM 1000,Communication Elective,,,,CUNY Borough Of Manhattan Community College
New York,NY,Cuny Borough Of Manhattan Community College,SPE 100,Fundamentals Of Public Speaking,COMM 1000,Communication Elective,,,,CUNY Borough Of Manhattan Community College
Bronx,NY,Cuny Bronx Community College,CMS 11,Fundamentals Of Interpersonal Communication,COMM 1000,Communication Elective,,,,CUNY Bronx Community College
Bronx,NY,Cuny Bronx Community College,CMS 20,Public Speaking And Critical Listening,COMM 1000,Communication Elective,,,,CUNY Bronx Community College
Bronx,NY,Cuny Bronx Community College,COMM 11,Fundamentals Of Interpersonal Communication,COMM 1000,Communication Elective,,,,CUNY Bronx Community College
New York,NY,Cuny City College,SPCH 11100,Foundations Of Speech Communication,COMM 1000,Communication Elective,,,,CUNY City College
Brooklyn,NY,Cuny Kingsborough Community College,COM 01100,Mass Communications,COMM 1000,Communication Elective,,,,CUNY Kingsborough Community College
Long Island City,NY,Cuny Laguardia Community College,CSE110,Literacy And Propaganda,COMM 1000,Communication Elective,,,,CUNY LaGuardia Community College
Long Island City,NY,Cuny Laguardia Community College,HUC101,Fundamentals Of Communication,COMM 1000,Communication Elective,,,,CUNY LaGuardia Community College
Brooklyn,NY,Cuny New York City College Of Technology,SPE 1320,Voice And Diction,COMM 1000,Communication Elective,,,,CUNY New York City College Of Technology
Queens,NY,Cuny Queens College,ANTH 280,Language And Social Identity,COMM 1000,Communication Elective,COMM 1000 (3cr),05/01/2023,05/01/2026,CUNY Queens College Undergraduate
Queens,NY,Cuny Queens College,LCD 101,Introduction To Language,COMM 1000,Communication Elective,,,,CUNY Queens College Undergraduate
Milton,MA,Curry College,AC 1030,Communication Technology,COMM 1000,Communication Elective,,,,Curry College
Milton,MA,Curry College,AC 2768,Html And Design,COMM 1000,Communication Elective,,,,Curry College
Hanover,NH,Dartmouth College,FILM 46,Topics In Television,ARTS 2000 + COMM 1000,Arts Elective + Communication Elective,,,,"Dartmouth College Organization, Regulations And Courses"
Davidson,NC,Davidson College,COM 101,Principles Of Oral Communication,COMM 1000,Communication Elective,,,,Davidson College
Cupertino,CA,De Anza College,SPCH 10,Fundamentals Of Oral Communication,COMM 1000,Communication Elective,,,,De Anza College
Franklin,MA,Dean College,SPC 101,Communication Fundamentals,COMM 1000,Communication Elective,,,,Dean College
Franklin,MA,Dean College,SPC 111,Public Speaking,COMM 1000,Communication Elective,,,,Dean College
Granville,OH,Denison University,CINE 225,History Of Cinema,COMM 1000,Communication Elective,COMM 1000 (4 cr),01/01/2024,01/01/2027,Denison University
Pleasant Hill,CA,Diablo Valley College,COMM-120,Public Speaking,COMM 1000,Communication Elective,,,,Diablo Valley College
Pleasant Hill,CA,Diablo Valley College,SPCH-120,Public Speaking,COMM 1000,Communication Elective,,,,Diablo Valley College
Philadelphia,PA,Drexel University,COM 150,Mass Media And Society,COMM 1000,Communication Elective,,,,Drexel University Undergraduate
Philadelphia,PA,Drexel University,HUM 106,Humanities & Commun I,COMM 1000,Communication Elective,,,,Drexel University
Philadelphia,PA,Drexel University,HUM 107,Humanities And Communications II,COMM 1000,Communication Elective,,,,Drexel University Undergraduate
Poughkeepsie,NY,Dutchess Community College,COM101,Introduction To Media Communication,COMM 1000,Communication Elective,,,,Dutchess Community College
Poughkeepsie,NY,Dutchess Community College,SPE101,Public Speaking,COMM 1000,Communication Elective,,,,Dutchess Community College
Monterey Park,CA,East Los Angeles College,SPEECH 101,Oral Communication I,COMM 1000,Communication Elective,,,,East Los Angeles College
Beverly,MA,Endicott College,CMM 100,Media Aesthetics,COMM 1000,Communication Elective,COMM 1000 (3cr),09/01/2023,09/01/2026,Endicott College
Beverly,MA,Endicott College,CMM 106,Media And Culture I,COMM 1000,Communication Elective,COMM 1000 (3cr),09/01/2023,09/01/2026,Endicott College
Fairfield,CT,Fairfield University,CO 0101,Argument And Advocacy,COMM 1000,Communication Elective,,,,Fairfield University Course Descriptions
Canandaigua,NY,Finger Lakes Community College,COM 110,Public Speaking,COMM 1000,Communication Elective,,,,Finger Lakes Community College
Boca Raton,FL,Florida Atlantic University,SPC 2601,Public Speaking,COMM 1000,Communication Elective,,,,Florida Atlantic University
Los Altos Hills,CA,Foothill College,COMM 1A,Public Speaking,COMM 1000,Communication Elective,,,,Foothill College
Bronx,NY,Fordham University,COMM 1010,Introduction To Communication And Media Studies,COMM 1000,Communication Elective,,,,Fordham University
Bronx,NY,Fordham University,ENGL 2000,Texts And Contexts,COMM 1000,Communication Elective,COMM 1000 (3cr),09/01/2023,09/01/2026,Fordham University
Rindge,NH,Franklin Pierce University,MC100,"Communication, Media, And Society",COMM 1000,Communication Elective,,,,Franklin Pierce University
Fresno,CA,Fresno City College,COMM 1,Introduction To Public Speaking,COMM 1000,Communication Elective,,,,Fresno City College
Johnstown,NY,Fulton-Montgomery Community College,EN 132,Speech,COMM 1000,Communication Elective,,,,Fulton-Montgomery Community College
Johnstown,NY,Fulton-Montgomery Community College,ENG 132,Speech,COMM 1000,Communication Elective,,,,Fulton-Montgomery Community College
Greenville,SC,Furman University,COM-101,Public Speaking,COMM 1000,Communication Elective,,,,Furman University
Batavia,NY,Genesee Community College,SPE108,Public Speaking,COMM 1000,Communication Elective,,,,Genesee Community College
Atlanta,GA,Georgia State University-Perimeter College,COMM 1201,Public Speaking,COMM 1000,Communication Elective,,,,Georgia Perimeter College
Greenfield,MA,Greenfield Community College,PCS 101,Public Speaking,COMM 1000,Communication Elective,,,,Greenfield Community College
Greenfield,MA,Greenfield Community College,PCS 141,Interpersonal Communication,COMM 1000,Communication Elective,,,,Greenfield Community College
Greenfield,MA,Greenfield Community College,SPE 101,Oral Communication: Public Speaking,COMM 1000,Communication Elective,,,,Greenfield Community College
Greenville,SC,Greenville Technical College,SPC 205,Public Speaking,COMM 1000,Communication Elective,,,,Greenville Technical College
El Cajon,CA,Grossmont College,COMM 122,Public Speaking,COMM 1000,Communication Elective,,,,Grossmont College
Lawrenceville,GA,Gwinnett Technical College,SPC 191,Fundamentals Of Speech,COMM 1000,Communication Elective,,,,Gwinnett Technical College
Haverford,PA,Haverford College,LING 114,Introduction To Semantics,COMM 1000,Communication Elective,,,,Haverford College
Tampa,FL,Hillsborough Community College,SPC-1600H,Honors Public Speaking,COMM 1000,Communication Elective,,,,Hillsborough Community College
Raymond,MS,Hinds Community College-Raymond Campus,SPT 1113,Public Speaking I,COMM 1000,Communication Elective,,,,Hinds Community College
Hempstead,NY,Hofstra University,SPCM 001,Oral Communication,COMM 1000,Communication Elective,,,,Hofstra University Undergraduate
Holyoke,MA,Holyoke Community College,COM 121,Introduction To Communication,COMM 1000,Communication Elective,COMM 1000 (3cr),01/01/2024,01/01/2027,Holyoke Community College
Holyoke,MA,Holyoke Community College,COM 131,Mass Communication,COMM 1000,Communication Elective,COMM 1000 (3 cr),01/01/2024,01/01/2027,Holyoke Community College
Columbia,MD,Howard Community College,SPCH 101,Introduction To Human Communication,COMM 1000,Communication Elective,,,,Howard Community College
Jersey City,NJ,Hudson County Community College,ENG 112,Speech,COMM 1000,Communication Elective,,,,Hudson County Community College
Troy,NY,Hudson Valley Community College,BADM 200,Business Communications,COMM 1000,Communication Elective,,,,Hudson Valley Community College
Troy,NY,Hudson Valley Community College,DART 110,Introduction To Graphic Design,COMM 1000,Communication Elective,,,,Hudson Valley Community College
Troy,NY,Hudson Valley Community College,ENGL 120,Communication,COMM 1000,Communication Elective,COMM 1000 (3cr),09/01/2023,09/01/2026,Hudson Valley Community College
Bloomington,IN,Indiana University-Bloomington,MSCH-C 101,Media,COMM 1000,Communication Elective,,,,Indiana University College Of Arts And Sciences
Indianapolis,IN,Indiana University-Purdue University-Indianapolis,COMM-R 110,Fundamentals Of Speech Communication,COMM 1000,Communication Elective,,,,Indiana University Purdue University Indianapolis Bulletin
Ames,IA,Iowa State University,ENGL 150,Critical Thinking And Communication,COMM 1000,Communication Elective,,,,Iowa State University
Ames,IA,Iowa State University,JL MC 101,Mass Media And Society,COMM 1000,Communication Elective,,,,Iowa State University
Carterville,IL,John A Logan College,SPE 115,Speech,COMM 1000,Communication Elective,,,,John A. Logan College
Keuka Park,NY,Keuka College,ENG 112,Writing As Argument,COMM 1000,Communication Elective,,,,Keuka College Record
Devils Lake,ND,Lake Region State College,COMM 110,Fundamentals Of Public Speaking,COMM 1000,Communication Elective,,,,Lake Region State College
Putney,VT,Landmark College,COM1011,Introduction To Communication,COMM 1000,Communication Elective,,,,Landmark College
Albany,OR,Linn-Benton Community College,COMM 111,Public Speaking,COMM 1000,Communication Elective,,,,Linn-Benton Community College
The Woodlands,TX,Lone Star College System,SPCH1318,Interpersonal Communication,COMM 1000,Communication Elective,,,,Lone Star College
Nanticoke,PA,Luzerne County Community College,COM 104,Introduction To Multimedia Technology,COMM 1000,Communication Elective,,,,Luzerne County Community College
Nanticoke,PA,Luzerne County Community College,SPE 125,Fundamentals Of Speech,COMM 1000,Communication Elective,,,,Luzerne County Community College
Rancho Palos Verdes,CA,Marymount California University,SPE 105,Fundamentals Of Speech,COMM 1000,Communication Elective,,,,Marymount California University
Lucerne,CA,Marymount California University - Lakeside Campus,SPE 105,Fundamentals Of Speech,COMM 1000,Communication Elective,,,,Marymount California University
San Pedro,CA,Marymount California University - Waterfront Campus,SPE 105,Fundamentals Of Speech,COMM 1000,Communication Elective,,,,Marymount California University
New York,NY,Marymount Manhattan College,CAA 100,Effective Thinking,COMM 1000,Communication Elective,,,,Marymount Manhattan College
Wellesley Hills,MA,Massachusetts Bay Community College,HU 221,Introduction To Film,COMM 1000,Communication Elective,COMM 1000 (3cr),05/01/2023,05/01/2026,Massachusetts Bay Community College
Montreal,QC,Mcgill University,CCOM 206,Communication In Engineering,COMM 1000,Communication Elective,,,,Mcgill University Course Descriptions
Mechanicsburg,PA,Messiah University,COMM 104,Fundamentals Of Interpersonal Communication,COMM 1000,Communication Elective,,,,Messiah College
Fayetteville,NC,Methodist University,OCL 1510,Speech Communication,COMM 1000,Communication Elective,,,,Methodist University Undergraduate
Miami,FL,Miami Dade College,SPC1017,Introduction To Communication,COMM 1000,Communication Elective,,,,Miami Dade College
East Lansing,MI,Michigan State University,COM 100,Human Communication,COMM 1000,Communication Elective,,,,Michigan State University Course Descriptions
Edison,NJ,Middlesex College,COM-105,Introduction To Communication Study,COMM 1000,Communication Elective,,,,Middlesex College
Bedford,MA,Middlesex Community College,COM 101,Introduction To Communication And Media,COMM 1000,Communication Elective,COMM 1000 (3cr),05/01/2023,05/01/2026,Middlesex Community College
Bedford,MA,Middlesex Community College,COM 125,Social Media,COMM 1000,Communication Elective,,,,Middlesex Community College
Oceanside,CA,Miracosta College,COMM 101,Public Speaking,COMM 1000,Communication Elective,,,,MiraCosta College
Santa Clara,CA,Mission College,COMM 001,Public Speaking,COMM 1000,Communication Elective,,,,Mission College
Utica,NY,Mohawk Valley Community College-Utica Branch,EN101,English 1: Composition,COMM 1000,Communication Elective,,,,Mohawk Valley Community College
Utica,NY,Mohawk Valley Community College-Utica Branch,EN150,Effective Speech,COMM 1000,Communication Elective,,,,Mohawk Valley Community College
Rochester,NY,Monroe Community College,COM 109,An Introduction To Public Relations,COMM 1000,Communication Elective,,,,Monroe Community College
Rochester,NY,Monroe Community College,LDS 101,A Seminar In Leadership Development,COMM 1000,Communication Elective,,,,Monroe Community College
Montclair,NJ,Montclair State University,CMST 101,Fundamentals Of Speech: Communication Requirement,COMM 1000,Communication Elective,,,,Montclair State University
Rockville,MD,Montgomery College,CG 120,Computer Graphics: Art And Illustration I,COMM 1000,Communication Elective,,,,Montgomery College
Blue Bell,PA,Montgomery County Community College,SPC 120,Public Speaking,COMM 1000,Communication Elective,,,,Montgomery County Community College
Moorpark,CA,Moorpark College,COMM M01,Public Speaking,COMM 1000,Communication Elective,,,,Moorpark College Course Descriptions
Moorpark,CA,Moorpark College,COMM M25,Introduction To Rhetorical Criticism,COMM 1000,Communication Elective,,,,Moorpark College Course Descriptions
Gardner,MA,Mount Wachusett Community College,SPC 113,Speech,COMM 1000,Communication Elective,,,,Mount Wachusett Community College
Gresham,OR,Mt Hood Community College,SP111,Fundamentals Of Public Speaking,COMM 1000,Communication Elective,,,,Mount Hood Community College
Garden City,NY,Nassau Community College,COM 101,Interpersonal Communications,COMM 1000,Communication Elective,,,,Nassau Community College
Garden City,NY,Nassau Community College,COM 103,Public Speaking,COMM 1000,Communication Elective,,,,Nassau Community College
