City,State,Institution,Transfer Course ID,Transfer Course Name,RPI Course ID,RPI Course Name,Note,Begin,End,Transfer Catalog
Tucson,AZ,University Of Arizona,AFAS 160D1,Introduction To African American Literature,LITR 2000,Literature Elective,,,,University Of Arizona Fall Course Descriptions
Berkeley,CA,University Of California-Berkeley,ENGLISH 121,Romantic Period,LITR 2000,Literature Elective,,,,University Of California Berkeley
Irvine,CA,University Of California-Irvine,ENGLISH 7,Literature In English From The Eighteenth To The Twentieth Centuries,LITR 2000,Literature Elective,,,,University Of California Irvine
Irvine,CA,University Of California-Irvine,FLM&MDA 112,Genre Study,LITR 2000,Literature Elective,,,,University Of California Irvine
Los Angeles,CA,University Of California-Los Angeles,ENGL 85,American Novel,LITR 2000,Literature Elective,,,,University Of California Los Angeles
Chicago,IL,University Of Chicago,ENGL 20900,Fantasy And Science Fiction,LITR 2000,Literature Elective,,,,University Of Chicago College
Chicago,IL,University Of Chicago,ENGL 24304,India In English,LITR 2000,Literature Elective,,,,University Of Chicago College
Colorado Springs,CO,University Of Colorado At Colorado Springs,ENGL 3910,Topics In Literature,LITR 2000,Literature Elective,,,,University Of Colorado At Colorado Springs
Storrs,CT,University Of Connecticut,ENGL 250,Honors I: Approaches To Literature,LITR 2000,Literature Elective,,,,University Of Connecticut Undergraduate
Storrs,CT,University Of Connecticut,ENGL 1616W,Major Works Of English And American Literature,LITR 2000,Literature Elective,,,,University Of Connecticut Undergraduate
Groton,CT,University Of Connecticut-Avery Point,ENGL 250,Honors I: Approaches To Literature,LITR 2000,Literature Elective,,,,University Of Connecticut Undergraduate
Groton,CT,University Of Connecticut-Avery Point,ENGL 1616W,Major Works Of English And American Literature,LITR 2000,Literature Elective,,,,University Of Connecticut Undergraduate
Hartford,CT,University Of Connecticut-Hartford Campus,ENGL 250,Honors I: Approaches To Literature,LITR 2000,Literature Elective,,,,University Of Connecticut Undergraduate
Hartford,CT,University Of Connecticut-Hartford Campus,ENGL 1616W,Major Works Of English And American Literature,LITR 2000,Literature Elective,,,,University Of Connecticut Undergraduate
Stamford,CT,University Of Connecticut-Stamford,ENGL 250,Honors I: Approaches To Literature,LITR 2000,Literature Elective,,,,University Of Connecticut Undergraduate
Stamford,CT,University Of Connecticut-Stamford,ENGL 1616W,Major Works Of English And American Literature,LITR 2000,Literature Elective,,,,University Of Connecticut Undergraduate
Waterbury,CT,University Of Connecticut-Waterbury Campus,ENGL 250,Honors I: Approaches To Literature,LITR 2000,Literature Elective,,,,University Of Connecticut Undergraduate
Waterbury,CT,University Of Connecticut-Waterbury Campus,ENGL 1616W,Major Works Of English And American Literature,LITR 2000,Literature Elective,,,,University Of Connecticut Undergraduate
Gainesville,FL,University Of Florida,AML 2070,Survey Of American Literature,LITR 2000,Literature Elective,,,,University Of Florida Undergraduate
Gainesville,FL,University Of Florida-Online,AML 2070,Survey Of American Literature,LITR 2000,Literature Elective,,,,University Of Florida Undergraduate
Honolulu,HI,University Of Hawai'i At Manoa,ENG 272,Introduction To Literature: Culture And Literature,LITR 2000,Literature Elective,,,,University Of Hawaii Manoa
Honolulu,HI,University Of Hawai'i At Manoa,ENG 273,Introduction To Literature: Creative Writing And Literature,LITR 2000,Literature Elective,,,,University Of Hawaii Manoa
Houston,TX,University Of Houston,ENGL 2360,Western World Lit I–Honors,LITR 2000,Literature Elective,,,,University Of Houston Undergraduate
Champaign,IL,University Of Illinois At Urbana - Champaign,EALC 250,Intro To Japanese Culture,LITR 2000,Literature Elective,,,,University Of Illinois At Urbana-Champaign
Baltimore,MD,University Of Maryland-Baltimore County,RLST 210,Classical Mythology,LITR 2000,Literature Elective,,,,University Of Maryland Baltimore County Undergraduate
Amherst,MA,University Of Massachusetts-Amherst,COMLIT 233,International Fantasy,LITR 2000,Literature Elective,,,,University Of Massachusetts Amherst Guide To Undergraduate Programs
Amherst,MA,University Of Massachusetts-Amherst,COMP-LIT 233,International Fantasy,LITR 2000,Literature Elective,,,,University Of Massachusetts Amherst Course Descriptions
Dearborn,MI,University Of Michigan-Dearborn,HONS 301,Western Culture I: Classical And Religious Traditions,LITR 2000,Literature Elective,LITR 2000 (3 cr),05/01/2023,05/01/2026,University Of Michigan Dearborn
Dahlonega,GA,University Of North Georgia,ENGL 2131,American Literature I,LITR 2000,Literature Elective,,,,University Of North Georgia Undergraduate
Pittsburgh,PA,University Of Pittsburgh-Main Campus,FR 0080,Modern French Novel,LITR 2000,Literature Elective,,,,University Of Pittsburgh Undergraduate
San Juan,PR,University Of Puerto Rico-Rio Piedras,ESPA 3201,"GÉNeros Literarios, Narrativa Y Teatro",LITR 2000,Literature Elective,,,,University Of Puerto Rico Rio Piedras
Rochester,NY,University Of Rochester,ENG 211,Milton,LITR 2000,Literature Elective,,,,University Of Rochester Fall Course Descriptions
Rochester,NY,University Of Rochester,ENG 267,Environmental Apocalypse And Anthropocene,LITR 2000,Literature Elective,,,,University Of Rochester Fall Course Descriptions
Columbia,SC,University Of South Carolina Columbia,CLAS 220,Introduction To Classical Mythology,LITR 2000,Literature Elective,,,,University Of South Carolina At Columbia Undergraduate
Knoxville,TN,University Of Tennessee,ENGL 221,World Literature I: Ancient Through Early Modern,LITR 2000,Literature Elective,,,,University Of Tennessee Knoxville Undergraduate
Knoxville,TN,University Of Tennessee,ENGL 231,American Literature I: Colonial Era To The Civil War,LITR 2000,Literature Elective,,,,University Of Tennessee Knoxville Undergraduate
Sewanee,TN,University Of The South,ENGL 200,Representative Masterpieces,LITR 2000,Literature Elective,,,,University Of The South Sewanee College Arts And Sciences
Sewanee,TN,University Of The South,SPAN 300,Introduction To Hispanic Literature,LITR 2000,Literature Elective,,,,University Of The South Sewanee College Arts And Sciences
Burlington,VT,University Of Vermont And State Agricultural College,ENG 24,American Literature,LITR 2000,Literature Elective,,,,University Of Vermont Undergraduate
Seattle,WA,University Of Washington,SCAND 280,Ibsen And His Major Plays In English,LITR 2000,Literature Elective,,,,University Of Washington Course Descriptions
Carrollton,GA,University Of West Georgia,ENGL 2110,World Literature,LITR 2000,Literature Elective,,,,University Of West Georgia Undergraduate
Carrollton,GA,University Of West Georgia,ENGL 2130,American Literature,LITR 2000,Literature Elective,,,,University Of West Georgia Undergraduate
Madison,WI,University Of Wisconsin-Madison,ENGL 241,Literature And Culture I: To The 18Th Century,LITR 2000,Literature Elective,,,,University Of Wisconsin Madison Course Descriptions
Madison,WI,University Of Wisconsin-Madison,ENGL 242,Literature And Culture II: From The 18Th Century To The Present,LITR 2000,Literature Elective,,,,University Of Wisconsin Madison Course Descriptions
Madison,WI,University Of Wisconsin-Madison,ENGL 245,Seminar In The Major,LITR 2000,Literature Elective,,,,University Of Wisconsin Madison Course Descriptions
Orlando,FL,Valencia College,HUM 2310,Mythology,LITR 2000,Literature Elective,,,,Valencia College
Randolph Center,VT,Vermont State University,ENG 2260,Touchstones Of Western Literature,LITR 2000,Literature Elective,,,,Castleton University Undergraduate
Middletown,CT,Wesleyan University,ALIT 230,Japanese Detective Fiction And Narrative Theory,LITR 2000,Literature Elective,,,,Wesleyan University
Palatine,IL,William Rainey Harper College,LIT 224,Women In Literature,LITR 2000,Literature Elective,,,,Harper College
Williamstown,MA,Williams College,AFR 240,Introduction To The Music Of Duke Ellington,LITR 2000,Literature Elective,,,,Williams College
New Orleans,LA,Xavier University Of Louisiana,ENGL 2010,Introduction To World Literature I,LITR 2000,Literature Elective,,,,Xavier University Of Louisiana
New Orleans,LA,Xavier University Of Louisiana,THEO 2002,Prophets And Prophecy,LITR 2000,Literature Elective,,,,Xavier University Of Louisiana
