City,State,Institution,Transfer Course ID,Transfer Course Name,RPI Course ID,RPI Course Name,Note,Begin,End,Transfer Catalog
Sarasota,FL,Keiser University-Sarasota,AML1000,American Literature,LITR 2000,Literature Elective,,,,Keiser University Undergraduate
Tallahassee,FL,Keiser University-Tallahassee,AML1000,American Literature,LITR 2000,Literature Elective,,,,Keiser University Undergraduate
Tampa,FL,Keiser University-Tampa,AML1000,American Literature,LITR 2000,Literature Elective,,,,Keiser University Undergraduate
West Palm Beach,FL,Keiser University-West Palm Beach,AML1000,American Literature,LITR 2000,Literature Elective,,,,Keiser University Undergraduate
Kennesaw,GA,Kennesaw State University,ENGL 2110,World Literature,LITR 2000,Literature Elective,,,,Kennesaw State University Undergraduate
Gambier,OH,Kenyon College,ENGL 103,Introduction To Literature And Language,LITR 2000,Literature Elective,,,,Kenyon College
Parsons,KS,Labette Community College,ENGL 207,British Literature I,LITR 2000,Literature Elective,,,,Labette Community College
Parsons,KS,Labette Community College,ENGL 209,American Literature I,LITR 2000,Literature Elective,,,,Labette Community College
Beaumont,TX,Lamar University-Beaumont,ENGL 2310,British Lit Before 1800,LITR 2000,Literature Elective,,,,Lamar University
Syracuse,NY,Le Moyne College,ENG 200,Perspectives In Literature,LITR 2000,Literature Elective,,,,Le Moyne College
Brooklyn,NY,Liu Brooklyn,HEG 21,Honors Literature And Writing Seminar I,LITR 2000,Literature Elective,,,,LIU Brooklyn Undergraduate
Brooklyn,NY,Liu Brooklyn,HEG 22,Honors Literature And Writing Seminar II,LITR 2000,Literature Elective,,,,LIU Brooklyn Undergraduate
Brooklyn,NY,Liu Brooklyn,HHE 172,Honors Advanced Elective Seminar,LITR 2000,Literature Elective,,,,LIU Brooklyn Undergraduate
Brookville,NY,Liu Post,ENG 64,"Crime, Guilt, And Atonement",LITR 2000,Literature Elective,,,,LIU Post Undergraduate
The Woodlands,TX,Lone Star College System,ENGL2323,Survey Of British Literature: Romantic Through The Present,LITR 2000,Literature Elective,,,,Lone Star College
Riverdale,NY,Manhattan College,ENGL 276,Introduction To Drama,LITR 2000,Literature Elective,,,,Manhattan College Undergraduate
Riverdale,NY,Manhattan College,ENGL 287,Fantasy And Science Fiction,LITR 2000,Literature Elective,,,,Manhattan College Undergraduate
Tempe,AZ,Maricopa Community College District,ENH 251,Mythology,LITR 2000,Literature Elective,,,,Maricopa County Community College District Course Descriptions
Marlboro,VT,Marlboro College,ART2242,The Films Of Charlie Chaplin,LITR 2000,Literature Elective,,,,Marlboro College Spring Course Descriptions
Marlboro,VT,Marlboro College,HUM882,19Th Century American Poetry,LITR 2000,Literature Elective,,,,Marlboro College Fall Course Descriptions
Marlboro,VT,Marlboro College,HUM1237,England And The Wider World In Victorian Fiction - Introductory,LITR 2000,Literature Elective,,,,Marlboro College Fall Course Descriptions
Marlboro,VT,Marlboro College,HUM1262,What Will Suffice: American Literature In The 20Th Century,LITR 2000,Literature Elective,,,,Marlboro College Spring Course Descriptions
Waco,TX,Mclennan Community College,ENGL 2322,British Literature I,LITR 2000,Literature Elective,,,,McLennan Community College Course Descriptions
West Windsor,NJ,Mercer County Community College,ENG 220,Science Fiction Literature,LITR 2000,Literature Elective,,,,Mercer County Community College
Mesa,AZ,Mesa Community College,ENH 251,Mythology,LITR 2000,Literature Elective,,,,Maricopa County Community College District Course Descriptions
Mechanicsburg,PA,Messiah University,ENGL 242,Medieval-Renaissance English Literature,LITR 2000,Literature Elective,,,,Messiah College
Mechanicsburg,PA,Messiah University,ENGL 252,American Literature Before 1900,LITR 2000,Literature Elective,,,,Messiah College
Miami,FL,Miami Dade College,LIT2480,Issues In Literature & Culture,LITR 2000,Literature Elective,,,,Miami Dade College
Oceanside,CA,Miracosta College,FILM 101,Introduction To Film,LITR 2000,Literature Elective,,,,MiraCosta College
Rochester,NY,Monroe Community College,ENG 215,Children's Literature,LITR 2000,Literature Elective,,,,Monroe Community College
Rochester,NY,Monroe Community College,ENG 230,Mythology,LITR 2000,Literature Elective,,,,Monroe Community College
Montclair,NJ,Montclair State University,GNHU 285,Mythology,LITR 2000,Literature Elective,,,,Montclair State University
Rockville,MD,Montgomery College,EN 211,Survey Of American Literature I,LITR 2000,Literature Elective,,,,Montgomery College
Atlanta,GA,Morehouse College,HENG 250,World Literature,LITR 2000,Literature Elective,,,,Morehouse College Course Descriptions
Cresson,PA,Mount Aloysius College,EN 102,Introduction To Literature,LITR 2000,Literature Elective,,,,Mount Aloysius College
Gardner,MA,Mount Wachusett Community College,ENG 213,American Literature I,LITR 2000,Literature Elective,,,,Mount Wachusett Community College
Gardner,MA,Mount Wachusett Community College,ENG 224,Mystery Fiction,LITR 2000,Literature Elective,,,,Mount Wachusett Community College
Gardner,MA,Mount Wachusett Community College,ENG 235,Children's Literature,LITR 2000,Literature Elective,,,,Mount Wachusett Community College
New York,NY,New York University,FMTV-UT 1093,Film Marketing & Distribution,LITR 2000,Literature Elective,,,,New York University Leonard Stern School Of Business Undergraduate
Haverhill,MA,Northern Essex Community College,LIT201,American Literature I,LITR 2000,Literature Elective,,,,Northern Essex Community College
Haverhill,MA,Northern Essex Community College,LIT251,Mythology And Literature,LITR 2000,Literature Elective,,,,Northern Essex Community College
Haverhill,MA,Northern Essex Community College,LIT263,The Short Story,LITR 2000,Literature Elective,,,,Northern Essex Community College
Maryville,MO,Northwest Missouri State University,ENGL 10245,English Literature: Beowulf Through The 18Th Century,LITR 2000,Literature Elective,,,,Northwest Missouri State University Undergraduate
Evanston,IL,Northwestern University,COMP LIT 202-0,Interpreting Culture,LITR 2000,Literature Elective,,,,Northwestern University Undergraduate
Oberlin,OH,Oberlin College,CLAS 210,Greek And Roman Mythology,LITR 2000,Literature Elective,LITR 2000 (4cr),05/01/2023,05/01/2026,Oberlin College
Oberlin,OH,Oberlin College,ENGL 268,American Mythologies: Baseball In Literature And Film,LITR 2000,Literature Elective,,,,Oberlin College Course Descriptions
Columbus,OH,Ohio State University,CLASSICS 222,Classical Mythology,LITR 2000,Literature Elective,,,,Ohio State University Course Offerings
Wooster,OH,Ohio State University Agricultural Technical Inst,CLASSICS 222,Classical Mythology,LITR 2000,Literature Elective,,,,Ohio State University Course Offerings
Lima,OH,Ohio State University-Lima Campus,CLASSICS 222,Classical Mythology,LITR 2000,Literature Elective,,,,Ohio State University Course Offerings
Mansfield,OH,Ohio State University-Mansfield Campus,CLASSICS 222,Classical Mythology,LITR 2000,Literature Elective,,,,Ohio State University Course Offerings
Marion,OH,Ohio State University-Marion Campus,CLASSICS 222,Classical Mythology,LITR 2000,Literature Elective,,,,Ohio State University Course Offerings
Newark,OH,Ohio State University-Newark Campus,CLASSICS 222,Classical Mythology,LITR 2000,Literature Elective,,,,Ohio State University Course Offerings
Syracuse,NY,Onondaga Community College,ENG 222,English Literature II,LITR 2000,Literature Elective,,,,Onondaga Community College
Middletown,NY,Orange County Community College,ENG 120,Introduction To Mythology,LITR 2000,Literature Elective,,,,SUNY Orange County Community College
Middletown,NY,Orange County Community College,ENG 216,Children's Literature,LITR 2000,Literature Elective,,,,SUNY Orange County Community College
Middletown,NY,Orange County Community College,ENG 225,International Literature: Non-European,LITR 2000,Literature Elective,,,,SUNY Orange County Community College
Phoenix,AZ,Paradise Valley Community College,ENH 251,Mythology,LITR 2000,Literature Elective,,,,Maricopa County Community College District Course Descriptions
Phoenix,AZ,Phoenix College,ENH 251,Mythology,LITR 2000,Literature Elective,,,,Maricopa County Community College District Course Descriptions
Claremont,CA,Pitzer College,MLLC 122,Critical Analysis Through Literature,LITR 2000,Literature Elective,,,,Pitzer College
Portland,OR,Portland Community College,ENG 254,American Literature From 1865,LITR 2000,Literature Elective,,,,Portland Community College
Anderson,IN,Purdue University - Purdue Polytechnic Anderson,SCLA 10200,"Transformative Texts, Critical Thinking And Communication II: Modern World",LITR 2000,Literature Elective,,,,Purdue University
Columbus,IN,Purdue University - Purdue Polytechnic Columbus,SCLA 10200,"Transformative Texts, Critical Thinking And Communication II: Modern World",LITR 2000,Literature Elective,,,,Purdue University
Indianapolis,IN,Purdue University - Purdue Polytechnic Indianapolis,SCLA 10200,"Transformative Texts, Critical Thinking And Communication II: Modern World",LITR 2000,Literature Elective,,,,Purdue University
Kokomo,IN,Purdue University - Purdue Polytechnic Kokomo,SCLA 10200,"Transformative Texts, Critical Thinking And Communication II: Modern World",LITR 2000,Literature Elective,,,,Purdue University
Lafayette,IN,Purdue University - Purdue Polytechnic Lafayette,SCLA 10200,"Transformative Texts, Critical Thinking And Communication II: Modern World",LITR 2000,Literature Elective,,,,Purdue University
New Albany,IN,Purdue University - Purdue Polytechnic New Albany,SCLA 10200,"Transformative Texts, Critical Thinking And Communication II: Modern World",LITR 2000,Literature Elective,,,,Purdue University
Richmond,IN,Purdue University - Purdue Polytechnic Richmond,SCLA 10200,"Transformative Texts, Critical Thinking And Communication II: Modern World",LITR 2000,Literature Elective,,,,Purdue University
South Bend,IN,Purdue University - Purdue Polytechnic South Bend,SCLA 10200,"Transformative Texts, Critical Thinking And Communication II: Modern World",LITR 2000,Literature Elective,,,,Purdue University
Vincennes,IN,Purdue University - Purdue Polytechnic Vincennes,SCLA 10200,"Transformative Texts, Critical Thinking And Communication II: Modern World",LITR 2000,Literature Elective,,,,Purdue University
West Lafayette,IN,Purdue University-Main Campus,SCLA 10200,"Transformative Texts, Critical Thinking And Communication II: Modern World",LITR 2000,Literature Elective,,,,Purdue University
Whittier,CA,Rio Hondo College,LIT 102H,Approaches To Literature Honors,LITR 2000,Literature Elective,,,,Rio Hondo College
Whittier,CA,Rio Hondo College,LIT 112BH,American Literature After 1865 Honors,LITR 2000,Literature Elective,,,,Rio Hondo College
Tempe,AZ,Rio Salado College,ENH 251,Mythology,LITR 2000,Literature Elective,,,,Maricopa County Community College District Course Descriptions
Rochester,NY,Roberts Wesleyan College,LIT 101,Introduction To Literature,LITR 2000,Literature Elective,,,,Roberts Wesleyan College Undergraduate
Rochester,NY,Rochester Institute Of Technology,ENGL-315,Digital Literature,LITR 2000,Literature Elective,,,,Rochester Institute Of Technology Undergraduate
Troy,NY,Russell Sage College,HUM 200,Contemp World Lit And Cultures,LITR 2000,Literature Elective,,,,Russell Sage College
Troy,NY,Russell Sage College,MAT 248,Topics In Mathematics,LITR 2000,Literature Elective,,,,Sage College Of Albany
Staten Island,NY,Saint John's University - Staten Island Campus,ENG 2060,Introduction To American Literature,LITR 2000,Literature Elective,,,,St. Johns University
Colchester,VT,Saint Michaels College,EN 211,Genres: Poetry,LITR 2000,Literature Elective,,,,Saint Michael'S College Undergraduate
Colchester,VT,Saint Michaels College,FS 111,The Examined Life,LITR 2000,Literature Elective,,,,Saint Michael'S College Undergraduate
Northfield,MN,Saint Olaf College,CLASS 244,The Golden Age Of Rome,LITR 2000,Literature Elective,,,,Saint Olaf College
Jersey City,NJ,Saint Peter's University,EL-134,Fiction,LITR 2000,Literature Elective,,,,Saint Peter'S University Undergraduate
San Francisco,CA,San Francisco State University,WCL 230,Introduction To World Literature,LITR 2000,Literature Elective,,,,San Francisco State University
Pasadena,TX,San Jacinto College,ENGL 2322,British Literature I,LITR 2000,Literature Elective,,,,San Jacinto Community College District
Houston,TX,San Jacinto College-North Campus,ENGL 2322,British Literature I,LITR 2000,Literature Elective,,,,San Jacinto Community College District
Houston,TX,San Jacinto College-South Campus,ENGL 2322,British Literature I,LITR 2000,Literature Elective,,,,San Jacinto Community College District
Houston,TX,San Jacinto Community College District - Generation Park Campus,ENGL 2322,British Literature I,LITR 2000,Literature Elective,,,,San Jacinto Community College District
Santa Monica,CA,Santa Monica College,ENGL 15,Shakespeare,LITR 2000,Literature Elective,,,,Santa Monica College
Schenectady,NY,Schenectady County Community College,HON 244,Topics In Literary Classics,LITR 2000,Literature Elective,,,,Schenectady County Community College
Schenectady,NY,Schenectady County Community College,LIT 256,American Literature To 1865,LITR 2000,Literature Elective,,,,Schenectady County Community College
Schenectady,NY,Schenectady County Community College,LIT 258,American Literature Since 1850,LITR 2000,Literature Elective,,,,Schenectady County Community College
Scottsdale,AZ,Scottsdale Community College,ENH 251,Mythology,LITR 2000,Literature Elective,,,,Maricopa County Community College District Course Descriptions
Shoreline,WA,Shoreline Community College,CINEM 201,Introduction To Cinema History,LITR 2000,Literature Elective,,,,Shoreline Community College
Seattle,WA,"Shoreline Community College - Cnc Machinists Program , Georgetown Ssc",CINEM 201,Introduction To Cinema History,LITR 2000,Literature Elective,,,,Shoreline Community College
Seattle,WA,Shoreline Community College - Dental Hygiene,CINEM 201,Introduction To Cinema History,LITR 2000,Literature Elective,,,,Shoreline Community College
Loudonville,NY,Siena College,ENGL - 055,Latin Literature In Translation,LITR 2000,Literature Elective,,,,Siena College Undergraduate
Loudonville,NY,Siena College,ENGL - 210,Women In Literature,LITR 2000,Literature Elective,,,,Siena College Undergraduate
Loudonville,NY,Siena College,ENGL - 213,Survey Of American Literature,LITR 2000,Literature Elective,,,,Siena College Undergraduate
Loudonville,NY,Siena College,ENGL - 250,The Drama,LITR 2000,Literature Elective,,,,Siena College Undergraduate
Saratoga Springs,NY,Skidmore College,EN 201,Evolving Canon I,LITR 2000,Literature Elective,,,,Skidmore College
Saratoga Springs,NY,Skidmore College,EN 211,Fiction,LITR 2000,Literature Elective,,,,Skidmore College
Phoenix,AZ,South Mountain Community College,ENH 251,Mythology,LITR 2000,Literature Elective,,,,Maricopa County Community College District Course Descriptions
New Haven,CT,Southern Connecticut State University,HON 275,Science And Writing,LITR 2000,Literature Elective,,,,Southern Connecticut State University Undergraduate
Manchester,NH,Southern New Hampshire University,LIT200,Critical Approaches To Literature,LITR 2000,Literature Elective,,,,Southern New Hampshire University Spring
Springfield,MA,Springfield Technical Community College,ENGL-200,Composition 2: Intro To Literature,LITR 2000,Literature Elective,,,,Springfield Technical Community College
Springfield,MA,Springfield Technical Community College,ENGL-300,Literature Of The Western World: Bc To 17Th Century,LITR 2000,Literature Elective,,,,Springfield Technical Community College
Springfield,MA,Springfield Technical Community College,HONR-508,Humanities Colloquium: The Comic Spirit,LITR 2000,Literature Elective,,,,Springfield Technical Community College
Rochester,NY,St. John Fisher University,ENGL-247C,War In Literature,LITR 2000,Literature Elective,,,,Saint John Fisher College Undergraduate
Queens,NY,St. John's University,ENG 2060,Introduction To American Literature,LITR 2000,Literature Elective,,,,St. Johns University
Miami Gardens,FL,St. Thomas University,ENL 2012,Survey Of English Literature I,LITR 2000,Literature Elective,,,,St. Thomas University Undergraduate
Stony Brook,NY,Stony Brook University,EGL 192,Fiction: The Art Of The Story,LITR 2000,Literature Elective,,,,SUNY Stony Brook Undergraduate Bulletin And Course Descriptions Spring
Stony Brook,NY,Stony Brook University,EGL 218,American Literature II,LITR 2000,Literature Elective,,,,SUNY Stony Brook Undergraduate Bulletin And Course Descriptions Spring
Stony Brook,NY,Stony Brook University,HUI 234,Introduction To 20Th-Century Drama,LITR 2000,Literature Elective,,,,SUNY Stony Brook Undergraduate Bulletin And Course Descriptions Spring
Stony Brook,NY,Stony Brook University,HUM 121,Death And Afterlife In Literature,LITR 2000,Literature Elective,,,,SUNY Stony Brook Undergraduate Bulletin And Course Descriptions Spring
Stony Brook,NY,Stony Brook University,HUM 123,Sexuality In Literature,LITR 2000,Literature Elective,,,,SUNY Stony Brook Undergraduate Bulletin And Course Descriptions Spring
Vestal,NY,Suny At Binghamton,COLI 212,Literature And Society,LITR 2000,Literature Elective,,,,SUNY Binghamton University
Vestal,NY,Suny At Binghamton,ENG 227,British Literature I,LITR 2000,Literature Elective,,,,SUNY Binghamton University
Vestal,NY,Suny At Binghamton,ENG 228,British Literature II,LITR 2000,Literature Elective,,,,SUNY Binghamton University
Vestal,NY,Suny At Binghamton,ENG 245,Shakespeare,LITR 2000,Literature Elective,,,,SUNY Binghamton University
Canton,NY,Suny Canton College Of Technology,ENGL 209,Approaches To Literature,LITR 2000,Literature Elective,,,,SUNY Canton College Of Technology
Geneseo,NY,Suny College At Geneseo,ENGL 213,British Literature II,LITR 2000,Literature Elective,,,,SUNY Geneseo Undergraduate
Geneseo,NY,Suny College At Geneseo,ENGL 235,American Literature,LITR 2000,Literature Elective,,,,SUNY Geneseo Undergraduate
Geneseo,NY,Suny College At Geneseo,ENGL 237,Voices And Perspectives,LITR 2000,Literature Elective,,,,SUNY Geneseo Undergraduate
Oneonta,NY,Suny College At Oneonta,ALIT 200,American Literature To 1865,LITR 2000,Literature Elective,,,,SUNY Oneonta Undergraduate
Oneonta,NY,Suny College At Oneonta,ALIT 280,Jack London,LITR 2000,Literature Elective,,,,SUNY Oneonta Undergraduate
Oneonta,NY,Suny College At Oneonta,ALIT 369,Rachel Carson,LITR 2000,Literature Elective,,,,SUNY Oneonta Undergraduate
Oneonta,NY,Suny College At Oneonta,ELIT 201,English Literature – Renaissance To 18Th Century,LITR 2000,Literature Elective,,,,SUNY Oneonta Undergraduate
Oneonta,NY,Suny College At Oneonta,ELIT 240,Medieval English Literature,LITR 2000,Literature Elective,,,,SUNY Oneonta Undergraduate
Oneonta,NY,Suny College At Oneonta,ELIT 270,Shakespeare,LITR 2000,Literature Elective,,,,SUNY Oneonta Undergraduate
Oneonta,NY,Suny College At Oneonta,LITR 250,Critical Approaches To Literature,LITR 2000,Literature Elective,,,,SUNY Oneonta Undergraduate
Oneonta,NY,Suny College At Oneonta,LITR 285,Writing Lives: Gender And Memoir,LITR 2000,Literature Elective,,,,SUNY Oneonta Undergraduate
Oneonta,NY,Suny College At Oneonta,WLIT 212,Survey Of Greek Literature,LITR 2000,Literature Elective,,,,SUNY Oneonta Undergraduate
Oneonta,NY,Suny College At Oneonta,WLIT 231,Mythology,LITR 2000,Literature Elective,,,,SUNY Oneonta Undergraduate
Oneonta,NY,Suny College At Oneonta,WLIT 283,Homer,LITR 2000,Literature Elective,,,,SUNY Oneonta Undergraduate
Oneonta,NY,Suny College At Oneonta,WMST 214,"Witches, Harlots, Wild Women",LITR 2000,Literature Elective,,,,SUNY Oneonta Undergraduate
Oswego,NY,Suny College At Oswego,ENG 395,Specialized Studies,LITR 2000,Literature Elective,,,,SUNY Oswego Undergraduate
Plattsburgh,NY,Suny College At Plattsburgh,ENG 209,Introduction To Writing Fiction,LITR 2000,Literature Elective,,,,SUNY College At Plattsburgh Undergraduate And Graduate
Plattsburgh,NY,Suny College At Plattsburgh,ENG 255,Literature And Science,LITR 2000,Literature Elective,,,,SUNY College At Plattsburgh Undergraduate And Graduate
Purchase,NY,Suny College At Purchase,ALI 3400,Short Fiction,LITR 2000,Literature Elective,,,,SUNY Purchase College
Purchase,NY,Suny College At Purchase,FTF 3265,"Sports Films: Underdogs, Champions, And Gutter Balls",LITR 2000,Literature Elective,,,,SUNY Purchase College
Purchase,NY,Suny College At Purchase,LIT 1065,Only Connect: Difference And Otherness In Literature,LITR 2000,Literature Elective,,,,SUNY Purchase College
Purchase,NY,Suny College At Purchase,LIT 2825,Modernism And The Metropolis,LITR 2000,Literature Elective,,,,SUNY Purchase College
Cobleskill,NY,Suny College Of Agriculture And Technology At Cobleskill,ENGL 250,Fiction Writing,LITR 2000,Literature Elective,,,,SUNY College Of Agriculture And Technology At Cobleskill
Alfred,NY,Suny College Of Technology At Alfred,LITR - 2603,Introduction To Literature,LITR 2000,Literature Elective,,,,Alfred State College
Delhi,NY,Suny College Of Technology At Delhi,LITR 110,Introduction To Fiction,LITR 2000,Literature Elective,,,,SUNY Delhi College Of Technology
Cortland,NY,Suny Cortland,ENG 200,Introduction To Literature,LITR 2000,Literature Elective,,,,SUNY Cortland Undergraduate
Cortland,NY,Suny Cortland,HLH 201,Health Problems Of The Underserved,LITR 2000,Literature Elective,,,,SUNY Cortland Undergraduate
Suffern,NY,Suny Rockland Community College,ENG 220,Honors Literature Seminar I,LITR 2000,Literature Elective,,,,SUNY Rockland Community College
Suffern,NY,Suny Rockland Community College,ENG 221,Honors Literature Seminar II,LITR 2000,Literature Elective,,,,SUNY Rockland Community College
Stone Ridge,NY,Suny Ulster County Community College,ENG 206,Literature: Major Themes,LITR 2000,Literature Elective,,,,SUNY Ulster County Community College
Valhalla,NY,Suny Westchester Community College,ENG 202,Children’s Literature,LITR 2000,Literature Elective,,,,SUNY Westchester Community College
Valhalla,NY,Suny Westchester Community College,ENG 209,Studies In The Short Story,LITR 2000,Literature Elective,,,,SUNY Westchester Community College
Selinsgrove,PA,Susquehanna University,FILM-230,American Film And Culture,LITR 2000,Literature Elective,,,,Susquehanna University
Newton,NJ,Sussex County Community College,ENGL203,American Literature I,LITR 2000,Literature Elective,,,,Sussex County Community College
Syracuse,NY,Syracuse University,ETS 141,Reading And Interpretation I: From Language To Discourse,LITR 2000,Literature Elective,,,,Syracuse University Undergraduate
Syracuse,NY,Syracuse University,LIT 211,Ancient Greek Drama: The Birth Of Comedy And Tragedy,LITR 2000,Literature Elective,,,,Syracuse University Undergraduate
Ewing,NJ,The College Of New Jersey,LIT 227,Global Animated Film,LITR 2000,Literature Elective,,,,The College Of New Jersey Course Catalog
Albany,NY,The College Of Saint Rose,ENG 244,Early World Literature,LITR 2000,Literature Elective,,,,College Of Saint Rose Undergraduate Studies
Albany,NY,The Sage College-Albany Campus,MAT 248,Topics In Mathematics,LITR 2000,Literature Elective,,,,Sage College Of Albany
Dryden,NY,Tompkins-Cortland Community College,ENGL226,World Literature II,LITR 2000,Literature Elective,,,,Tompkins Cortland Community College (TC3)
Troy,AL,Troy University,ENG 2205,World Literature Before 1660,LITR 2000,Literature Elective,,,,Troy University Undergraduate
Dothan,AL,Troy University - Dothan Campus,ENG 2205,World Literature Before 1660,LITR 2000,Literature Elective,,,,Troy University Undergraduate
Montgomery,AL,Troy University - Montgomery Campus,ENG 2205,World Literature Before 1660,LITR 2000,Literature Elective,,,,Troy University Undergraduate
Phenix City,AL,Troy University - Phenix City Campus,ENG 2205,World Literature Before 1660,LITR 2000,Literature Elective,,,,Troy University Undergraduate
Troy,AL,Troy University-Online,ENG 2205,World Literature Before 1660,LITR 2000,Literature Elective,,,,Troy University Undergraduate
Medford,MA,Tufts University,CLS 0032,Classics Of Rome,LITR 2000,Literature Elective,,,,Tufts University Course Descriptions
New Orleans,LA,Tulane University,CLAS 304,Mythology,LITR 2000,Literature Elective,,,,Tulane University Undergraduate Catalog
New Orleans,LA,Tulane University,ENLS 201,Introduction To British Literature I,LITR 2000,Literature Elective,,,,Tulane University
Schenectady,NY,Union College,EGL 101,The Study Of Literature: Fiction,LITR 2000,Literature Elective,,,,Union College
Schenectady,NY,Union College,EGL 276,Literature Of The Manor House,LITR 2000,Literature Elective,,,,Union College
Albany,NY,"University At Albany, State University Of New York",A ENG 243,Literature And Film,LITR 2000,Literature Elective,LITR 2000 (3 credits),05/01/2023,05/01/2026,SUNY University At Albany Undergraduate Bulletin
Buffalo,NY,"University At Buffalo, State University Of New York",DMS 107,Film & Media History 1,LITR 2000,Literature Elective,,,,SUNY University At Buffalo Undergraduate
Buffalo,NY,"University At Buffalo, State University Of New York",DMS 108,Film History II,LITR 2000,Literature Elective,,,,SUNY University At Buffalo Undergraduate
Buffalo,NY,"University At Buffalo, State University Of New York",DMS 213,Immigration And Film,LITR 2000,Literature Elective,,,,SUNY University At Buffalo Undergraduate
London, ,University College London,CLAS1201,Greek Myth: Its Use And Meaning,LITR 2000,Literature Elective,,,,University College London Study Abroad Guide
London, ,University College London,CLAS1202,Roman Life And Thought,LITR 2000,Literature Elective,,,,University College London Study Abroad Guide
Huntsville,AL,University Of Alabama In Huntsville,EH 206,British Literature II,LITR 2000,Literature Elective,,,,University Of Alabama Huntsville Undergraduate
