City,State,Institution,Transfer Course ID,Transfer Course Name,RPI Course ID,RPI Course Name,Note,Begin,End,Transfer Catalog
Bradenton,FL,State College Of Florida Manatee-Sarasota,MAC 2311,Calculus With Analytic Geometry I,MATH 1010,Calculus I,,,,State College Of Florida Manatee - Sarasota
Hoboken,NJ,Stevens Institute Of Technology,MA 115,Calculus I,MATH 1010,Calculus I,,,,Stevens Institute Of Technology
Galloway,NJ,Stockton University,MATH 2215,Calculus I,MATH 1010,Calculus I,MATH 1010 (4cr),05/01/2023,05/01/2026,Stockton University Course Descriptions Spring
Easton,MA,Stonehill College,MA 126,Calculus II,MATH 1010,Calculus I,,,,Stonehill College Hillbook
Easton,MA,Stonehill College,MTH 125,Calculus I,MATH 1010,Calculus I,,,,Stonehill College Hillbook
Stony Brook,NY,Stony Brook University,MAT 125,Calculus A,MATH 1010,Calculus I,,,,SUNY Stony Brook Undergraduate Bulletin And Course Descriptions Spring
Stony Brook,NY,Stony Brook University,MAT 131,Calculus I,MATH 1010,Calculus I,,,,SUNY Stony Brook Undergraduate Bulletin And Course Descriptions Spring
Selden,NY,Suffolk County Community College-Ammerman Campus,MAT141,Calculus With Analytic Geometry I,MATH 1010,Calculus I,,,,Suffolk County Community College
Selden,NY,Suffolk County Community College-Central Report,MAT141,Calculus With Analytic Geometry I,MATH 1010,Calculus I,,,,Suffolk County Community College
Riverhead,NY,Suffolk County Community College-Eastern Campus,MAT141,Calculus With Analytic Geometry I,MATH 1010,Calculus I,,,,Suffolk County Community College
Brentwood,NY,Suffolk County Community College-Western Campus,MAT141,Calculus With Analytic Geometry I,MATH 1010,Calculus I,,,,Suffolk County Community College
Loch Sheldrake,NY,Sullivan County Community College,MAT 1301 + MAT 2203 + MAT 2301 + MAT 2302,Analytical Geometry & Calculus I + Linear Algebra + Analytical Geometry & Calculus II + Analytical Geometry & Calculus III,MATH 1010 + MATH 1020 + MATH 2010,Calculus I + Calculus II + Multivariable Calculus And Matrix Algebra,,,,SUNY Sullivan County Community College
Vestal,NY,Suny At Binghamton,MATH 221,Calculus I,MATH 1010,Calculus I,,,,SUNY Binghamton University
Fredonia,NY,Suny At Fredonia,MATH 122,University Calculus I,MATH 1010,Calculus I,,,,SUNY Fredonia General
Canton,NY,Suny Canton College Of Technology,MATH 161 + MATH 162 + MATH 263,Calculus I + Calculus II + Calculus III,MATH 1010 + MATH 1020 + MATH 2011,Calculus I + Calculus II + Multivariable Calculus,,,,SUNY Canton College Of Technology
Brockport,NY,Suny College At Brockport,MTH 201,Calculus I,MATH 1010,Calculus I,,,,SUNY College At Brockport
Geneseo,NY,Suny College At Geneseo,MATH 221,R/Calculus I,MATH 1010,Calculus I,,,,SUNY Geneseo Undergraduate
Oneonta,NY,Suny College At Oneonta,MATH 173,Calculus I,MATH 1010,Calculus I,,,,SUNY Oneonta Undergraduate
Oneonta,NY,Suny College At Oneonta,MATH 223,Calculus I,MATH 1010,Calculus I,,,,SUNY Oneonta Undergraduate
Oswego,NY,Suny College At Oswego,MAT 210,Calculus I,MATH 1010,Calculus I,,,,SUNY Oswego Undergraduate
Plattsburgh,NY,Suny College At Plattsburgh,MAT 224,Calculus I,MATH 1010,Calculus I,,,,SUNY College At Plattsburgh Undergraduate And Graduate
Potsdam,NY,Suny College At Potsdam,MATH 151,Calculus I,MATH 1010,Calculus I,,,,SUNY Potsdam
Purchase,NY,Suny College At Purchase,MAT 1500,Calculus I,MATH 1010,Calculus I,,,,SUNY Purchase College
Purchase,NY,Suny College At Purchase,BMA 1500 + MAT 1500,Calculus I + Calculus I,MATH 1010,Calculus I,,,,SUNY Purchase College
Cobleskill,NY,Suny College Of Agriculture And Technology At Cobleskill,MATH 231,Calculus I,MATH 1010,Calculus I,,,,SUNY College Of Agriculture And Technology At Cobleskill
Syracuse,NY,Suny College Of Environmental Science And Forestry,APM 205,Calculus I For Science And Engineering,MATH 1010,Calculus I,,,,SUNY College Of Environmental Science And Forestry
Alfred,NY,Suny College Of Technology At Alfred,MATH - 1084 + MATH - 2094,Calculus I + Calculus II,MATH 1010,Calculus I,,,,Alfred State College
Delhi,NY,Suny College Of Technology At Delhi,MATH 210,Calculus I,MATH 1010,Calculus I,,,,SUNY Delhi College Of Technology
Cortland,NY,Suny Cortland,MAT 135,Calculus I,MATH 1010,Calculus I,,,,SUNY Cortland Undergraduate
Saratoga Springs,NY,Suny Empire State University,SMT-272104,Calculus 1,MATH 1010,Calculus I,,,,SUNY Empire State College Undergraduate
Throggs Neck,NY,Suny Maritime College,MATH 101,Calculus I,MATH 1010,Calculus I,,,,SUNY Maritime College
New Paltz,NY,Suny New Paltz,MAT251,Calculus I,MATH 1010,Calculus I,,,,SUNY New Paltz Undergraduate
Utica,NY,Suny Polytechnic Institute,MAT 151,Calculus I,MATH 1010,Calculus I,,,,SUNY Polytechnic Institute Undergraduate
Suffern,NY,Suny Rockland Community College,MAT 201,Honors Calculus I,MATH 1010,Calculus I,,,,SUNY Rockland Community College
Suffern,NY,Suny Rockland Community College,MAT 203 + MAT 207,Calculus I + Linear Algebra,MATH 1010 + MATH 1020 + MATH 2010,Calculus I + Calculus II + Multivariable Calculus And Matrix Algebra,,,,SUNY Rockland Community College
Stone Ridge,NY,Suny Ulster County Community College,MAT 170,Calculus I,MATH 1010,Calculus I,,,,SUNY Ulster County Community College
Valhalla,NY,Suny Westchester Community College,MATH 181,Calculus 1,MATH 1010,Calculus I,MATH 1010 (4 cr),05/01/2023,05/01/2026,SUNY Westchester Community College
Selinsgrove,PA,Susquehanna University,MATH-111,Calculus I,MATH 1010,Calculus I,,,,Susquehanna University
Syracuse,NY,Syracuse University,MAT 295,Calculus I,MATH 1010,Calculus I,MATH 1010 (4 cr),05/01/2023,05/01/2026,Syracuse University Undergraduate
Philadelphia,PA,Temple University,MATH 1041,Calculus I,MATH 1010,Calculus I,,,,Temple University Undergraduate
New York,NY,The College Board Ap/Clep,AP,Calculus Ab Ap Calculus Ab,MATH 1010,Calculus I,Effective for admits Fall 2020: Accepted scores of 5.,09/01/2023,05/01/2024,The College Board AP/CLEP
New York,NY,The College Board Ap/Clep,AP,Calculus Bc Ap Calculus Bc,MATH 1010 + MATH 1020,Calculus I + Calculus II,Effective for admits Fall 2020: Accepted scores of 5.,09/01/2023,05/01/2024,The College Board AP/CLEP
Ewing,NJ,The College Of New Jersey,MAT 127,Calculus A,MATH 1010,Calculus I,,,,The College Of New Jersey Course Catalog
Albany,NY,The College Of Saint Rose,MAT 190,Calculus 1,MATH 1010,Calculus I,MATH 1010 (4cr),09/01/2023,09/01/2026,College Of Saint Rose Undergraduate Studies
New York,NY,The New School,LMTH 2040,Calculus: A Multidisciplinary Approach,MATH 1010,Calculus I,,,,The New School Course Descriptions Spring
University Park,PA,The Pennsylvania State University,MATH 140,Calculus With Analytic Geometry I,MATH 1010,Calculus I,MATH 1010 (4cr),05/01/2023,05/01/2026,Pennsylvania State University Undergraduate
Tuscaloosa,AL,The University Of Alabama,MATH125,Calculus I,MATH 1010,Calculus I,,,,University Of Alabama Undergraduate
Austin,TX,The University Of Texas At Austin,M 408C,Differential And Integral Calculus,MATH 1010,Calculus I,,,,University Of Texas At Austin General Information
Trenton,NJ,Thomas Edison State University,MAT-232,Calculus II,MATH 1010 + MATH 1010,Calculus I + Calculus I,,,,Thomas Edison State University Undergraduate
Trenton,NJ,Thomas Edison State University,MAT-232,Calculus II,MATH 1010 + MATH 1010,Calculus I + Calculus I,,,,Thomas Edison State University Undergraduate
Philadelphia,PA,Thomas Jefferson University,MATH 111,Calculus I,MATH 1010,Calculus I,,,,Thomas Jefferson University
Norfolk,VA,Tidewater Community College,MTH 173,Calculus With Analytic Geometry I,MATH 1010,Calculus I,,,,Tidewater Community College
Dryden,NY,Tompkins-Cortland Community College,MATH201,Calculus I,MATH 1010,Calculus I,,,,Tompkins Cortland Community College (TC3)
River Grove,IL,Triton College,MAT 131,Calculus & Analytic Geometry I,MATH 1010,Calculus I,,,,Triton College
Chicago,IL,Triton College - Intl Union Of Operating Engr Local 399 Trning Fac.,MAT 131,Calculus & Analytic Geometry I,MATH 1010,Calculus I,,,,Triton College
Medford,MA,Tufts University,MATH 0017,Honors Calculus I-II,MATH 1010,Calculus I,,,,Tufts University Course Descriptions
Medford,MA,Tufts University,MATH 0032,Calculus I,MATH 1010,Calculus I,,,,Tufts University Course Descriptions
New Orleans,LA,Tulane University,MATH 122,Calculus II,MATH 1010,Calculus I,,,,Tulane University
Schenectady,NY,Union College,MTH 110,Calculus 1: Differential Calculus,MATH 1010,Calculus I,,,,Union College
Schenectady,NY,Union College,MTH 113,Accelerated Single-Variable Calculus,MATH 1010,Calculus I,,,,Union College
Cranford,NJ,Union County College,MAT 171,Unified Calculus I,MATH 1010,Calculus I,,,,Union County College
Kings Point,NY,United States Merchant Marine Academy,MM101,Calculus I,MATH 1010,Calculus I,,,,United States Merchant Marine Academy
West Point,NY,United States Military Academy,MA104,Calculus I,MATH 1010,Calculus I,,,,United State Military Academy Course Descriptions
Annapolis,MD,United States Naval Academy,SM121,Calculus I,MATH 1010,Calculus I,,,,United States Naval Academy Course Descriptions
Annapolis,MD,United States Naval Academy,SM131,Calculus I,MATH 1010,Calculus I,,,,United States Naval Academy Course Descriptions
Annapolis,MD,United States Naval Academy,SM161,Calculus With Computers I,MATH 1010,Calculus I,,,,United States Naval Academy Course Descriptions
Santurce,PR,Universidad Del Sagrado CorazN,MAT 201,CLculo I,MATH 1010,Calculus I,,,,Universidad Del Sagrado Corazon
Albany,NY,"University At Albany, State University Of New York",A MAT 112,Calculus I,MATH 1010,Calculus I,MATH 1010 (4cr),05/01/2023,05/01/2026,SUNY University At Albany Undergraduate Bulletin
Buffalo,NY,"University At Buffalo, State University Of New York",MTH 141,College Calculus I,MATH 1010,Calculus I,,,,SUNY University At Buffalo Undergraduate
Akron,OH,University Of Akron Main Campus,3450:221 + 3450:222,Analytic Geometry-Calculus I + Analytic Geometry-Calculus II,MATH 1010,Calculus I,,,,University Of Akron Undergraduate
Anchorage,AK,University Of Alaska Anchorage,MATH A251 + MATH A252 + MATH A253,Calculus I + Calculus II + Calculus III,MATH 1010 + MATH 1020 + MATH 2011,Calculus I + Calculus II + Multivariable Calculus,,,,University Of Alaska Anchorage
Fairbanks,AK,University Of Alaska Fairbanks,MATH F200X,Calculus I,MATH 1010,Calculus I,,,,University Of Alaska Fairbanks
Tucson,AZ,University Of Arizona,MATH 122B,First-Semester Calculus,MATH 1010,Calculus I,,,,University Of Arizona Fall Course Descriptions
Tucson,AZ,University Of Arizona,MATH 125,Calculus I,MATH 1010,Calculus I,,,,University Of Arizona Fall Course Descriptions
Berkeley,CA,University Of California-Berkeley,MATH 1A,Calculus,MATH 1010,Calculus I,,,,University Of California Berkeley
Irvine,CA,University Of California-Irvine,MATH 2A,Single-Variable Calculus I,MATH 1010,Calculus I,MATH 1010 (4cr),05/01/2023,05/01/2026,University Of California Irvine
Riverside,CA,University Of California-Riverside,MATH 009B,First-Year Calculus,MATH 1010,Calculus I,MATH 1010 (4 cr),05/01/2023,05/01/2026,University Of California Riverside
Santa Barbara,CA,University Of California-Santa Barbara,MATH 3A + MATH 3B + MATH 4A + MATH 4B + MATH 6A + MATH 6B,"Calculus With Applications, First Course + Calculus With Applications, Second Course + Linear Algebra With Applications + Differential Equations + Vector Calculus With Applications, First Course + Vector Calculus With Applications, Second Course",MATH 1010 + MATH 1020 + MATH 2010 + MATH 2400,Calculus I + Calculus II + Multivariable Calculus And Matrix Algebra + Introduction To Differential Equations,,,,University Of California Santa Barbara
Boulder,CO,University Of Colorado At Boulder,APPM 1350,Calculus 1 For Engineers,MATH 1010,Calculus I,,,,University Of Colorado At Boulder
Storrs,CT,University Of Connecticut,MATH 135Q,Honors Calculus I,MATH 1010,Calculus I,,,,University Of Connecticut Undergraduate
Storrs,CT,University Of Connecticut,MATH 1131Q,Calculus I,MATH 1010,Calculus I,MATH 1010 (4cr),05/01/2023,05/01/2026,University Of Connecticut Undergraduate
Groton,CT,University Of Connecticut-Avery Point,MATH 135Q,Honors Calculus I,MATH 1010,Calculus I,,,,University Of Connecticut Undergraduate
Groton,CT,University Of Connecticut-Avery Point,MATH 1131Q,Calculus I,MATH 1010,Calculus I,MATH 1010 (4cr),05/01/2023,05/01/2026,University Of Connecticut Undergraduate
Hartford,CT,University Of Connecticut-Hartford Campus,MATH 135Q,Honors Calculus I,MATH 1010,Calculus I,,,,University Of Connecticut Undergraduate
Hartford,CT,University Of Connecticut-Hartford Campus,MATH 1131Q,Calculus I,MATH 1010,Calculus I,MATH 1010 (4cr),05/01/2023,05/01/2026,University Of Connecticut Undergraduate
Stamford,CT,University Of Connecticut-Stamford,MATH 135Q,Honors Calculus I,MATH 1010,Calculus I,,,,University Of Connecticut Undergraduate
Stamford,CT,University Of Connecticut-Stamford,MATH 1131Q,Calculus I,MATH 1010,Calculus I,MATH 1010 (4cr),05/01/2023,05/01/2026,University Of Connecticut Undergraduate
Waterbury,CT,University Of Connecticut-Waterbury Campus,MATH 135Q,Honors Calculus I,MATH 1010,Calculus I,,,,University Of Connecticut Undergraduate
Waterbury,CT,University Of Connecticut-Waterbury Campus,MATH 1131Q,Calculus I,MATH 1010,Calculus I,MATH 1010 (4cr),05/01/2023,05/01/2026,University Of Connecticut Undergraduate
Newark,DE,University Of Delaware,MATH 241,Analytic Geometry And Calculus A,MATH 1010,Calculus I,,,,University Of Delaware Undergraduate
Denver,CO,University Of Denver,MATH 1952,Calculus II,MATH 1010,Calculus I,,,,University Of Denver Undergraduate
Detroit,MI,University Of Detroit Mercy,MTH 1410,Analytic Geometry And Calculus I,MATH 1010,Calculus I,,,,University Of Detroit Mercy Undergraduate
Gainesville,FL,University Of Florida,MAC 2311,Analytic Geometry And Calculus 1,MATH 1010,Calculus I,,,,University Of Florida Undergraduate
Gainesville,FL,University Of Florida-Online,MAC 2311,Analytic Geometry And Calculus 1,MATH 1010,Calculus I,,,,University Of Florida Undergraduate
Athens,GA,University Of Georgia,MATH 2250,Calculus I For Science And Engineering,MATH 1010,Calculus I,,,,University Of Georgia Course Descriptions
West Hartford,CT,University Of Hartford,M 144,Calculus I,MATH 1010,Calculus I,MATH 1010 (4cr),05/01/2023,05/01/2026,University Of Hartford Undergraduate
Houston,TX,University Of Houston,MATH 1431,Calculus I,MATH 1010,Calculus I,,,,University Of Houston Undergraduate
Champaign,IL,University Of Illinois At Urbana - Champaign,MATH 220,Calculus,MATH 1010,Calculus I,,,,University Of Illinois At Urbana-Champaign
Champaign,IL,University Of Illinois At Urbana - Champaign,MATH 221,Calculus I,MATH 1010,Calculus I,,,,University Of Illinois At Urbana-Champaign
Iowa City,IA,University Of Iowa,MATH: 1850,Calculus I,MATH 1010,Calculus I,,,,University Of Iowa
Orono,ME,University Of Maine,MAT 126,Calculus I,MATH 1010,Calculus I,,,,University Of Maine Undergraduate
Baltimore,MD,University Of Maryland-Baltimore County,MATH 151,Calculus And Analytic Geometry I,MATH 1010,Calculus I,,,,University Of Maryland Baltimore County Undergraduate
College Park,MD,University Of Maryland-College Park,MATH140,Calculus I,MATH 1010,Calculus I,,,,University Of Maryland College Park Undergraduate
Amherst,MA,University Of Massachusetts-Amherst,MATH 131,Calculus I,MATH 1010,Calculus I,MATH 1010 (4cr),05/01/2023,05/01/2026,University Of Massachusetts Amherst Course Descriptions
Amherst,MA,University Of Massachusetts-Amherst,MATH 131H,Calculus I Honors,MATH 1010,Calculus I,,,,University Of Massachusetts Amherst Course Descriptions
Boston,MA,University Of Massachusetts-Boston,MATH 140,Calculus I,MATH 1010,Calculus I,,,,University Of Massachusetts Boston Undergraduate
North Dartmouth,MA,University Of Massachusetts-Dartmouth,MTH 113,Calculus For Applied Science And Engineering I,MATH 1010,Calculus I,,,,University Of Massachusetts Dartmouth
Lowell,MA,University Of Massachusetts-Lowell,MATH.1310,Calculus I,MATH 1010 + MATH 1010,Calculus I + Calculus I,,,,University Of Massachusetts Lowell Undergraduate
Lowell,MA,University Of Massachusetts-Lowell,MATH.1310,Calculus I,MATH 1010 + MATH 1010,Calculus I + Calculus I,,,,University Of Massachusetts Lowell Undergraduate
Ann Arbor,MI,University Of Michigan-Ann Arbor,MATH 115,Calculus I,MATH 1010,Calculus I,,,,"University Of Michigan College Of Literature, Science, And The Arts Fall Courses"
Dearborn,MI,University Of Michigan-Dearborn,MATH 115,Calculus I,MATH 1010,Calculus I,MATH 1010 (4 cr),05/01/2023,05/01/2026,University Of Michigan Dearborn
Minneapolis,MN,University Of Minnesota Twin Cities,MATH 1271,Calculus I,MATH 1010,Calculus I,,,,University Of Minnesota Twin Cities Undergraduate
Minneapolis,MN,University Of Minnesota Twin Cities,MATH 1371,Cse Calculus I,MATH 1010,Calculus I,,,,University Of Minnesota Twin Cities Undergraduate
Columbia,MO,University Of Missouri,MATH 1500,Analytic Geometry And Calculus I,MATH 1010,Calculus I,,,,University Of Missouri Columbia University
Saint Louis,MO,University Of Missouri-St Louis,MATH 1800,Analytic Geometry And Calculus I,MATH 1010,Calculus I,,,,University Of Missouri St Louis
Montevallo,AL,University Of Montevallo,MATH 170,Calculus I,MATH 1010,Calculus I,,,,University Of Montevallo Undergraduate
Las Vegas,NV,University Of Nevada-Las Vegas,MATH 181,Calculus I,MATH 1010,Calculus I,,,,University Of Nevada Las Vegas Undergraduate
Durham,NH,University Of New Hampshire-Main Campus,MATH 425,Calculus I,MATH 1010,Calculus I,,,,University Of New Hampshire Manchester
Manchester,NH,University Of New Hampshire-Manchester,MATH 425,Calculus I,MATH 1010,Calculus I,,,,University Of New Hampshire Manchester
West Haven,CT,University Of New Haven,M 117,Calculus I,MATH 1010,Calculus I,,,,University Of New Haven Undergraduate
West Haven,CT,University Of New Haven,MATH 1117,Calculus I,MATH 1010,Calculus I,,,,University Of New Haven Undergraduate
Albuquerque,NM,University Of New Mexico-Main Campus,MATH 162,Calculus I,MATH 1010,Calculus I,,,,University Of New Mexico Albuquerque
Albuquerque,NM,University Of New Mexico-Main Campus,MATH 180,Elements Of Calculus I,MATH 1010,Calculus I,,,,University Of New Mexico Albuquerque
Jacksonville,FL,University Of North Florida,MAC2311 + MAC2312,(Gm) Calculus I + (Gm) Calculus II,MATH 1010,Calculus I,,,,University Of North Florida
Dahlonega,GA,University Of North Georgia,MATH 1501,Calculus I,MATH 1010,Calculus I,,,,University Of North Georgia Undergraduate
Greeley,CO,University Of Northern Colorado,MATH 131,Calculus I,MATH 1010,Calculus I,,,,University Of Northern Colorado Undergraduate
Saint Paul,MN,University Of Northwestern St. Paul,MAT2121,Calculus And Analytic Geometry I,MATH 1010,Calculus I,,,,University Of Northwestern Traditional Undergraduate & Dual Enrollment
Notre Dame,IN,University Of Notre Dame,MATH 125 + MATH 126 + MATH 225,Calculus I + Calculus II + Foundations Of Higher Math,MATH 1010 + MATH 1020,Calculus I + Calculus II,,,,University Of Notre Dame Undergraduate
Notre Dame,IN,University Of Notre Dame,MATH 10550,Calculus I,MATH 1010,Calculus I,,,,University Of Notre Dame Fall Course Descriptions
Eugene,OR,University Of Oregon,MATH 261 + MATH 262,Calculus With Theory I + Calculus With Theory II,MATH 1010,Calculus I,,,,University Of Oregon
Bradford,PA,University Of Pittsburgh-Bradford,MATH 0140,Calculus 1,MATH 1010,Calculus I,,,,University Of Pittsburgh Bradford
Pittsburgh,PA,University Of Pittsburgh-Main Campus,MATH 0220,Analytic Geometry And Calculus 1,MATH 1010,Calculus I,,,,University Of Pittsburgh Undergraduate
Mayaguez,PR,University Of Puerto Rico-Mayaguez,MATE 3031,Calculus I,MATH 1010,Calculus I,,,,University Of Puerto Rico Mayaguez Undergraduate
San Juan,PR,University Of Puerto Rico-Rio Piedras,MATE 3151,Calculo I,MATH 1010,Calculus I,,,,University Of Puerto Rico Rio Piedras
Kingston,RI,University Of Rhode Island,MTH243,Calculus For Functions Of Several Variables,MATH 1010 + MATH 1020,Calculus I + Calculus II,,,,University Of Rhode Island
Richmond,VA,University Of Richmond,MATH 211 + MATH 212,Calculus I + Calculus II,MATH 1010,Calculus I,,,,University Of Richmond Undergraduate
Rochester,NY,University Of Rochester,MTH 141,Calculus I,MATH 1010,Calculus I,,,,University Of Rochester Fall Course Descriptions
Rochester,NY,University Of Rochester,MTH 161,Calculus Ia,MATH 1010,Calculus I,,,,University Of Rochester Fall Course Descriptions
San Francisco,CA,University Of San Francisco,MATH 109,Calculus & Analytic Geom I,MATH 1010,Calculus I,,,,University Of San Francisco
Columbia,SC,University Of South Carolina Columbia,MATH 141,Calculus I,MATH 1010,Calculus I,,,,University Of South Carolina At Columbia Undergraduate
Tampa,FL,University Of South Florida,MAC 2311,Calculus I,MATH 1010,Calculus I,,,,University Of South Florida Undergraduate
Sarasota,FL,University Of South Florida Sarasota-Manatee,MAC 2311,Calculus I,MATH 1010,Calculus I,,,,University Of South Florida Undergraduate
St. Petersburg,FL,University Of South Florida-St. Petersburg,MAC 2311,Calculus I,MATH 1010,Calculus I,,,,University Of South Florida Undergraduate
Los Angeles,CA,University Of Southern California,MATH 125,Calculus I,MATH 1010,Calculus I,,,,University Of Southern California
Portland,ME,University Of Southern Maine,MAT 152,Calculus A,MATH 1010,Calculus I,MATH 1010 (4 cr),05/01/2023,05/01/2026,University Of Southern Maine Undergraduate
Sydney,NSW,University Of Sydney,MATH1001,Differential Calculus,MATH 1010,Calculus I,,,,University Of Sydney Undergraduate Science
Sydney,NSW,University Of Sydney,MATH1021,Calculus Of One Variable,MATH 1010,Calculus I,,,,University Of Sydney Faculty Of Engineering Undergraduate
Knoxville,TN,University Of Tennessee,MATH 141 + MATH 142,Calculus I + Calculus II,MATH 1010,Calculus I,,,,University Of Tennessee Knoxville Undergraduate
Washington,DC,University Of The District Of Columbia,1535 + 1535,151 Calculus I + 155 Calculus I Lab,MATH 1010,Calculus I,,,,University Of The District Of Columbia
Sewanee,TN,University Of The South,MATH 101 + MATH 102 + MATH 207 + MATH 210,Calculus I + Calculus II + Multidimensional Calculus + Linear Algebra,MATH 1010 + MATH 1020 + MATH 2010,Calculus I + Calculus II + Multivariable Calculus And Matrix Algebra,,,,University Of The South Sewanee College Arts And Sciences
Toronto,ON,University Of Toronto,MAT196H1,Calculus A,MATH 1010,Calculus I,,,,University Of Toronto Faculty Of Applied Science And Engineering
Salt Lake City,UT,University Of Utah,MATH1210,Calculus I,MATH 1010,Calculus I,,,,University Of Utah
Burlington,VT,University Of Vermont And State Agricultural College,MATH 021,Qr: Calculus I,MATH 1010,Calculus I,,,,University Of Vermont Undergraduate
Seattle,WA,University Of Washington,MATH 124,Calculus With Analytic Geometry I,MATH 1010,Calculus I,,,,University Of Washington Course Descriptions
Carrollton,GA,University Of West Georgia,MATH 1634,Calculus I,MATH 1010,Calculus I,,,,University Of West Georgia Undergraduate
Madison,WI,University Of Wisconsin-Madison,MATH 221,Calculus And Analytic Geometry 1,MATH 1010,Calculus I,,,,University Of Wisconsin Madison Course Descriptions
Laramie,WY,University Of Wyoming,MATH2200,Calculus I,MATH 1010,Calculus I,,,,University Of Wyoming
Utica,NY,Utica University,MAT 201,Calculus I,MATH 1010,Calculus I,,,,Utica University Winter/Spring Undergraduate
Orlando,FL,Valencia College,MAC 2311,Calculus With Analytic Geometry I,MATH 1010,Calculus I,,,,Valencia College
Flushing,NY,Vaughn College Of Aeronautics And Technology,MAT120,Calculus I,MATH 1010,Calculus I,,,,Vaughn College Of Aeronautics And Technology Undergraduate
Randolph Center,VT,Vermont State University,MAT 1520,Calculus For Engineering,MATH 1010,Calculus I,,,,Vermont Technical College
Villanova,PA,Villanova University,MAT 1500,Calculus I,MATH 1010,Calculus I,,,,Villanova University
Lexington,VA,Virginia Military Institute,MA 115 + MA 116,Calculus With Analytic Geometry I + Calculus With Analytic Geometry II,MATH 1010,Calculus I,,,,Virginia Military Institute
Hampton,VA,Virginia Peninsula Community College,MTH 263,Calculus I,MATH 1010,Calculus I,MATH 1010 (4cr),05/01/2023,05/01/2026,Virginia Peninsula Community College
Blacksburg,VA,Virginia Polytechnic Institute And State University,MATH 1225,Calculus Of A Single Variable,MATH 1010,Calculus I,,09/01/2023,09/01/2026,Virginia Polytechnic Institute And State University
Roanoke,VA,Virginia Western Community College,MTH 175 + MTH 178,Calculus Of One Variable I + Topics In Analytic Geometry,MATH 1010,Calculus I,,,,Virginia Western Community College
Raleigh,NC,Wake Technical Community College,MAT-271,Calculus I,MATH 1010,Calculus I,,,,Wake Technical Community College
Washington,NJ,Warren County Community College,MAT 201,Calculus I,MATH 1010,Calculus I,,,,Warren County Community College
Chestertown,MD,Washington College,MAT 112,Integral Calculus,MATH 1010,Calculus I,,,,Washington College
Pullman,WA,Washington State University,MATH 171,Calculus I,MATH 1010,Calculus I,,,,Washington State University
Everett,WA,Washington State University - Everett Campus,MATH 171,Calculus I,MATH 1010,Calculus I,,,,Washington State University
Spokane,WA,Washington State University-Spokane,MATH 171,Calculus I,MATH 1010,Calculus I,,,,Washington State University
Richland,WA,Washington State University-Tri Cities,MATH 171,Calculus I,MATH 1010,Calculus I,,,,Washington State University
Vancouver,WA,Washington State University-Vancouver,MATH 171,Calculus I,MATH 1010,Calculus I,,,,Washington State University
Aurora,NY,Wells College,MATH 111,Calculus I: Introduction To Calculus,MATH 1010,Calculus I,,,,Wells College
Boston,MA,Wentworth Institute Of Technology,MATH 285,Engineering Calculus I,MATH 1010,Calculus I,,,,Wentworth Institute Of Technology Summer Course Descriptions
