City,State,Institution,Transfer Course ID,Transfer Course Name,RPI Course ID,RPI Course Name,Note,Begin,End,Transfer Catalog
Garden City,NY,Adelphi University,MTH141,Calculus I,MATH 1010,Calculus I,,,,Adelphi University Undergraduate And Graduate Courses
Queensbury,NY,Adirondack Community College,MAT 131,Calculus I,MATH 1010,Calculus I,MATH 1010 (4 cr),01/01/2024,01/01/2027,SUNY Adirondack Community College
Adrian,MI,Adrian College,MATH135,Calculus & Analytic Geometry I,MATH 1010,Calculus I,,,,Adrian College Undergraduate
Albany,NY,Albany College Of Pharmacy And Health Sciences,MAT 121,Calculus I,MATH 1010,Calculus I,,,,Albany College Of Pharmacy And Health Sciences
Alfred,NY,Alfred University,MATH 151,Calculus I,MATH 1010,Calculus I,MATH 1010 (4 cr),05/01/2023,05/01/2026,Alfred University
Sacramento,CA,American River College,MATH 400,Calculus I,MATH 1010,Calculus I,,,,American River College
Washington,DC,American University,MATH-211,Applied Calculus I,MATH 1010,Calculus I,,,,American University
Washington,DC,American University,MATH-221,Calculus I,MATH 1010,Calculus I,,,,American University
Cairo, ,American University In Cairo,MACT 1121 + MACT 1122,Calculus I + Calculus II,MATH 1010,Calculus I,,,,American University In Cairo
Arnold,MD,Anne Arundel Community College,MAT 191,Calculus And Analytic Geometry 1,MATH 1010,Calculus I,,,,Anne Arundel Community College
Boone,NC,Appalachian State University,MAT 1110,Calculus With Analytic Geometry I,MATH 1010,Calculus I,,,,Appalachian State University Undergraduate
Sierra Vista,AZ,Arizona State University - Cochise,MAT 265,Calculus For Engineers I,MATH 1010,Calculus I,,,,Arizona State University Course Descriptions Fall
Lake Havasu City,AZ,Arizona State University - Lake Havasu,MAT 265,Calculus For Engineers I,MATH 1010,Calculus I,,,,Arizona State University Course Descriptions Fall
Mesa,AZ,Arizona State University - Mesa City Center,MAT 265,Calculus For Engineers I,MATH 1010,Calculus I,,,,Arizona State University Course Descriptions Fall
Tucson,AZ,Arizona State University - Pima,MAT 265,Calculus For Engineers I,MATH 1010,Calculus I,,,,Arizona State University Course Descriptions Fall
Casa Grande,AZ,Arizona State University - Pinal,MAT 265,Calculus For Engineers I,MATH 1010,Calculus I,,,,Arizona State University Course Descriptions Fall
Thatcher,AZ,Arizona State University - The Gila Valley,MAT 265,Calculus For Engineers I,MATH 1010,Calculus I,,,,Arizona State University Course Descriptions Fall
Prescott Valley,AZ,Arizona State University - Yavapai,MAT 265,Calculus For Engineers I,MATH 1010,Calculus I,,,,Arizona State University Course Descriptions Fall
Yuma,AZ,Arizona State University - Yuma,MAT 265,Calculus For Engineers I,MATH 1010,Calculus I,,,,Arizona State University Course Descriptions Fall
Phoenix,AZ,Arizona State University-Downtown Phoenix,MAT 265,Calculus For Engineers I,MATH 1010,Calculus I,,,,Arizona State University Course Descriptions Fall
Mesa,AZ,Arizona State University-Polytechnic,MAT 265,Calculus For Engineers I,MATH 1010,Calculus I,,,,Arizona State University Course Descriptions Fall
Scottsdale,AZ,Arizona State University-Skysong,MAT 265,Calculus For Engineers I,MATH 1010,Calculus I,,,,Arizona State University Course Descriptions Fall
Tempe,AZ,Arizona State University-Tempe,MAT 265,Calculus For Engineers I,MATH 1010,Calculus I,,,,Arizona State University Course Descriptions Fall
Glendale,AZ,Arizona State University-West,MAT 265,Calculus For Engineers I,MATH 1010,Calculus I,,,,Arizona State University Course Descriptions Fall
Russellville,AR,Arkansas Tech University,MATH 2914 + MATH 2924 + MATH 2934,Calculus I + Calculus II + Calculus III,MATH 1010 + MATH 1020 + MATH 2011,Calculus I + Calculus II + Multivariable Calculus,,,,Arkansas Tech University Undergraduate
Athabasca,AB,Athabasca University,MATH 265,Introduction To Calculus I,MATH 1010,Calculus I,,,,Athabasca University Undergraduate
Clarksville,TN,Austin Peay State University,MATH 1910,Calculus I,MATH 1010,Calculus I,,,,Austin Peay State University Undergraduate
Bakersfield,CA,Bakersfield College,MATH 6A + MATH 6B,Analytic Geometry And Calculus I + Analytic Geometry And Calculus II,MATH 1010,Calculus I,,,,Bakersfield College
Berea,OH,Baldwin Wallace University,MTH 141,Calculus I,MATH 1010,Calculus I,,,,Baldwin Wallace University
Lewiston,ME,Bates College,MATH 105,Calculus I,MATH 1010,Calculus I,,,,Bates College
Bellevue,WA,Bellevue College,MATH& 151,Calculus I,MATH 1010,Calculus I,MATH 1010 (4cr),05/01/2023,05/01/2026,Bellevue College
Beloit,WI,Beloit College,MATH 110,Calculus I,MATH 1010,Calculus I,,,,Beloit College
Waltham,MA,Bentley University,MA 131,Calculus I,MATH 1010,Calculus I,,,,Bentley University Undergraduate
Paramus,NJ,Bergen Community College,MAT-280,Calculus I,MATH 1010,Calculus I,MATH 1010 (4cr),05/01/2023,05/01/2026,Bergen Community College
Pittsfield,MA,Berkshire Community College,ENM 151,Engineering Calculus I,MATH 1010,Calculus I,,,,Berkshire Community College
Boise,ID,Boise State University,MATH170,Calculus I,MATH 1010,Calculus I,,,,Boise State University Undergraduate
Chestnut Hill,MA,Boston College,MATH1100,Calculus I,MATH 1010,Calculus I,,,,Boston College
Waltham,MA,Brandeis University,MATH 10a,Techniques Of Calculus (A),MATH 1010,Calculus I,,,,Brandeis University
Fall River,MA,Bristol Community College,MTH 214,Calculus I,MATH 1010,Calculus I,,,,Bristol Community College
Lincroft,NJ,Brookdale Community College,MATH171,Calculus I,MATH 1010,Calculus I,,,,Brookdale Community College
Binghamton,NY,Broome Community College,MAT 181,Calculus I,MATH 1010,Calculus I,,,,SUNY Broome Community College
Fort Lauderdale,FL,Broward College,MAC2311,Calculus And Analytical Geometry I,MATH 1010,Calculus I,,,,Broward College
Smithfield,RI,Bryant University,MATH 121,Calculus And Analytic Geometry I,MATH 1010,Calculus I,,,,Bryant University Undergraduate
Lewisburg,PA,Bucknell University,MATH 201,Calculus I,MATH 1010,Calculus I,,,,Bucknell University
Newtown,PA,Bucks County Community College,MATH 140,Calculus I,MATH 1010,Calculus I,,,,Bucks County Community College
Bristol,PA,Bucks County Community College-Lower Bucks Campus,MATH 140,Calculus I,MATH 1010,Calculus I,,,,Bucks County Community College
Perkasie,PA,Bucks County Community College-Upper Bucks Campus,MATH 140,Calculus I,MATH 1010,Calculus I,,,,Bucks County Community College
Boston,MA,Bunker Hill Community College,MAT-281,Calculus I,MATH 1010,Calculus I,,,,Bunker Hill Community College
Boston,MA,Bunker Hill Community College,MAT-282 + MAT-283,Calculus II + Calculus III,MATH 1010 + MATH 2011,Calculus I + Multivariable Calculus,,,,Bunker Hill Community College
Aptos,CA,Cabrillo College,MATH-5A,Anl Geom And Calc I,MATH 1010,Calculus I,,,,Cabrillo College Course Descriptions
Pasadena,CA,California Institute Of Technology,Ma 1a,Calculus Of One And Several Variables And Linear Algebra,MATH 1010,Calculus I,,,,California Institute Of Technology
Pasadena,CA,California Institute Of Technology,Ma 1b + Ma 1c,Calculus Of One And Several Variables And Linear Algebra + Calculus Of One And Several Variables And Linear Algebra,MATH 1010 + MATH 1020,Calculus I + Calculus II,,,,California Institute Of Technology
Long Beach,CA,California State University-Long Beach,MATH 122,Calculus I,MATH 1010,Calculus I,,,,California State University Long Beach
Cambridge, ,Cambridge Assessment International Education,Mathematics - 9709,Mathematics,MATH 1010 + MATH 1020,Calculus I + Calculus II,A Level Only,,,AICE Cambridge International Exams
Redwood City,CA,Canada College,MATH 251,Analytical Geometry And Calculus I,MATH 1010,Calculus I,,,,Canada College
Buffalo,NY,Canisius College,MAT 111,Calculus I,MATH 1010,Calculus I,,,,Canisius College Undergraduate
West Barnstable,MA,Cape Cod Community College,MAT240,Calculus I,MATH 1010,Calculus I,,,,Cape Cod Community College
Cleveland,OH,Case Western Reserve University,MATH 121,Calculus For Science And Engineering I,MATH 1010,Calculus I,,,,Case Western Reserve University
Auburn,NY,Cayuga Community College,MATH 108 + MATH 201,Calculus I + Calculus II,MATH 1010,Calculus I,,,,Cayuga Community College
Cedarville,OH,Cedarville University,MATH-1710,Calculus I,MATH 1010,Calculus I,,,,Cedarville University Undergraduate
Mcpherson,KS,Central Christian College Of Kansas,NS-MA 111-G,Calculus I,MATH 1010,Calculus I,,,,Central Christian College Of Kansas
New Britain,CT,Central Connecticut State University,MATH 152,Calculus I,MATH 1010,Calculus I,,,,Central Connecticut State University
Mount Pleasant,MI,Central Michigan University,MTH 132,Calculus I,MATH 1010,Calculus I,,,,Central Michigan University Undergraduate
Albuquerque,NM,Central New Mexico Community College,MATH 162,Calculus I,MATH 1010,Calculus I,,,,Central New Mexico Community College
Albuquerque,NM,Central New Mexico Community College,MATH 1710 + MATH 1715,Calculus I + Calculus II,MATH 1010,Calculus I,,,,Central New Mexico Community College
Bend,OR,Central Oregon Community College,MTH 251,Calculus I,MATH 1010,Calculus I,,,,Central Oregon Community College
Danville,KY,Centre College,MAT 170 + MAT 171,Calculus-I + Calculus-II,MATH 1010,Calculus I,,,,Centre College
Burlington,VT,Champlain College,MTH 230,Calculus I,MATH 1010,Calculus I,,,,Champlain College Undergraduate
Chandler,AZ,Chandler-Gilbert Community College,MAT 220,Calculus With Analytic Geometry I,MATH 1010,Calculus I,MATH 1010 (4cr),05/01/2023,05/01/2026,Maricopa County Community College District Course Descriptions
Chandler,AZ,Chandler-Gilbert Community College,MAT 221,Calculus With Analytic Geometry I,MATH 1010,Calculus I,MATH 1010 (4cr),05/01/2023,05/01/2026,Maricopa County Community College District Course Descriptions
Charleston,SC,Citadel Military College Of South Carolina,MATH 131,Analytic Geometry And Calculus I,MATH 1010,Calculus I,,,,Citadel Military College Of South Carolina
San Francisco,CA,City College Of San Francisco,MATH 110A,Calculus I,MATH 1010,Calculus I,,,,City College Of San Francisco
Atlanta,GA,Clark Atlanta University,CMAT 111,Calculus I,MATH 1010,Calculus I,,,,Clark Atlanta University Undergraduate
Worcester,MA,Clark University,MATH 120,Calculus I,MATH 1010,Calculus I,,,,Clark University
Worcester,MA,Clark University,MATH 124,Honors Calculus I,MATH 1010,Calculus I,,,,Clark University
Potsdam,NY,Clarkson University,MA 131,Calculus I,MATH 1010,Calculus I,,,,Clarkson University Course Descriptions
Potsdam,NY,Clarkson University,MA 132,Calculus II,MATH 1010 + MATH 1010,Calculus I + Calculus I,,,,Clarkson University Course Descriptions
Potsdam,NY,Clarkson University,MA 132,Calculus II,MATH 1010 + MATH 1010,Calculus I + Calculus I,,,,Clarkson University Course Descriptions
Schenectady,NY,Clarkson University Capital Region Campus,MA 131,Calculus I,MATH 1010,Calculus I,,,,Clarkson University Course Descriptions
Schenectady,NY,Clarkson University Capital Region Campus,MA 132,Calculus II,MATH 1010 + MATH 1010,Calculus I + Calculus I,,,,Clarkson University Course Descriptions
Schenectady,NY,Clarkson University Capital Region Campus,MA 132,Calculus II,MATH 1010 + MATH 1010,Calculus I + Calculus I,,,,Clarkson University Course Descriptions
Clemson,SC,Clemson University,MATH 1060,Calculus Of One Variable I,MATH 1010,Calculus I,,,,Clemson University Undergraduate
Cleveland,OH,Cleveland State University,MTH 181,Calculus I,MATH 1010,Calculus I,MATH 1010 (4cr),05/01/2023,05/01/2026,Cleveland State University Undergraduate
Plattsburgh,NY,Clinton Community College,MAT 224,Calculus I,MATH 1010,Calculus I,,,,State University Of New York Clinton Community College
Waterville,ME,Colby College,MA121,Single-Variable Calculus,MATH 1010,Calculus I,,,,Colby College
Kentfield,CA,College Of Marin,MATH123,Analytic Geometry And Calculus I,MATH 1010,Calculus I,,,,College Of Marin
Twin Falls,ID,College Of Southern Idaho,MATH 170 + MATH 175,Calculus 1 + Calculus 2,MATH 1010,Calculus I,,,,College Of Southern Idaho
La Plata,MD,College Of Southern Maryland,MTH-1200,Calculus I And Analytic Geometry,MATH 1010,Calculus I,,,,College Of Southern Maryland
Santa Clarita,CA,College Of The Canyons,MATH 211,Calculus I,MATH 1010,Calculus I,,,,College Of The Canyons
Eureka,CA,College Of The Redwoods,MATH50A,Differential Calculus,MATH 1010,Calculus I,,,,College Of The Redwoods
Wooster,OH,College Of Wooster,MATH 11100,Calculus & Analytic Geom I,MATH 1010,Calculus I,,,,College Of Wooster
Allen,TX,Collin College - Allen Campus,MATH 2413,Calculus I,MATH 1010,Calculus I,,,,Collin College
Mckinney,TX,Collin College - Central Park Campus,MATH 2413,Calculus I,MATH 1010,Calculus I,,,,Collin College
Rockwall,TX,Collin College - Higher Education Center At Rockwall,MATH 2413,Calculus I,MATH 1010,Calculus I,,,,Collin College
Mckinney,TX,Collin County Community College District,MATH 2413,Calculus I,MATH 1010,Calculus I,,,,Collin College
Golden,CO,Colorado School Of Mines,MATH111,Calculus For Scientists And Engineers I,MATH 1010,Calculus I,,,,Colorado School Of Mines Undergraduate
New York,NY,Columbia University In The City Of New York,MATH UN1101,Calculus I,MATH 1010,Calculus I,,,,Columbia University Columbia College
Hudson,NY,Columbia-Greene Community College,MA 123,Calculus II,MATH 1010,Calculus I,,,,Columbia-Greene Community College
Baltimore,MD,Community College Of Baltimore County,MATH 251,Calculus I,MATH 1010,Calculus I,,,,Community College Of Baltimore County
Montpelier,VT,Community College Of Vermont,MAT 1531,Calculus I,MATH 1010,Calculus I,MATH 1010 (4cr),05/01/2023,05/01/2026,Community College Of Vermont
New Haven,CT,Connecticut State Community College Gateway Campus,MAT 254,Calculus I,MATH 1010,Calculus I,MATH 1010 (4cr),05/01/2023,05/01/2026,Gateway Community College
Bridgeport,CT,Connecticut State Community College Housatonic Campus,MAT* E254,Calculus I,MATH 1010,Calculus I,,,,Housatonic Community College
Waterbury,CT,Connecticut State Community College Naugatuck Campus,MAT* H254,Calculus I,MATH 1010,Calculus I,,,,Naugatuck Valley Community College
Norwich,CT,Connecticut State Community College Three Rivers Campus,MAT* K254,Calculus I,MATH 1010,Calculus I,,,,Three Rivers Community College
Farmington,CT,Connecticut State Community College Tunxis Campus,MAT*254,Calculus I,MATH 1010,Calculus I,,,,Tunxis Community College
New York,NY,Cooper Union For The Advancement Of Science & Art,MA 111,Calculus I,MATH 1010,Calculus I,,,,Cooper Union
Ithaca,NY,Cornell University-Endowed Colleges,MATH 191,Calculus For Engineers,MATH 1010,Calculus I,,,,Cornell University
Ithaca,NY,Cornell University-Endowed Colleges,MATH 1110,Calculus I,MATH 1010,Calculus I,,,,Cornell University
Corning,NY,Corning Community College,MA 161,Calculus I,MATH 1010,Calculus I,,,,Corning Community College
Corning,NY,Corning Community College,MATH 1610,Calculus I,MATH 1010,Calculus I,,,,Corning Community College
Sacramento,CA,Cosumnes River College,MATH 400,Calculus I,MATH 1010,Calculus I,,,,Cosumnes River College
Randolph,NJ,County College Of Morris,MAT-131,Analytic Geometry And Calculus I,MATH 1010,Calculus I,,,,County College Of Morris
New Bern,NC,Craven Community College,MAT 271,Calculus I,MATH 1010,Calculus I,,,,Craven Community College
San Luis Obispo,CA,Cuesta College,MATH 265A,Calculus I,MATH 1010,Calculus I,,,,Cuesta College
New York,NY,Cuny Bernard M Baruch College,MTH 2207,Applied Calculus And Matrix Applications,MATH 1010,Calculus I,MATH 1010 (4cr),05/01/2023,05/01/2026,CUNY Baruch College Undergraduate
New York,NY,Cuny Bernard M Baruch College,MTH 2610,Calculus I,MATH 1010,Calculus I,MATH 1010 (4 cr),01/01/2024,01/01/2027,CUNY Baruch College Undergraduate
New York,NY,Cuny Bernard M Baruch College,MTH 3006,Integral Calculus,MATH 1010,Calculus I,,,,CUNY Baruch College Undergraduate
New York,NY,Cuny Borough Of Manhattan Community College,MAT 301,Analytic Geometry And Calculus I,MATH 1010,Calculus I,MATH 1010 (4cr),05/01/2023,05/01/2026,CUNY Borough Of Manhattan Community College
Bronx,NY,Cuny Bronx Community College,MTH 31,Analytic Geometry And Calculus I,MATH 1010,Calculus I,,,,CUNY Bronx Community College
New York,NY,Cuny City College,MATH 20100,Calculus I,MATH 1010,Calculus I,,,,CUNY City College
Staten Island,NY,Cuny College Of Staten Island,MTH 231,Analytic Geometry And Calculus I,MATH 1010,Calculus I,,,,CUNY College Of Staten Island Undergraduate
Long Island City,NY,Cuny Laguardia Community College,MAT201,Calculus I,MATH 1010,Calculus I,,,,CUNY LaGuardia Community College
Brooklyn,NY,Cuny New York City College Of Technology,MAT 1475,Calculus I,MATH 1010,Calculus I,,05/01/2023,05/01/2026,CUNY New York City College Of Technology Fall
Queens,NY,Cuny Queens College,MATH 141 + MATH 142 + MATH 143,Calculus/Differentiation + Calculus/Integration + Calculus-Infinite Series,MATH 1010,Calculus I,MATH 1010 (4cr),05/01/2023,05/01/2026,CUNY Queens College Undergraduate
Queens,NY,Cuny Queens College,MATH 151,Calculus/Differentiation & Integration,MATH 1010,Calculus I,MATH 1010 (4 cr),01/01/2024,01/01/2027,CUNY Queens College Undergraduate
Bayside,NY,Cuny Queensborough Community College,MA441,Analytic Geometry & Calc I,MATH 1010,Calculus I,,,,CUNY Queensborough Community College
Dallas,TX,Dallas College,MATH 2413,Calculus I,MATH 1010,Calculus I,,,,Dallas College
Cupertino,CA,De Anza College,MATH 1A,Calculus,MATH 1010,Calculus I,MATH 1010 (4cr),05/01/2023,05/01/2026,De Anza College
Media,PA,Delaware County Community College,MAT 160,Calculus I,MATH 1010,Calculus I,,,,Delaware County Community College
Georgetown,DE,Delaware Technical Community College-Owens,MAT 281,Calculus I,MATH 1010,Calculus I,,,,Delaware Technical Community College
Wilmington,DE,Delaware Technical Community College-Stanton/Wilmington,MAT 281,Calculus I,MATH 1010,Calculus I,,,,Delaware Technical Community College
Dover,DE,Delaware Technical Community College-Terry,MAT 281,Calculus I,MATH 1010,Calculus I,,,,Delaware Technical Community College
Granville,OH,Denison University,MATH-123,Single Variable Calculus I,MATH 1010,Calculus I,,,,Denison University
Granville,OH,Denison University,MATH 135,Single Variable Calculus,MATH 1010,Calculus I,MATH 1010 (4 cr),01/01/2024,01/01/2027,Denison University
Pleasant Hill,CA,Diablo Valley College,MATH-192 + MATH-193 + MATH-194 + MATH-292,Analytic Geometry And Calculus I + Analytic Geometry And Calculus II + Linear Algebra + Analytic Geometry And Calculus III,MATH 1010 + MATH 1020 + MATH 2010,Calculus I + Calculus II + Multivariable Calculus And Matrix Algebra,,,,Diablo Valley College
Carlisle,PA,Dickinson College,MATH 161,Calculus I,MATH 1010,Calculus I,,,,Dickinson College
Madison,NJ,Drew University,MATH 16,Accelerated Calculus,MATH 1010,Calculus I,,,,Drew University College Of Liberal Arts
Philadelphia,PA,Drexel University,MATH 121,Calculus I,MATH 1010,Calculus I,,,,Drexel University Undergraduate
Philadelphia,PA,Drexel University,TDEC 110 + TDEC 112,Mathematical Foundations Of Engineering + Mathematical Foundations Of Engineering II,MATH 1010,Calculus I,,,,Drexel University
Pittsburgh,PA,Duquesne University,MATH 116,Calculus II,MATH 1010,Calculus I,,,,Duquesne University Undergraduate
Poughkeepsie,NY,Dutchess Community College,MAT221,Calculus I,MATH 1010,Calculus I,MATH 1010 (4cr),05/01/2023,05/01/2026,Dutchess Community College
Richmond,IN,Earlham College,MATH 180,Calculus A,MATH 1010,Calculus I,,,,Earlham College Curriculum Guide
Monterey Park,CA,East Los Angeles College,MATH 261,Calculus I,MATH 1010,Calculus I,,,,East Los Angeles College
Cocoa,FL,Eastern Florida State College,MAC 1311,Calculus 1 With Analytic Geometry,MATH 1010,Calculus I,,,,Eastern Florida State College
Ypsilanti,MI,Eastern Michigan University,MATH 120,Calculus I,MATH 1010,Calculus I,,,,Eastern Michigan University Undergraduate
Saint Petersburg,FL,Eckerd College,MA 131M,Calculus I,MATH 1010,Calculus I,MATH 1010 (3 cr),01/01/2024,01/01/2027,Eckerd College
Saint Petersburg,FL,Eckerd College,MA 131M + MA 132M,Calculus I + Calculus II,MATH 1010,Calculus I,,,,Eckerd College
Lynnwood,WA,Edmonds College,MATH& 151,Calculus I,MATH 1010,Calculus I,,,,Edmonds College
Elon,NC,Elon University,MTH 151,Calculus I,MATH 1010,Calculus I,,,,Elon University Undergraduate
Prescott,AZ,Embry-Riddle Aeronautical University - Prescott,MA 241,Calculus And Analytical Geometry I,MATH 1010,Calculus I,,,,Embry-Riddle Aeronautical University Prescott Campus
Buffalo,NY,Erie Community College,MT 181,Calculus And Analytic Geometry I,MATH 1010,Calculus I,,,,Erie Community College
Newark,NJ,Essex County College,MTH 121,Calc With Analytic Geom I,MATH 1010,Calculus I,,,,Essex County College
Avondale,AZ,Estrella Mountain Community College,MAT 220,Calculus With Analytic Geometry I,MATH 1010,Calculus I,MATH 1010 (4cr),05/01/2023,05/01/2026,Maricopa County Community College District Course Descriptions
Avondale,AZ,Estrella Mountain Community College,MAT 221,Calculus With Analytic Geometry I,MATH 1010,Calculus I,MATH 1010 (4cr),05/01/2023,05/01/2026,Maricopa County Community College District Course Descriptions
Fairfield,CT,Fairfield University,MA 0145,"Calculus I For Chemistry, Engineering, And Physics Majors",MATH 1010,Calculus I,,,,Fairfield University Course Descriptions
Wroxton, ,Fairleigh Dickinson University - Wroxton,MATH_1203,Calculus I,MATH 1010,Calculus I,MATH 1010 (4cr),09/01/2023,09/01/2026,Fairleigh Dickinson University Course Offerings
Madison,NJ,Fairleigh Dickinson University-Florham Campus,MATH_1203,Calculus I,MATH 1010,Calculus I,MATH 1010 (4cr),09/01/2023,09/01/2026,Fairleigh Dickinson University Course Offerings
Teaneck,NJ,Fairleigh Dickinson University-Metropolitan Campus,MATH_1203,Calculus I,MATH 1010,Calculus I,MATH 1010 (4cr),09/01/2023,09/01/2026,Fairleigh Dickinson University Course Offerings
Farmingdale,NY,Farmingdale State College,MTH 150,Calculus I,MATH 1010,Calculus I,MATH 1010 (4cr),05/01/2023,05/01/2026,SUNY Farmingdale State College
Canandaigua,NY,Finger Lakes Community College,MAT 272,Calculus II,MATH 1010,Calculus I,,,,Finger Lakes Community College
Fort Myers,FL,Florida Gulf Coast University,MAC 2312,Calculus II,MATH 1010,Calculus I,,,,Florida Gulf Coast University Spring Course Descriptions
Melbourne,FL,Florida Institute Of Technology-Florida Tech Online,MTH 1001,Calculus 1,MATH 1010,Calculus I,,,,Florida Institute Of Technology
Melbourne,FL,Florida Institute Of Technology-Melbourne,MTH 1001,Calculus 1,MATH 1010,Calculus I,,,,Florida Institute Of Technology
Jacksonville,FL,Florida State College At Jacksonville,MAC 2311,Calculus With Analytic Geometry I,MATH 1010,Calculus I,,,,Florida State College At Jacksonville
Tallahassee,FL,Florida State University,MAC 2311,Calculus With Analytic Geometry I,MATH 1010,Calculus I,,,,Florida State University
City Of Knowledge, ,Florida State University - Panama,MAC 2311,Calculus With Analytic Geometry I,MATH 1010,Calculus I,,,,Florida State University
Folsom,CA,Folsom Lake College,MATH 400,Calculus I,MATH 1010,Calculus I,,,,Folsom Lake College
Los Altos Hills,CA,Foothill College,MATH 1A,Calculus,MATH 1010,Calculus I,,,,Foothill College
Bronx,NY,Fordham University,MATH 1206,Calculus I,MATH 1010,Calculus I,MATH 1010 (4cr),09/01/2023,09/01/2026,Fordham University
Hays,KS,Fort Hays State University,MATH 234,Analytic Geometry And Calculus I,MATH 1010,Calculus I,,,,Fort Hays State University
Lancaster,PA,Franklin And Marshall College,MAT 109,Calculus I,MATH 1010,Calculus I,,,,Franklin And Marshall College
Fresno,CA,Fresno City College,MATH 5A,Mathematical Analysis I,MATH 1010,Calculus I,,,,Fresno City College
Westminster,CO,Front Range Community College,MAT 201,Calculus I,MATH 1010,Calculus I,,,,Front Range Community College
Johnstown,NY,Fulton-Montgomery Community College,MAT 170,Calculus I,MATH 1010,Calculus I,,,,Fulton-Montgomery Community College
Greenville,SC,Furman University,MTH-150,Analytic Geometry And Calculus I,MATH 1010,Calculus I,,,,Furman University
Phoenix,AZ,Gateway Community College,MAT 220,Calculus With Analytic Geometry I,MATH 1010,Calculus I,MATH 1010 (4cr),05/01/2023,05/01/2026,Maricopa County Community College District Course Descriptions
Phoenix,AZ,Gateway Community College,MAT 221,Calculus With Analytic Geometry I,MATH 1010,Calculus I,MATH 1010 (4cr),05/01/2023,05/01/2026,Maricopa County Community College District Course Descriptions
Batavia,NY,Genesee Community College,MAT141,Calculus 1,MATH 1010,Calculus I,,,,Genesee Community College
Fairfax,VA,George Mason University,MATH 113,Analytic Geometry And Calculus I,MATH 1010,Calculus I,MATH 1010 (4 cr),05/01/2023,05/01/2026,George Mason University
Fairfax,VA,George Mason University,MATH 115,Analytic Geometry And Calculus I (Honors),MATH 1010,Calculus I,MATH 1010 (4 cr),05/01/2023,05/01/2026,George Mason University
Washington,DC,George Washington University,MATH 1231,Single-Variable Calculus I,MATH 1010,Calculus I,,,,George Washington University
Washington,DC,Georgetown University,MATH-035,Calculus I,MATH 1010,Calculus I,,,,Georgetown University Course Descriptions
Atlanta,GA,Georgia State University-Perimeter College,MATH 2431,Calculus I,MATH 1010,Calculus I,,,,Georgia Perimeter College
Gettysburg,PA,Gettysburg College,MATH-111,Calculus I (Honors),MATH 1010,Calculus I,,,,Gettysburg College
Glendale,AZ,Glendale Community College,MAT 220,Calculus With Analytic Geometry I,MATH 1010,Calculus I,MATH 1010 (4cr),05/01/2023,05/01/2026,Maricopa County Community College District Course Descriptions
Glendale,AZ,Glendale Community College,MAT 221,Calculus With Analytic Geometry I,MATH 1010,Calculus I,MATH 1010 (4cr),05/01/2023,05/01/2026,Maricopa County Community College District Course Descriptions
Glendale,CA,Glendale Community College,MATH 103,Calculus And Analytic Geometry,MATH 1010,Calculus I,,,,Glendale Community College
Wenham,MA,Gordon College,MAT 121,Calculus I,MATH 1010,Calculus I,,,,Gordon College Undergraduate
