City,State,Institution,Transfer Course ID,Transfer Course Name,RPI Course ID,RPI Course Name,Note,Begin,End,Transfer Catalog
Auburn,WA,Green River College,MATH& 151,Calculus I,MATH 1010,Calculus I,,,,Green River College
Greenfield,MA,Greenfield Community College,MAT 201,Calculus With Analytic Geometry I,MATH 1010,Calculus I,,,,Greenfield Community College
Greenville,SC,Greenville Technical College,MAT 140 + MAT 141,Analytical Geometry And Calculus I + Analytical Geometry And Calculus II,MATH 1010,Calculus I,,,,Greenville Technical College
Grinnell,IA,Grinnell College,MAT 131,Calculus I,MATH 1010,Calculus I,,,,Grinnell College
El Cajon,CA,Grossmont College,MATH 180,Analytic Geometry And Calculus I,MATH 1010,Calculus I,,,,Grossmont College
Clinton,NY,Hamilton College,MATH 113,Calculus I,MATH 1010,Calculus I,,,,Hamilton College
Bel Air,MD,Harford Community College,MATH 203,Calculus I,MATH 1010,Calculus I,,,,Harford Community College
Oneonta,NY,Hartwick College,MATH 121,Single Variable Calculus,MATH 1010,Calculus I,,,,Hartwick College
Cambridge,MA,Harvard University,MATH E-15,Introduction To The Calculus A,MATH 1010,Calculus I,,,,Harvard University Extension Programs
Cambridge,MA,Harvard University,MATH S-1A,Calculus I,MATH 1010,Calculus I,,,,Harvard University Summer School
Haverford,PA,Haverford College,MATH 114 + MATH 115,Calculus II + Enriched Calculus II,MATH 1010,Calculus I,,,,Haverford College
Herkimer,NY,Herkimer County Community College,MA 245,Calculus I,MATH 1010,Calculus I,MATH 1010 (4 cr),01/01/2024,01/01/2027,Herkimer County Community College
Herkimer,NY,Herkimer County Community College,MA 246,Calculus II,MATH 1010 + MATH 1010,Calculus I + Calculus I,,,,Herkimer County Community College
Herkimer,NY,Herkimer County Community College,MA 246,Calculus II,MATH 1010 + MATH 1010,Calculus I + Calculus I,,,,Herkimer County Community College
Herkimer,NY,Herkimer County Community College,MA 245 + MA 246,Calculus I + Calculus II,MATH 1010 + MATH 1010,Calculus I + Calculus I,,,,Herkimer County Community College
Herkimer,NY,Herkimer County Community College,MA 245 + MA 246,Calculus I + Calculus II,MATH 1010 + MATH 1010,Calculus I + Calculus I,,,,Herkimer County Community College
Butte,MT,Highlands College Of Montana Tech,MATH 1516,Calculus I With Algebra Enhancement,MATH 1010,Calculus I,,,,Montana Tech Of The University Of Montana
Tampa,FL,Hillsborough Community College,MAC 2311 + MAC 2312,Calculus And Analytic Geometry I + Calculus And Analytic Geometry II,MATH 1010,Calculus I,,,,Hillsborough Community College
Geneva,NY,Hobart William Smith Colleges,MATH 130,Calculus I,MATH 1010,Calculus I,,,,Hobart And William Smith Colleges
Hempstead,NY,Hofstra University,MATH 071,Analytic Geometry And Calculus I,MATH 1010,Calculus I,,,,Hofstra University Undergraduate
Holyoke,MA,Holyoke Community College,MTH 111,Calculus And Analytical Geometry I,MATH 1010,Calculus I,,,,Holyoke Community College
Holyoke,MA,Holyoke Community College,MTH 113,Calculus I,MATH 1010,Calculus I,MATH 1010 (4 cr),01/01/2024,01/01/2027,Holyoke Community College
Houghton,NY,Houghton College,MATH 181,Calculus I,MATH 1010,Calculus I,,,,Houghton College
Jersey City,NJ,Hudson County Community College,MAT 111,Calculus I,MATH 1010,Calculus I,,,,Hudson County Community College
Troy,NY,Hudson Valley Community College,MATH 180,Calculus I,MATH 1010,Calculus I,MATH 1010 (4cr),05/01/2023,05/01/2026,Hudson Valley Community College
East Peoria,IL,Illinois Central College,MATH 222 + MATH 223,Calculus And Analytic Geometry I + Calculus And Analytic Geometry II,MATH 1010,Calculus I,,,,Illinois Central College
Chicago,IL,Illinois Institute Of Technology,MATH 151,Calculus I,MATH 1010,Calculus I,,,,Illinois Institute Of Technology Undergraduate
Indiana,PA,Indiana University Of Pennsylvania,MATH 125 + MATH 126 + MATH 225,"Calculus I/Physics, Chemistry, Mathematics + Calculus II/Physics, Chemistry, Mathematics + Calculus III/Physics, Chemistry, Mathematics",MATH 1010 + MATH 1020,Calculus I + Calculus II,,,,Indiana University Of Pennsylvania Undergraduate
Indianapolis,IN,Indiana University-Purdue University-Indianapolis,MATH 16500,Analytic Geometry And Calculus I,MATH 1010,Calculus I,,,,Indiana University Purdue University Indianapolis Bulletin
New Rochelle,NY,Iona University,MTH 231,Calculus 1,MATH 1010,Calculus I,,,,Iona University Undergraduate
Ames,IA,Iowa State University,MATH 165,Calculus I,MATH 1010,Calculus I,,,,Iowa State University
Irvine,CA,Irvine Valley College,MATH 3A,Analytic Geometry And Calculus I,MATH 1010,Calculus I,,,,Irvine Valley College
Ithaca,NY,Ithaca College,MATH 11100,Calculus I,MATH 1010,Calculus I,,,,Ithaca College
Anderson,IN,Ivy Tech Community College-Anderson,MAT 218 + MAT 219,Calculus With Analytic Geometry I + Calculus With Analytic Geometry II,MATH 1010 + MATH 1020,Calculus I + Calculus II,,,,Ivy Tech Community College
Bloomington,IN,Ivy Tech Community College-Bloomington,MAT 218 + MAT 219,Calculus With Analytic Geometry I + Calculus With Analytic Geometry II,MATH 1010 + MATH 1020,Calculus I + Calculus II,,,,Ivy Tech Community College
Columbus,IN,Ivy Tech Community College-Columbus,MAT 218 + MAT 219,Calculus With Analytic Geometry I + Calculus With Analytic Geometry II,MATH 1010 + MATH 1020,Calculus I + Calculus II,,,,Ivy Tech Community College
Muncie,IN,Ivy Tech Community College-East Central,MAT 218 + MAT 219,Calculus With Analytic Geometry I + Calculus With Analytic Geometry II,MATH 1010 + MATH 1020,Calculus I + Calculus II,,,,Ivy Tech Community College
Noblesville,IN,Ivy Tech Community College-Hamilton County,MAT 218 + MAT 219,Calculus With Analytic Geometry I + Calculus With Analytic Geometry II,MATH 1010 + MATH 1020,Calculus I + Calculus II,,,,Ivy Tech Community College
Indianapolis,IN,Ivy Tech Community College-Indianapolis,MAT 218 + MAT 219,Calculus With Analytic Geometry I + Calculus With Analytic Geometry II,MATH 1010 + MATH 1020,Calculus I + Calculus II,,,,Ivy Tech Community College
Kokomo,IN,Ivy Tech Community College-Kokomo,MAT 218 + MAT 219,Calculus With Analytic Geometry I + Calculus With Analytic Geometry II,MATH 1010 + MATH 1020,Calculus I + Calculus II,,,,Ivy Tech Community College
Lafayette,IN,Ivy Tech Community College-Lafayette,MAT 218 + MAT 219,Calculus With Analytic Geometry I + Calculus With Analytic Geometry II,MATH 1010 + MATH 1020,Calculus I + Calculus II,,,,Ivy Tech Community College
Lawrenceburg,IN,Ivy Tech Community College-Lawrenceburg,MAT 218 + MAT 219,Calculus With Analytic Geometry I + Calculus With Analytic Geometry II,MATH 1010 + MATH 1020,Calculus I + Calculus II,,,,Ivy Tech Community College
Marion,IN,Ivy Tech Community College-Marion,MAT 218 + MAT 219,Calculus With Analytic Geometry I + Calculus With Analytic Geometry II,MATH 1010 + MATH 1020,Calculus I + Calculus II,,,,Ivy Tech Community College
South Bend,IN,Ivy Tech Community College-Northcentral,MAT 218 + MAT 219,Calculus With Analytic Geometry I + Calculus With Analytic Geometry II,MATH 1010 + MATH 1020,Calculus I + Calculus II,,,,Ivy Tech Community College
Fort Wayne,IN,Ivy Tech Community College-Northeast,MAT 218 + MAT 219,Calculus With Analytic Geometry I + Calculus With Analytic Geometry II,MATH 1010 + MATH 1020,Calculus I + Calculus II,,,,Ivy Tech Community College
Gary,IN,Ivy Tech Community College-Northwest,MAT 218 + MAT 219,Calculus With Analytic Geometry I + Calculus With Analytic Geometry II,MATH 1010 + MATH 1020,Calculus I + Calculus II,,,,Ivy Tech Community College
Richmond,IN,Ivy Tech Community College-Richmond,MAT 218 + MAT 219,Calculus With Analytic Geometry I + Calculus With Analytic Geometry II,MATH 1010 + MATH 1020,Calculus I + Calculus II,,,,Ivy Tech Community College
Sellersburg,IN,Ivy Tech Community College-South Central,MAT 218 + MAT 219,Calculus With Analytic Geometry I + Calculus With Analytic Geometry II,MATH 1010 + MATH 1020,Calculus I + Calculus II,,,,Ivy Tech Community College
Madison,IN,Ivy Tech Community College-Southeast,MAT 218 + MAT 219,Calculus With Analytic Geometry I + Calculus With Analytic Geometry II,MATH 1010 + MATH 1020,Calculus I + Calculus II,,,,Ivy Tech Community College
Evansville,IN,Ivy Tech Community College-Southwest,MAT 218 + MAT 219,Calculus With Analytic Geometry I + Calculus With Analytic Geometry II,MATH 1010 + MATH 1020,Calculus I + Calculus II,,,,Ivy Tech Community College
Valparaiso,IN,Ivy Tech Community College-Valparaiso,MAT 218 + MAT 219,Calculus With Analytic Geometry I + Calculus With Analytic Geometry II,MATH 1010 + MATH 1020,Calculus I + Calculus II,,,,Ivy Tech Community College
Terre Haute,IN,Ivy Tech Community College-Wabash Valley,MAT 218 + MAT 219,Calculus With Analytic Geometry I + Calculus With Analytic Geometry II,MATH 1010 + MATH 1020,Calculus I + Calculus II,,,,Ivy Tech Community College
Richmond,VA,J Sargeant Reynolds Community College,MTH 173,Calculus With Analytic Geometry I,MATH 1010,Calculus I,,,,J Sargeant Reynolds Community College
Jamestown,NY,Jamestown Community College,MAT 172 + MAT 2650,Calculus And Analytic Geometry II + Calculus&Analytic Geometry III,MATH 1010 + MATH 1020,Calculus I + Calculus II,,,,Jamestown Community College
Jamestown,NY,Jamestown Community College,MAT 1710,Calculus/Analytic Geometry I,MATH 1010,Calculus I,MATH 1010 (4cr),05/01/2023,05/01/2026,Jamestown Community College
Watertown,NY,Jefferson Community College,MTH 221,Calculus 1,MATH 1010,Calculus I,,,,Jefferson Community College
Union,NJ,Kean University,MATH 2415,Calculus I,MATH 1010,Calculus I,,,,Kean University Undergraduate
Kennesaw,GA,Kennesaw State University,MATH 2253,Calculus I,MATH 1010,Calculus I,,,,Southern Polytechnic State University
Galesburg,IL,Knox College,MATH 152,Calculus II,MATH 1010,Calculus I,,,,Knox College
Parsons,KS,Labette Community College,MATH 130,Calculus I,MATH 1010,Calculus I,,,,Labette Community College
Easton,PA,Lafayette College,MATH 161,Calculus I,MATH 1010,Calculus I,,,,Lafayette College
Laconia,NH,Lakes Region Community College,MATH270L,Calculus I,MATH 1010,Calculus I,MATH 1010 (4cr),05/01/2023,05/01/2026,Lakes Region Community College
Putney,VT,Landmark College,MAT2732,Calculus I,MATH 1010,Calculus I,,,,Landmark College
Middletown,VA,Laurel Ridge Community College,MTH 173,Calculus With Analytic Geometry I,MATH 1010,Calculus I,,,,Lord Fairfax Community College
Syracuse,NY,Le Moyne College,MTH 145,Calculus I,MATH 1010,Calculus I,,,,Le Moyne College
Schnecksville,PA,Lehigh Carbon Community College,MAT 190 + MAT 195 + MAT 200 + MAT 205,Calculus And Analytic Geometry I + Calculus And Analytic Geometry II + Calculus And Analytic Geometry III + Calculus And Analytic Geometry IV,MATH 1010 + MATH 1020 + MATH 2011,Calculus I + Calculus II + Multivariable Calculus,,,,Lehigh Carbon Community College
Bethlehem,PA,Lehigh University,MATH 021,Calculus I,MATH 1010,Calculus I,,,,Lehigh University
Brookville,NY,Liu Post,MTH 7,Calculus And Analytic Geometry I,MATH 1010,Calculus I,,,,LIU Post Undergraduate
Long Beach,CA,Long Beach City College,MATH 60,First Calculus Course,MATH 1010,Calculus I,MATH 1010 (4 cr),05/01/2023,05/01/2026,Long Beach City College
Los Angeles,CA,Los Angeles City College,MATH 261,Calculus I,MATH 1010,Calculus I,MATH 1010 (4cr),05/01/2023,05/01/2026,Los Angeles City College
Sylmar,CA,Los Angeles Mission College,MATH 265,Calculus With Analytic Geometry I,MATH 1010,Calculus I,,,,Los Angeles Mission College
Los Angeles,CA,Loyola Marymount University,MATH 131,Calculus I,MATH 1010,Calculus I,,,,Loyola Marymount University
Nanticoke,PA,Luzerne County Community College,MAT 151 + MAT 251,Analytic Geometry And Calculus I + Analytic Geometry And Calculus II,MATH 1010,Calculus I,,,,Luzerne County Community College
Manchester,NH,Manchester Community College,MATH204,Calculus I,MATH 1010,Calculus I,,,,Manchester Community College
Purchase,NY,Manhattanville College,MATH 1030,Calculus I,MATH 1010,Calculus I,,,,Manhattanville College Undergraduate
Tempe,AZ,Maricopa Community College District,MAT 220,Calculus With Analytic Geometry I,MATH 1010,Calculus I,MATH 1010 (4cr),05/01/2023,05/01/2026,Maricopa County Community College District Course Descriptions
Tempe,AZ,Maricopa Community College District,MAT 221,Calculus With Analytic Geometry I,MATH 1010,Calculus I,MATH 1010 (4cr),05/01/2023,05/01/2026,Maricopa County Community College District Course Descriptions
Poughkeepsie,NY,Marist College,MATH 241,Calculus I,MATH 1010,Calculus I,,,,Marist College Undergraduate Programs
Marlboro,VT,Marlboro College,NSC31,Calculus II,MATH 1010,Calculus I,,,,Marlboro College Spring Course Descriptions
Milwaukee,WI,Marquette University,MATH 80,Calculus 1,MATH 1010,Calculus I,,,,Marquette University Undergraduate
Rancho Palos Verdes,CA,Marymount California University,MTH 130,Calculus I,MATH 1010,Calculus I,,,,Marymount California University
Lucerne,CA,Marymount California University - Lakeside Campus,MTH 130,Calculus I,MATH 1010,Calculus I,,,,Marymount California University
San Pedro,CA,Marymount California University - Waterfront Campus,MTH 130,Calculus I,MATH 1010,Calculus I,,,,Marymount California University
Brockton,MA,Massasoit Community College,MATH-221,Calculus I,MATH 1010,Calculus I,,,,Massasoit Community College
Montreal,QC,Mcgill University,MATH 150,Calculus A,MATH 1010,Calculus I,,,,Mcgill University Course Descriptions
Waco,TX,Mclennan Community College,MATH 2413,Calculus I,MATH 1010,Calculus I,,,,McLennan Community College Course Descriptions
West Windsor,NJ,Mercer County Community College,MAT 151,Calculus I For The Mathematical And Physical Sciences,MATH 1010,Calculus I,,,,Mercer County Community College
Macon,GA,Mercer University,MAT 191,Calculus I,MATH 1010,Calculus I,,,,Mercer University Macon
Oakland,CA,Merritt College,MATH 3A,Calculus I,MATH 1010,Calculus I,,,,Merritt College
Mesa,AZ,Mesa Community College,MAT 220,Calculus With Analytic Geometry I,MATH 1010,Calculus I,MATH 1010 (4cr),05/01/2023,05/01/2026,Maricopa County Community College District Course Descriptions
Mesa,AZ,Mesa Community College,MAT 221,Calculus With Analytic Geometry I,MATH 1010,Calculus I,MATH 1010 (4cr),05/01/2023,05/01/2026,Maricopa County Community College District Course Descriptions
Miami,FL,Miami Dade College,MAC2311,Calculus And Analytical Geometry 1,MATH 1010,Calculus I,,,,Miami Dade College
Hamilton,OH,Miami University-Hamilton,MTH 151,Calculus I,MATH 1010,Calculus I,,,,Miami University
Middletown,OH,Miami University-Middletown,MTH 151,Calculus I,MATH 1010,Calculus I,,,,Miami University
Oxford,OH,Miami University-Oxford,MTH 151,Calculus I,MATH 1010,Calculus I,,,,Miami University
East Lansing,MI,Michigan State University,MTH 132,Calculus I,MATH 1010,Calculus I,,,,Michigan State University Course Descriptions
Bedford,MA,Middlesex Community College,MAT 290,Calculus I For Engineering And Science,MATH 1010,Calculus I,,,,Middlesex Community College
Milwaukee,WI,Milwaukee School Of Engineering,MA 136,Calculus I,MATH 1010,Calculus I,MATH 1010 (4 cr),05/01/2023,05/01/2026,Milwaukee School Of Engineering Undergraduate
Oceanside,CA,Miracosta College,MATH 150,Calculus And Analytic Geometry I,MATH 1010,Calculus I,,,,MiraCosta College
Santa Clara,CA,Mission College,MAT 003A,Analytic Geometry And Calculus I,MATH 1010,Calculus I,,,,Mission College
Rolla,MO,Missouri University Of Science And Technology,MATH 8,Calculus With Analytic Geometry I,MATH 1010,Calculus I,,,,Missouri University Of Science And Technology Undergraduate
Utica,NY,Mohawk Valley Community College-Utica Branch,MA151,Calculus 1,MATH 1010,Calculus I,MATH 1010 (4 cr),01/01/2024,01/01/2027,Mohawk Valley Community College
Utica,NY,Mohawk Valley Community College-Utica Branch,MA151 + MA152 + MA253 + MA280,Calculus 1 + Calculus 2 + Calculus 3 + Linear Algebra,MATH 1010 + MATH 1020 + MATH 2010,Calculus I + Calculus II + Multivariable Calculus And Matrix Algebra,,,,Mohawk Valley Community College
Rockville Centre,NY,Molloy University,MAT 2210,Calculus I,MATH 1010,Calculus I,,,,Molloy University
Rochester,NY,Monroe Community College,MTH 210,Calculus I,MATH 1010,Calculus I,MATH 1010 (4 cr),01/01/2024,01/01/2027,Monroe Community College
Butte,MT,Montana Technological University,MATH 1516,Calculus I With Algebra Enhancement,MATH 1010,Calculus I,,,,Montana Tech Of The University Of Montana
Rockville,MD,Montgomery College,MA 181,Calculus I,MATH 1010,Calculus I,,,,Montgomery College
Rockville,MD,Montgomery College,MATH 181,Calculus I,MATH 1010,Calculus I,,,,Montgomery College
Moorpark,CA,Moorpark College,MATH M25A,Calculus With Analytic Geometry I,MATH 1010,Calculus I,MATH 1010 (4cr),05/01/2023,05/01/2026,Moorpark College Course Descriptions
Atlanta,GA,Morehouse College,HMTH 161,Calculus I,MATH 1010,Calculus I,,,,Morehouse College Course Descriptions
Morrisville,NY,Morrisville State College,MATH 161,Calculus I,MATH 1010,Calculus I,,,,SUNY Morrisville State College
Cresson,PA,Mount Aloysius College,CM 117,Calculus I,MATH 1010,Calculus I,,,,Mount Aloysius College
Gardner,MA,Mount Wachusett Community College,MAT 211,Calculus I,MATH 1010,Calculus I,,,,Mount Wachusett Community College
Gresham,OR,Mt Hood Community College,MTH251 + MTH252,Calculus I: Differential Calculus + Calculus II: Integral Calculus,MATH 1010,Calculus I,,,,Mount Hood Community College
Walnut,CA,Mt. San Antonio College,MATH 180,Calculus And Analytic Geometry,MATH 1010,Calculus I,,,,Mount San Antonio College
Nashville,TN,Nashville State Community College,MATH 1910,Calculus I,MATH 1010,Calculus I,,,,Nashville State Community College
Garden City,NY,Nassau Community College,MAT 122,Calculus I,MATH 1010,Calculus I,,,,Nassau Community College
Rochester,NY,Nazareth University,MTH.Q 113,Calculus I,MATH 1010,Calculus I,,,,Nazareth College Undergraduate
Henniker,NH,New England College,MT 2510,Calculus I,MATH 1010,Calculus I,,,,New England College Residential Undergraduate
Newark,NJ,New Jersey Institute Of Technology,MATH 111,Calculus I,MATH 1010,Calculus I,,,,New Jersey Institute Of Technology Undergraduate
Newark,NJ,New Jersey Institute Of Technology,MATH 131,Calculus A,MATH 1010,Calculus I,,,,New Jersey Institute Of Technology Undergraduate
Socorro,NM,New Mexico Institute Of Mining And Technology,MATH 131,Calculus And Analytic Geometry I,MATH 1010,Calculus I,,,,New Mexico Tech
Roswell,NM,New Mexico Military Institute,MATH 1614,Calculus I,MATH 1010,Calculus I,,,,New Mexico Military Institute
New York,NY,New York Institute Of Technology-Manhattan Campus,MATH 170,Calculus I,MATH 1010,Calculus I,,,,New York Institute Of Technology NYIT
Old Westbury,NY,New York Institute Of Technology-Old Westbury,MATH 170,Calculus I,MATH 1010,Calculus I,,,,New York Institute Of Technology NYIT
Alfred Station,NY,New York State College Of Ceramics At Alfred University,MATH 151,Calculus I,MATH 1010,Calculus I,MATH 1010 (4 cr),05/01/2023,05/01/2026,Alfred University
New York,NY,New York University,MA-UY 1324,Integrated Calculus I For Engineers,MATH 1010,Calculus I,,,,New York University Tandon School Of Engineering
New York,NY,New York University,MATH-UA 121,Calculus I,MATH 1010,Calculus I,,,,New York University College Of Arts And Sciences
New York,NY,New York University,V63.0021,Calculus I,MATH 1010,Calculus I,,,,New York University College Of Arts And Sciences
New York,NY,New York University,V63.0121,Calculus I,MATH 1010,Calculus I,,,,New York University College Of Arts And Sciences
New York,NY,New York University,V63.0122,Calculus II,MATH 1010,Calculus I,,,,New York University College Of Arts And Sciences
Concord,NH,Nhti-Concord's Community College,MATH 205C,Calculus I,MATH 1010,Calculus I,MATH 1010 (4cr),05/01/2023,05/01/2026,NHTI Concord'S Community College
Norfolk,VA,Norfolk State University,MTH 184H,Honors Calclulus I,MATH 1010,Calculus I,,,,Norfolk State University Undergraduate
Raleigh,NC,North Carolina State University At Raleigh,MA 141,Calculus I,MATH 1010,Calculus I,,,,North Carolina State University Undergraduate
Saranac Lake,NY,North Country Community College,MAT 240,Calculus I,MATH 1010,Calculus I,,,,North Country Community College
Seattle,WA,North Seattle College,MATH& 151,Calculus I,MATH 1010,Calculus I,,,,Seattle Colleges
Danvers,MA,North Shore Community College,MAT251,Calculus 1,MATH 1010,Calculus I,MATH 1010 (4 cr),01/01/2024,01/01/2027,North Shore Community College
Danvers,MA,North Shore Community College,MAT251 + MAT252,Calculus 1 + Calculus 2,MATH 1010,Calculus I,,,,North Shore Community College
Bethlehem,PA,Northampton County Area Community College,MATH 180,Calculus I,MATH 1010,Calculus I,,,,Northampton Community College
Tannersville,PA,Northampton County Area Community College-Monroe,MATH 180,Calculus I,MATH 1010,Calculus I,,,,Northampton Community College
Boston,MA,Northeastern University,MATH 1251,Calculus And Differential Equations For Biology 1,MATH 1010,Calculus I,,,,Northeastern University Course Descriptions
Boston,MA,Northeastern University,MATH 1341,Calculus 1 For Science And Engineering,MATH 1010,Calculus I,,,,Northeastern University Course Descriptions
Boston,MA,Northeastern University,MATM 1341,Calculus 1 For Science And Engineering,MATH 1010,Calculus I,,,,Northeastern University Course Descriptions
Boston,MA,Northeastern University,MTH 1123,Calculus For Engineering Majors 1,MATH 1010,Calculus I,,,,Northeastern University Undergraduate
Boston,MA,Northeastern University,MTH 1193,Calculus 1,MATH 1010,Calculus I,,,,Northeastern University Undergraduate
Boston,MA,Northeastern University,MTH 1723,Honors Program,MATH 1010,Calculus I,,,,Northeastern University Undergraduate
Boston,MA,Northeastern University Lifelong Learning Network,MATH 1251,Calculus And Differential Equations For Biology 1,MATH 1010,Calculus I,,,,Northeastern University Course Descriptions
Boston,MA,Northeastern University Lifelong Learning Network,MATH 1341,Calculus 1 For Science And Engineering,MATH 1010,Calculus I,,,,Northeastern University Course Descriptions
Boston,MA,Northeastern University Lifelong Learning Network,MATM 1341,Calculus 1 For Science And Engineering,MATH 1010,Calculus I,,,,Northeastern University Course Descriptions
Boston,MA,Northeastern University Lifelong Learning Network,MTH 1123,Calculus For Engineering Majors 1,MATH 1010,Calculus I,,,,Northeastern University Undergraduate
Boston,MA,Northeastern University Lifelong Learning Network,MTH 1193,Calculus 1,MATH 1010,Calculus I,,,,Northeastern University Undergraduate
Boston,MA,Northeastern University Lifelong Learning Network,MTH 1723,Honors Program,MATH 1010,Calculus I,,,,Northeastern University Undergraduate
Oakland,CA,Northeastern University Oakland,MATH 1251,Calculus And Differential Equations For Biology 1,MATH 1010,Calculus I,,,,Northeastern University Course Descriptions
Oakland,CA,Northeastern University Oakland,MATH 1341,Calculus 1 For Science And Engineering,MATH 1010,Calculus I,,,,Northeastern University Course Descriptions
Oakland,CA,Northeastern University Oakland,MATM 1341,Calculus 1 For Science And Engineering,MATH 1010,Calculus I,,,,Northeastern University Course Descriptions
Flagstaff,AZ,Northern Arizona University,MAT 136,Calculus I,MATH 1010,Calculus I,,,,Northern Arizona University Undergraduate And Graduate Course Descriptions
Haverhill,MA,Northern Essex Community College,MAT251,Calculus I,MATH 1010,Calculus I,MATH 1010 (4 cr),01/01/2024,01/01/2027,Northern Essex Community College
Haverhill,MA,Northern Essex Community College,MAT251 + MAT252 + MAT253,Calculus I + Calculus II + Calculus III,MATH 1010 + MATH 1020 + MATH 2011,Calculus I + Calculus II + Multivariable Calculus,,,,Northern Essex Community College
Annandale,VA,Northern Virginia Community College,MTH 263,Calculus I,MATH 1010,Calculus I,MATH 1010 (4cr),05/01/2023,05/01/2026,Northern Virginia Community College
Maryville,MO,Northwest Missouri State University,MATH 17120,Calculus I,MATH 1010,Calculus I,,,,Northwest Missouri State University Undergraduate
Evanston,IL,Northwestern University,MATH 220-0 + MATH 224-0 + MATH 230-1 + MATH 230-2,Differential Calculus Of One-Variable Functions + Integral Calculus Of One-Variable Functions + Multivariable Differential Calculus + Multivariable Integral Calculus,MATH 1010 + MATH 1020 + MATH 2011,Calculus I + Calculus II + Multivariable Calculus,,,,Northwestern University Undergraduate
Northfield,VT,Norwich University,MA 121,Calculus I,MATH 1010,Calculus I,,,,Norwich University Course Descriptions
Bloomfield Hills,MI,Oakland Community College,MAT 1730,Calculus I,MATH 1010,Calculus I,,,,Oakland Community College
Des Plaines,IL,Oakton College,MAT 250,Calculus I,MATH 1010,Calculus I,,,,Oakton Community College
Oberlin,OH,Oberlin College,MATH 133,"Calculus I: Limits, Continuity, Differentiation, Integration And Applications",MATH 1010,Calculus I,,,,Oberlin College
Toms River,NJ,Ocean County College,MATH 265,Calculus I,MATH 1010,Calculus I,,,,Ocean County College
Columbus,OH,Ohio State University,MATH 152,Calculus And Analytic Geometry II,MATH 1010,Calculus I,,,,Ohio State University Course Offerings
Wooster,OH,Ohio State University Agricultural Technical Inst,MATH 152,Calculus And Analytic Geometry II,MATH 1010,Calculus I,,,,Ohio State University Course Offerings
Lima,OH,Ohio State University-Lima Campus,MATH 152,Calculus And Analytic Geometry II,MATH 1010,Calculus I,,,,Ohio State University Course Offerings
Mansfield,OH,Ohio State University-Mansfield Campus,MATH 152,Calculus And Analytic Geometry II,MATH 1010,Calculus I,,,,Ohio State University Course Offerings
Marion,OH,Ohio State University-Marion Campus,MATH 152,Calculus And Analytic Geometry II,MATH 1010,Calculus I,,,,Ohio State University Course Offerings
Newark,OH,Ohio State University-Newark Campus,MATH 152,Calculus And Analytic Geometry II,MATH 1010,Calculus I,,,,Ohio State University Course Offerings
