City,State,Institution,Transfer Course ID,Transfer Course Name,RPI Course ID,RPI Course Name,Note,Begin,End,Transfer Catalog
Adrian,MI,Adrian College,PHIL105,Logic,PHIL 1000,Philosophy Elective,,,,Adrian College Undergraduate
Worcester,MA,Assumption University,PHI 100,Socrates And The Search For Truth,PHIL 1000,Philosophy Elective,PHIL 1000 (3 cr),05/01/2023,05/01/2026,Assumption University
Worcester,MA,Assumption University,PHI 154,God And The Philosophers,PHIL 1000,Philosophy Elective,PHIL 1000 (3 cr),05/01/2023,05/01/2026,Assumption University
Waltham,MA,Bentley University,PH 101,Problems Of Philosophy,PHIL 1000,Philosophy Elective,,,,Bentley University Undergraduate
Paramus,NJ,Bergen Community College,PHR-102,Contemporary Moral Issues,PHIL 1000,Philosophy Elective,,,,Bergen Community College
Pittsfield,MA,Berkshire Community College,PHL 101,Philosophy & Self-Identity,PHIL 1000,Philosophy Elective,,,,Berkshire Community College
Chestnut Hill,MA,Boston College,PHIL1071,Philosophy Of The Person II,PHIL 1000,Philosophy Elective,,,,Boston College
Chestnut Hill,MA,Boston College,PL 005,Introduction To Basic Problems In Philosophy,PHIL 1000,Philosophy Elective,,,,Boston College
Chestnut Hill,MA,Boston College,THEO1401,Engaging Catholicism,PHIL 1000,Philosophy Elective,,,,Boston College
Chestnut Hill,MA,Boston College,PHIL1071 + THEO1401,Philosophy Of The Person II + Engaging Catholicism,PHIL 1000,Philosophy Elective,,,,Boston College
Lewisburg,PA,Bucknell University,PHIL 100,Introduction To Philosophy,PHIL 1000,Philosophy Elective,,,,Bucknell University
San Luis Obispo,CA,California Polytechnic State University-San Luis Obispo,PHIL 126,Logic And Argumentative Writing,PHIL 1000,Philosophy Elective,PHIL 1000 (4cr),05/01/2023,05/01/2026,California Polytechnic State University San Luis Obispo
Buffalo,NY,Canisius College,FYS 101,Explorations Of Academic Writing And Special Topics,PHIL 1000,Philosophy Elective,,,,Canisius College Undergraduate
Washington,DC,Catholic University Of America,PHIL 201,The Classical Mind: The Origin And Growth Of Western Philosophy,PHIL 1000,Philosophy Elective,,,,Catholic University Of America Course Descriptions
Washington,DC,Catholic University Of America,PHIL 202,The Modern Mind: Philosophy From Descartes To The Present,PHIL 1000,Philosophy Elective,,,,Catholic University Of America Course Descriptions
Mcpherson,KS,Central Christian College Of Kansas,MT-BI 100,Introduction To Biblical Literature,PHIL 1000,Philosophy Elective,,,,Central Christian College Of Kansas
Chandler,AZ,Chandler-Gilbert Community College,PHI 105,Introduction To Ethics,PHIL 1000,Philosophy Elective,PHIL 1000 (3 cr),05/01/2023,05/01/2026,Maricopa County Community College District Course Descriptions
Atlanta,GA,Clark Atlanta University,CPHI 105,Critical Thinking,PHIL 1000,Philosophy Elective,,,,Clark Atlanta University Undergraduate
Worcester,MA,Clark University,PHIL 050,Relativism & Absolutism Across The Disciplines,PHIL 1000,Philosophy Elective,,,,Clark University
Worcester,MA,Clark University,PHIL 105,Personal Values,PHIL 1000,Philosophy Elective,,,,Clark University
Astoria,OR,Clatsop Community College,PHL 103,Critical Reasoning,PHIL 1000,Philosophy Elective,,,,Clatsop Community College
Fountain Valley,CA,Coastline Community College,PHIL 120,From Ethics To Making Moral Choices,PHIL 1000,Philosophy Elective,,,,Coastline Community College
Waterville,ME,Colby College,PL114,Central Philosophical Issues: Nature And God,PHIL 1000,Philosophy Elective,,,,Colby College
Wooster,OH,College Of Wooster,PHIL 10000,"Ethics, Justice, And Society",PHIL 1000,Philosophy Elective,,,,College Of Wooster
Wooster,OH,College Of Wooster,PHIL 25000,Ancient Philosophy: Plato & Aristotle,PHIL 1000,Philosophy Elective,,,,College Of Wooster
Bridgeport,CT,Connecticut State Community College Housatonic Campus,PHL* E151,World Religions,PHIL 1000,Philosophy Elective,,,,Housatonic Community College
Waterbury,CT,Connecticut State Community College Naugatuck Campus,PHL* H111,Ethics,PHIL 1000,Philosophy Elective,,,,Naugatuck Valley Community College
Ithaca,NY,Cornell University-Endowed Colleges,PHIL 100,Freshman Writing Seminars In Philosophy,PHIL 1000,Philosophy Elective,,,,Cornell University
Randolph,NJ,County College Of Morris,PHL-115,Logic,PHIL 1000,Philosophy Elective,,,,County College Of Morris
New York,NY,Cuny Bernard M Baruch College,PHI 1500,Major Issues In Philosophy,PHIL 1000,Philosophy Elective,PHIL 1000 (3 cr),01/01/2024,01/01/2027,CUNY Baruch College Undergraduate
New York,NY,Cuny Bernard M Baruch College,PHI 1600,Logic And Moral Reasoning,PHIL 1000,Philosophy Elective,PHIL 1000 (3 cr),05/01/2023,05/01/2026,CUNY Baruch College Undergraduate
Long Island City,NY,Cuny Laguardia Community College,HUP112,Logic And Philosophy,PHIL 1000,Philosophy Elective,,,,CUNY LaGuardia Community College
Queens,NY,Cuny Queens College,PHIL 109,Modern Logic,PHIL 1000,Philosophy Elective,,,,CUNY Queens College Undergraduate
Queens,NY,Cuny Queens College,PHIL 116,Introduction To Philosophy Of Religion,PHIL 1000,Philosophy Elective,,,,CUNY Queens College Undergraduate
Poughkeepsie,NY,Dutchess Community College,PHI107,Introduction To The Art Of Reasoning,PHIL 1000,Philosophy Elective,,,,Dutchess Community College
Bangor,ME,Eastern Maine Community College,PHI 101,Ethics,PHIL 1000,Philosophy Elective,,,,Eastern Maine Community College
Saint Petersburg,FL,Eckerd College,FD 181,Human Experience,PHIL 1000,Philosophy Elective,PHIL 1000 (3 cr),01/01/2024,01/01/2027,Eckerd College
Buffalo,NY,Erie Community College,PY 102,Logic,PHIL 1000,Philosophy Elective,,,,Erie Community College
Avondale,AZ,Estrella Mountain Community College,PHI 105,Introduction To Ethics,PHIL 1000,Philosophy Elective,PHIL 1000 (3 cr),05/01/2023,05/01/2026,Maricopa County Community College District Course Descriptions
Fairfield,CT,Fairfield University,PH 10,Questions In Ancient And Medieval Philosophy,PHIL 1000,Philosophy Elective,,,,Fairfield University Undergraduate
Bronx,NY,Fordham University,PHIL 1000,Philosophy Of Human Nature,PHIL 1000,Philosophy Elective,PHIL 1000 (3cr),09/01/2023,09/01/2026,Fordham University
Bronx,NY,Fordham University,THEO 1000,Faith And Critical Reason,PHIL 1000,Philosophy Elective,PHIL 1000 (3cr),09/01/2023,09/01/2026,Fordham University
Lancaster,PA,Franklin And Marshall College,PHI 122,Introduction To Moral Philosophy,PHIL 1000,Philosophy Elective,,,,Franklin And Marshall College
Fresno,CA,Fresno City College,PHIL 1D,World Religions,PHIL 1000,Philosophy Elective,,,,Fresno City College
Phoenix,AZ,Gateway Community College,PHI 105,Introduction To Ethics,PHIL 1000,Philosophy Elective,PHIL 1000 (3 cr),05/01/2023,05/01/2026,Maricopa County Community College District Course Descriptions
Glendale,AZ,Glendale Community College,PHI 105,Introduction To Ethics,PHIL 1000,Philosophy Elective,PHIL 1000 (3 cr),05/01/2023,05/01/2026,Maricopa County Community College District Course Descriptions
Greenfield,MA,Greenfield Community College,PHI 104,Introduction To Ethics,PHIL 1000,Philosophy Elective,,,,Greenfield Community College
Gwynedd Valley,PA,Gwynedd Mercy College,RS-115,World Religions,PHIL 1000,Philosophy Elective,,,,Gwynedd Mercy University Undergraduate
Bel Air,MD,Harford Community College,PHIL 205,Ethics,PHIL 1000,Philosophy Elective,,,,Harford Community College
Troy,NY,Hudson Valley Community College,PHIL 101,Intro To Philosophy II,PHIL 1000,Philosophy Elective,,,,Hudson Valley Community College
Troy,NY,Hudson Valley Community College,PHIL 110,Comparative Religion,PHIL 1000,Philosophy Elective,PHIL 110 from HVCC will transfer to RPI at 3 credits.,02/09/2024,01/01/2027,Hudson Valley Community College
Ithaca,NY,Ithaca College,PHIL 22300,Introduction To The Philosophy Of Art,PHIL 1000,Philosophy Elective,,,,Ithaca College
Gambier,OH,Kenyon College,PHIL 110,Introduction To Ethics,PHIL 1000,Philosophy Elective,,,,Kenyon College
Keuka Park,NY,Keuka College,PHL 115,Ethics,PHIL 1000,Philosophy Elective,,,,Keuka College Record
Syracuse,NY,Le Moyne College,PHL 101,Phil Foundations Of Western,PHIL 1000,Philosophy Elective,,,,Le Moyne College
Riverdale,NY,Manhattan College,PHIL 152,Roots Of Modern Age: Philosophy - Fys,PHIL 1000,Philosophy Elective,,,,Manhattan College Undergraduate
Tempe,AZ,Maricopa Community College District,PHI 105,Introduction To Ethics,PHIL 1000,Philosophy Elective,PHIL 1000 (3 cr),05/01/2023,05/01/2026,Maricopa County Community College District Course Descriptions
West Windsor,NJ,Mercer County Community College,PHI 102,Introduction To Philosophy,PHIL 1000,Philosophy Elective,PHIL 1000 (3 cr),05/01/2023,05/01/2026,Mercer County Community College
Erie,PA,Mercyhurst University,CST 290,Catholic Spirituality,PHIL 1000,Philosophy Elective,,,,Mercyhurst University Undergraduate
North East,PA,Mercyhurst University-North East Campus,CST 290,Catholic Spirituality,PHIL 1000,Philosophy Elective,,,,Mercyhurst University Undergraduate
North Andover,MA,Merrimack College,PHL 1200,Philosophy Through Film,PHIL 1000,Philosophy Elective,,,,Merrimack College Undergraduate
Mesa,AZ,Mesa Community College,PHI 105,Introduction To Ethics,PHIL 1000,Philosophy Elective,PHIL 1000 (3 cr),05/01/2023,05/01/2026,Maricopa County Community College District Course Descriptions
Bedford,MA,Middlesex Community College,ETH 101,Ethics And Society,PHIL 1000,Philosophy Elective,,,,Middlesex Community College
Utica,NY,Mohawk Valley Community College-Utica Branch,ED150,Social & Philosophical Foundations Of Education,PHIL 1000,Philosophy Elective,,,,Mohawk Valley Community College
Montclair,NJ,Montclair State University,RELG 101,Understanding Religion,PHIL 1000,Philosophy Elective,,,,Montclair State University
Napa,CA,Napa Valley College,PHIL-125,Introduction To Ethics,PHIL 1000,Philosophy Elective,,,,Napa Valley College
Garden City,NY,Nassau Community College,PHI 104,Ancient And Medieval Philosophy,PHIL 1000,Philosophy Elective,,,,Nassau Community College
Rochester,NY,Nazareth University,PHL.Q 101,Philosophical Inquiry,PHIL 1000,Philosophy Elective,,,,Nazareth College Undergraduate
New York,NY,New York Institute Of Technology-Manhattan Campus,PHIL 110,Problems Of Philosophy,PHIL 1000,Philosophy Elective,,,,New York Institute Of Technology NYIT
Old Westbury,NY,New York Institute Of Technology-Old Westbury,PHIL 110,Problems Of Philosophy,PHIL 1000,Philosophy Elective,,,,New York Institute Of Technology NYIT
Haverhill,MA,Northern Essex Community College,PHI102,Issues In Philosophy,PHIL 1000,Philosophy Elective,,,,Northern Essex Community College
Haverhill,MA,Northern Essex Community College,PHI110,Ethics,PHIL 1000,Philosophy Elective,,,,Northern Essex Community College
Haverhill,MA,Northern Essex Community College,PHI121,Practical Logic,PHIL 1000,Philosophy Elective,,,,Northern Essex Community College
Haverhill,MA,Northern Essex Community College,REL101,World Religions,PHIL 1000,Philosophy Elective,,,,Northern Essex Community College
Oberlin,OH,Oberlin College,PHIL 122,The Nature Of Value,PHIL 1000,Philosophy Elective,,,,Oberlin College
Oberlin,OH,Oberlin College,PHIL 126,Problems Of Philosophy,PHIL 1000,Philosophy Elective,PHIL 1000 (4cr),05/01/2023,05/01/2026,Oberlin College
Chillicothe,OH,Ohio University-Chillicothe Branch,PHIL 101,Fundamentals Of Philosophy,PHIL 1000,Philosophy Elective,,,,Ohio University Undergraduate
Chillicothe,OH,Ohio University-Chillicothe Branch,PHIL 120,Principles Of Reasoning,PHIL 1000,Philosophy Elective,,,,Ohio University Undergraduate
Saint Clairsville,OH,Ohio University-Eastern Campus,PHIL 101,Fundamentals Of Philosophy,PHIL 1000,Philosophy Elective,,,,Ohio University Undergraduate
Saint Clairsville,OH,Ohio University-Eastern Campus,PHIL 120,Principles Of Reasoning,PHIL 1000,Philosophy Elective,,,,Ohio University Undergraduate
Lancaster,OH,Ohio University-Lancaster Branch,PHIL 101,Fundamentals Of Philosophy,PHIL 1000,Philosophy Elective,,,,Ohio University Undergraduate
Lancaster,OH,Ohio University-Lancaster Branch,PHIL 120,Principles Of Reasoning,PHIL 1000,Philosophy Elective,,,,Ohio University Undergraduate
Athens,OH,Ohio University-Main Campus,PHIL 101,Fundamentals Of Philosophy,PHIL 1000,Philosophy Elective,,,,Ohio University Undergraduate
Athens,OH,Ohio University-Main Campus,PHIL 120,Principles Of Reasoning,PHIL 1000,Philosophy Elective,,,,Ohio University Undergraduate
Ironton,OH,Ohio University-Southern Campus,PHIL 101,Fundamentals Of Philosophy,PHIL 1000,Philosophy Elective,,,,Ohio University Undergraduate
Ironton,OH,Ohio University-Southern Campus,PHIL 120,Principles Of Reasoning,PHIL 1000,Philosophy Elective,,,,Ohio University Undergraduate
Zanesville,OH,Ohio University-Zanesville Branch,PHIL 101,Fundamentals Of Philosophy,PHIL 1000,Philosophy Elective,,,,Ohio University Undergraduate
Zanesville,OH,Ohio University-Zanesville Branch,PHIL 120,Principles Of Reasoning,PHIL 1000,Philosophy Elective,,,,Ohio University Undergraduate
Stillwater,OK,Oklahoma State University-Main Campus,PHIL 1213,Philosophies Of Life,PHIL 1000,Philosophy Elective,,,,Oklahoma State University
Syracuse,NY,Onondaga Community College,PHI 108,Ethics,PHIL 1000,Philosophy Elective,,,,Onondaga Community College
New York,NY,Pace University-New York,PHI 115,Normative Ethics: Contemporary Moral Problems,PHIL 1000,Philosophy Elective,,,,Pace University Course Descriptions
Pleasantville,NY,Pace University-Pleasantville Briarcliff,PHI 115,Normative Ethics: Contemporary Moral Problems,PHIL 1000,Philosophy Elective,,,,Pace University Course Descriptions
White Plains,NY,Pace University-White Plains,PHI 115,Normative Ethics: Contemporary Moral Problems,PHIL 1000,Philosophy Elective,,,,Pace University Course Descriptions
Phoenix,AZ,Paradise Valley Community College,PHI 105,Introduction To Ethics,PHIL 1000,Philosophy Elective,PHIL 1000 (3 cr),05/01/2023,05/01/2026,Maricopa County Community College District Course Descriptions
Phoenix,AZ,Phoenix College,PHI 105,Introduction To Ethics,PHIL 1000,Philosophy Elective,PHIL 1000 (3 cr),05/01/2023,05/01/2026,Maricopa County Community College District Course Descriptions
Branchburg,NJ,Raritan Valley Community College,PHIL 103,Introduction To Formal Logic,PHIL 1000,Philosophy Elective,,,,Raritan Valley Community College
Branchburg,NJ,Raritan Valley Community College,PHIL 106,Current Moral And Social Issues,PHIL 1000,Philosophy Elective,,,,Raritan Valley Community College
Branchburg,NJ,Raritan Valley Community College,PHIL 114,Ethics,PHIL 1000,Philosophy Elective,,,,Raritan Valley Community College
Houston,TX,Rice University,PHIL 116,Introduction To The Philosophy Of Law,PHIL 1000,Philosophy Elective,,,,Rice University General Announcements
Tempe,AZ,Rio Salado College,PHI 105,Introduction To Ethics,PHIL 1000,Philosophy Elective,PHIL 1000 (3 cr),05/01/2023,05/01/2026,Maricopa County Community College District Course Descriptions
Riverside,CA,Riverside City College,HUM-10,World Religions,PHIL 1000,Philosophy Elective,,,,Riverside City College
Rochester,NY,Roberts Wesleyan College,BIB 101,Introduction To Old Testament Literature And Theology,PHIL 1000,Philosophy Elective,,,,Roberts Wesleyan College Undergraduate
Rochester,NY,Roberts Wesleyan College,BIB 102,Introduction To New Testament Literature And Theology,PHIL 1000,Philosophy Elective,,,,Roberts Wesleyan College Undergraduate
Rochester,NY,Rochester Institute Of Technology,PHIL-102,Introduction To Moral Issues,PHIL 1000,Philosophy Elective,,,,Rochester Institute Of Technology Undergraduate
Bristol,RI,Roger Williams University,CORE 104,"Literature, Philosophy, And The Examined Life",PHIL 1000,Philosophy Elective,,,,Roger Williams University
Bristol,RI,Roger Williams University School Of Law,CORE 104,"Literature, Philosophy, And The Examined Life",PHIL 1000,Philosophy Elective,,,,Roger Williams University
Troy,NY,Russell Sage College,PHI 107,Religions Of The World,PHIL 1000,Philosophy Elective,,,,Russell Sage College For Women
Fairfield,CT,Sacred Heart University,PH 101,Introduction To Philosophy,PHIL 1000,Philosophy Elective,,,,Sacred Heart University Undergraduate
Fairfield,CT,Sacred Heart University,PH 224,Introduction To Ancient Philosophy,PHIL 1000,Philosophy Elective,,,,Sacred Heart University Undergraduate
Staten Island,NY,Saint John's University - Staten Island Campus,PHI 1000C,Philosophy Of The Human Person,PHIL 1000,Philosophy Elective,,,,St. Johns University
Northfield,MN,Saint Olaf College,PHIL 118,The Making Of The Modern Mind,PHIL 1000,Philosophy Elective,,,,Saint Olaf College
Jersey City,NJ,Saint Peter's University,PL-100 + PL-101,Introduction To Philosophy I + Introduction To Philosophy II,PHIL 1000 + PHIL 1110,Philosophy Elective + Introduction To Philosophy,,,,Saint Peter'S University Undergraduate
San Francisco,CA,San Francisco State University,PHIL 110,Introduction To Critical Thinking I,PHIL 1000,Philosophy Elective,,,,San Francisco State University
Stockton,CA,San Joaquin Delta College,PHILO 050,Asian Philosophy,PHIL 1000,Philosophy Elective,,,,San Joaquin Delta College
French Camp,CA,San Joaquin General Hospital School Of Radiation Technology,PHILO 050,Asian Philosophy,PHIL 1000,Philosophy Elective,,,,San Joaquin Delta College
Santa Clara,CA,Santa Clara University,PHIL 11A,Cultures & Ideas I,PHIL 1000,Philosophy Elective,,,,Santa Clara University Undergraduate
Santa Clara,CA,Santa Clara University,PHIL 12A,Cultures & Ideas II,PHIL 1000,Philosophy Elective,,,,Santa Clara University Undergraduate
Santa Clara,CA,Santa Clara University,SCTR 19,Religions Of The Book,PHIL 1000,Philosophy Elective,,,,Santa Clara University Undergraduate
Santa Monica,CA,Santa Monica College,PHILOS 3,Early Philosophers,PHIL 1000,Philosophy Elective,,,,Santa Monica College
Schenectady,NY,Schenectady County Community College,PHI 141,Survey Of Major Western Philosophers,PHIL 1000,Philosophy Elective,,,,Schenectady County Community College
Schenectady,NY,Schenectady County Community College,PHI 143,Introduction To Philosophical Problems,PHIL 1000,Philosophy Elective,,,,Schenectady County Community College
Schenectady,NY,Schenectady County Community College,REL 121,World Religions,PHIL 1000,Philosophy Elective,,,,Schenectady County Community College
Scottsdale,AZ,Scottsdale Community College,PHI 105,Introduction To Ethics,PHIL 1000,Philosophy Elective,PHIL 1000 (3 cr),05/01/2023,05/01/2026,Maricopa County Community College District Course Descriptions
South Orange,NJ,Seton Hall University,PLTL 1111,History Of Philosophy I,PHIL 1000,Philosophy Elective,,,,Seton Hall University Undergraduate
South Orange,NJ,Seton Hall University,PLTL 1112,History Of Philosophy II,PHIL 1000,Philosophy Elective,,,,Seton Hall University Undergraduate
South Orange,NJ,Seton Hall University,PLTL 1113,History Of Philosophy III,PHIL 1000,Philosophy Elective,,,,Seton Hall University Undergraduate
Loudonville,NY,Siena College,PHIL - 202,Philosophy And Reality,PHIL 1000,Philosophy Elective,,,,Siena College Undergraduate
Loudonville,NY,Siena College,RELG - 181,Experiences Of The Sacred,PHIL 1000,Philosophy Elective,,,,Siena College Undergraduate
Phoenix,AZ,South Mountain Community College,PHI 105,Introduction To Ethics,PHIL 1000,Philosophy Elective,PHIL 1000 (3 cr),05/01/2023,05/01/2026,Maricopa County Community College District Course Descriptions
Carbondale,IL,Southern Illinois University-Carbondale,PHIL103A,World Humanities,PHIL 1000,Philosophy Elective,,,,Southern Illinois University Carbondale Undergraduate
Dallas,TX,Southern Methodist University,PHIL 1318,Contemporary Moral Problems,PHIL 1000,Philosophy Elective,,,,Southern Methodist University Undergraduate
Chula Vista,CA,Southwestern College,PHIL 103,Logic And Critical Thinking,PHIL 1000,Philosophy Elective,,,,Southwestern College
Clearwater,FL,St Petersburg College,PHI 1600,Studies In Applied Ethics,PHIL 1000,Philosophy Elective,,,,St. Petersburg College
Rochester,NY,St. John Fisher University,REST-101C,Intro Study Of Religion,PHIL 1000,Philosophy Elective,,,,Saint John Fisher College Undergraduate
Queens,NY,St. John's University,PHI 1000C,Philosophy Of The Human Person,PHIL 1000,Philosophy Elective,,,,St. Johns University
Hoboken,NJ,Stevens Institute Of Technology,HPL 112,Science And Metaphysics,PHIL 1000,Philosophy Elective,,,,Stevens Institute Of Technology
Easton,MA,Stonehill College,GENP 100,Critical Encounters – Philosophy,PHIL 1000,Philosophy Elective,,,,Stonehill College Hillbook
Easton,MA,Stonehill College,GENR 100,Critical Encounters – Religious Studies,PHIL 1000,Philosophy Elective,,,,Stonehill College Hillbook
Easton,MA,Stonehill College,GR 100,Critical Encounters – Religious Studies,PHIL 1000,Philosophy Elective,,,,Stonehill College Hillbook
Easton,MA,Stonehill College,PHL 100,"Mind, Body, Self, And Science (Core/First-Year Seminar)",PHIL 1000,Philosophy Elective,,,,Stonehill College Hillbook
Stony Brook,NY,Stony Brook University,PHI 100,Concepts Of The Person (II),PHIL 1000,Philosophy Elective,PHIL 1000 (3cr),09/01/2023,09/01/2026,SUNY Stony Brook Undergraduate Bulletin And Course Descriptions Spring
Stony Brook,NY,Stony Brook University,PHI 104,Moral Reasoning (II),PHIL 1000,Philosophy Elective,,,,SUNY Stony Brook Undergraduate Bulletin And Course Descriptions Spring
Stony Brook,NY,Stony Brook University,PHI 105,Politics And Society (II),PHIL 1000,Philosophy Elective,,,,SUNY Stony Brook Undergraduate Bulletin And Course Descriptions Spring
Stony Brook,NY,Stony Brook University,PHI 108,Logical And Critical Reasoning (II),PHIL 1000,Philosophy Elective,,,,SUNY Stony Brook Undergraduate Bulletin And Course Descriptions Spring
Selden,NY,Suffolk County Community College-Ammerman Campus,PHL101,Issues In Philosophy,PHIL 1000,Philosophy Elective,,,,Suffolk County Community College
Selden,NY,Suffolk County Community College-Ammerman Campus,PHL104,Critical Thinking,PHIL 1000,Philosophy Elective,,,,Suffolk County Community College
Selden,NY,Suffolk County Community College-Ammerman Campus,PHL105,Logic,PHIL 1000,Philosophy Elective,,,,Suffolk County Community College
Selden,NY,Suffolk County Community College-Ammerman Campus,PHL107,Ethics,PHIL 1000,Philosophy Elective,,,,Suffolk County Community College
Selden,NY,Suffolk County Community College-Ammerman Campus,PL11,Issues In Philosophy,PHIL 1000,Philosophy Elective,,,,Suffolk County Community College
Selden,NY,Suffolk County Community College-Central Report,PHL101,Issues In Philosophy,PHIL 1000,Philosophy Elective,,,,Suffolk County Community College
Selden,NY,Suffolk County Community College-Central Report,PHL104,Critical Thinking,PHIL 1000,Philosophy Elective,,,,Suffolk County Community College
Selden,NY,Suffolk County Community College-Central Report,PHL105,Logic,PHIL 1000,Philosophy Elective,,,,Suffolk County Community College
Selden,NY,Suffolk County Community College-Central Report,PHL107,Ethics,PHIL 1000,Philosophy Elective,,,,Suffolk County Community College
Selden,NY,Suffolk County Community College-Central Report,PL11,Issues In Philosophy,PHIL 1000,Philosophy Elective,,,,Suffolk County Community College
Riverhead,NY,Suffolk County Community College-Eastern Campus,PHL101,Issues In Philosophy,PHIL 1000,Philosophy Elective,,,,Suffolk County Community College
Riverhead,NY,Suffolk County Community College-Eastern Campus,PHL104,Critical Thinking,PHIL 1000,Philosophy Elective,,,,Suffolk County Community College
Riverhead,NY,Suffolk County Community College-Eastern Campus,PHL105,Logic,PHIL 1000,Philosophy Elective,,,,Suffolk County Community College
Riverhead,NY,Suffolk County Community College-Eastern Campus,PHL107,Ethics,PHIL 1000,Philosophy Elective,,,,Suffolk County Community College
Riverhead,NY,Suffolk County Community College-Eastern Campus,PL11,Issues In Philosophy,PHIL 1000,Philosophy Elective,,,,Suffolk County Community College
Brentwood,NY,Suffolk County Community College-Western Campus,PHL101,Issues In Philosophy,PHIL 1000,Philosophy Elective,,,,Suffolk County Community College
Brentwood,NY,Suffolk County Community College-Western Campus,PHL104,Critical Thinking,PHIL 1000,Philosophy Elective,,,,Suffolk County Community College
Brentwood,NY,Suffolk County Community College-Western Campus,PHL105,Logic,PHIL 1000,Philosophy Elective,,,,Suffolk County Community College
Brentwood,NY,Suffolk County Community College-Western Campus,PHL107,Ethics,PHIL 1000,Philosophy Elective,,,,Suffolk County Community College
Brentwood,NY,Suffolk County Community College-Western Campus,PL11,Issues In Philosophy,PHIL 1000,Philosophy Elective,,,,Suffolk County Community College
Loch Sheldrake,NY,Sullivan County Community College,HUM 1304,Ethics,PHIL 1000,Philosophy Elective,,,,SUNY Sullivan County Community College
Vestal,NY,Suny At Binghamton,PHIL 107,Existence And Freedom,PHIL 1000,Philosophy Elective,,,,SUNY Binghamton University
Vestal,NY,Suny At Binghamton,PHIL 146,Law & Justice,PHIL 1000,Philosophy Elective,,,,SUNY Binghamton University
Brockport,NY,Suny College At Brockport,PHL 101,Introduction To Philosophy,PHIL 1000,Philosophy Elective,,,,SUNY College At Brockport
Geneseo,NY,Suny College At Geneseo,HONR 101,The Nature Of Inquiry,PHIL 1000,Philosophy Elective,,,,SUNY Geneseo Undergraduate
Oneonta,NY,Suny College At Oneonta,PHIL 103,Critical Thinking,PHIL 1000,Philosophy Elective,,,,SUNY Oneonta Undergraduate
Plattsburgh,NY,Suny College At Plattsburgh,PHI 104,Moral Problems,PHIL 1000,Philosophy Elective,,,,SUNY College At Plattsburgh Undergraduate And Graduate
Suffern,NY,Suny Rockland Community College,CSP 13000,Social And Ethical Issues In Computing,PHIL 1000,Philosophy Elective,PHIL 1000 (3 cr),01/01/2024,01/01/2027,SUNY Rockland Community College
Stone Ridge,NY,Suny Ulster County Community College,PHI 217,Religions Of The West,PHIL 1000,Philosophy Elective,,,,SUNY Ulster County Community College
