City,State,Institution,Transfer Course ID,Transfer Course Name,RPI Course ID,RPI Course Name,Note,Begin,End,Transfer Catalog
Garden City,NY,Adelphi University,PHI212,Ethics And Morality,PHIL 2000,Philosophy Elective,,,,Adelphi University Undergraduate And Graduate Courses
Queensbury,NY,Adirondack Community College,PHI 202,Ethics,PHIL 2000,Philosophy Elective,,,,SUNY Adirondack Community College
Queensbury,NY,Adirondack Community College,PHI 206,Biomedical Ethics,PHIL 2000,Philosophy Elective,,,,SUNY Adirondack Community College
Albany,NY,Albany College Of Pharmacy And Health Sciences,LAS 271,Religion As The Search For Meaning,PHIL 2000,Philosophy Elective,,,,Albany College Of Pharmacy And Health Sciences
Alfred,NY,Alfred University,PHIL 281,Ethics,PHIL 2000,Philosophy Elective,,,,Alfred University
Annandale-On-Hudson,NY,Bard College,SHP 222,The History Of Science Before Newton,PHIL 2000,Philosophy Elective,,,,Bard College
Albion,NY,Bard College - Albion Correctional Facility,SHP 222,The History Of Science Before Newton,PHIL 2000,Philosophy Elective,,,,Bard College
New York,NY,Bard College - Bard Globalization And International Affairs Program,SHP 222,The History Of Science Before Newton,PHIL 2000,Philosophy Elective,,,,Bard College
Newark,NJ,Bard College - Bhsec Newark,SHP 222,The History Of Science Before Newton,PHIL 2000,Philosophy Elective,,,,Bard College
Brooklyn,NY,Bard College - Brooklyn Public Library,SHP 222,The History Of Science Before Newton,PHIL 2000,Philosophy Elective,,,,Bard College
Napanoch,NY,Bard College - Eastern Ny Correctional Facility,SHP 222,The History Of Science Before Newton,PHIL 2000,Philosophy Elective,,,,Bard College
Beacon,NY,Bard College - Fishkill Correctional Facility,SHP 222,The History Of Science Before Newton,PHIL 2000,Philosophy Elective,,,,Bard College
Stormville,NY,Bard College - Green Haven Correctional Facility,SHP 222,The History Of Science Before Newton,PHIL 2000,Philosophy Elective,,,,Bard College
Holyoke,MA,Bard College - Holyoke Microcollege,SHP 222,The History Of Science Before Newton,PHIL 2000,Philosophy Elective,,,,Bard College
Los Angeles,CA,Bard College - Mat Program Ca,SHP 222,The History Of Science Before Newton,PHIL 2000,Philosophy Elective,,,,Bard College
New York,NY,"Bard College - New York Public Library, Countee Cullen Branch",SHP 222,The History Of Science Before Newton,PHIL 2000,Philosophy Elective,,,,Bard College
Bedford Hill,NY,Bard College - Taconic Correctional Facility,SHP 222,The History Of Science Before Newton,PHIL 2000,Philosophy Elective,,,,Bard College
Woodbourne,NY,Bard College - Woodbourne Correctional Facility,SHP 222,The History Of Science Before Newton,PHIL 2000,Philosophy Elective,,,,Bard College
Waltham,MA,Bentley University,PH 253,Theories Of Reality,PHIL 2000,Philosophy Elective,,,,Bentley University Undergraduate
Pittsfield,MA,Berkshire Community College,PHL 209,Ethics,PHIL 2000,Philosophy Elective,,,,Berkshire Community College
Pittsfield,MA,Berkshire Community College,PHL 212,Asian Philosophy,PHIL 2000,Philosophy Elective,,,,Berkshire Community College
Chestnut Hill,MA,Boston College,PL 088,Person And Social Responsibility I,PHIL 2000,Philosophy Elective,,,,Boston College Undergraduate
Chestnut Hill,MA,Boston College,TH 017,Introduction To Christian Theology II,PHIL 2000,Philosophy Elective,,,,Boston College Undergraduate
Fort Lauderdale,FL,Broward College,REL2300,World Religions,PHIL 2000,Philosophy Elective,,,,Broward College
Newtown,PA,Bucks County Community College,PHIL 111,Ethics,PHIL 2000,Philosophy Elective,,,,Bucks County Community College
Bristol,PA,Bucks County Community College-Lower Bucks Campus,PHIL 111,Ethics,PHIL 2000,Philosophy Elective,,,,Bucks County Community College
Perkasie,PA,Bucks County Community College-Upper Bucks Campus,PHIL 111,Ethics,PHIL 2000,Philosophy Elective,,,,Bucks County Community College
Aptos,CA,Cabrillo College,PHILO-14,Nonwest Philo Trad,PHIL 2000,Philosophy Elective,,,,Cabrillo College Course Descriptions
West Barnstable,MA,Cape Cod Community College,PHI201,Existentialism,PHIL 2000,Philosophy Elective,,,,Cape Cod Community College
Auburn,NY,Cayuga Community College,PHIL 203,World Religions,PHIL 2000,Philosophy Elective,,,,Cayuga Community College
San Francisco,CA,City College Of San Francisco,PHIL 12A,Symbolic Logic,PHIL 2000,Philosophy Elective,,,,City College Of San Francisco
Claremont,CA,Claremont Mckenna College,RLST 120,The Life Of Jesus,PHIL 2000,Philosophy Elective,,,,Claremont McKenna College
Atlanta,GA,Clark Atlanta University,CPHI 231,Ethics And Human Values,PHIL 2000,Philosophy Elective,,,,Clark Atlanta University Undergraduate
Clemson,SC,Clemson University,PHIL 3260,Science And Values,PHIL 2000,Philosophy Elective,PHIL 2000 (3 cr),01/01/2024,01/01/2027,Clemson University Undergraduate
Waterville,ME,Colby College,EA276,Zen And The Arts In Asia,PHIL 2000,Philosophy Elective,PHIL 2000 (4cr),05/01/2023,05/01/2026,Colby College
Waterville,ME,Colby College,HI 181,Conceptions Of Jews And Judaism,PHIL 2000,Philosophy Elective,,,,Colby College
Waterville,ME,Colby College,HI 182,Jews And Judaism In The Modern World,PHIL 2000,Philosophy Elective,,,,Colby College
Waterville,ME,Colby College,PL274,Philosophy Of Religion,PHIL 2000,Philosophy Elective,,,,Colby College
Williamsburg,VA,College Of William And Mary,PHIL 230,Philosophy Across Cultures,PHIL 2000,Philosophy Elective,,,,College Of William And Mary Undergraduate
Wooster,OH,College Of Wooster,RELS 10000,Religious Thought & Action,PHIL 2000,Philosophy Elective,,,,College Of Wooster
Montpelier,VT,Community College Of Vermont,PHI 1040,Introduction To Ethics,PHIL 2000,Philosophy Elective,PHIL 2000 (3cr),05/01/2023,05/01/2026,Community College Of Vermont
Bridgeport,CT,Connecticut State Community College Housatonic Campus,PHL* E111,Ethics,PHIL 2000,Philosophy Elective,,,,Housatonic Community College
Norwich,CT,Connecticut State Community College Three Rivers Campus,PHL* K111,Ethics,PHIL 2000,Philosophy Elective,,,,Three Rivers Community College
Randolph,NJ,County College Of Morris,PHL-280,Ancient Philosophy-Honors,PHIL 2000,Philosophy Elective,,,,County College Of Morris
New York,NY,Cuny Hunter College,PHILO 27500,Symbolic Logic,PHIL 2000,Philosophy Elective,,,,CUNY Hunter College Undergraduate
New York,NY,Cuny Hunter College,REL 32100,Buddhism,PHIL 2000,Philosophy Elective,,,,CUNY Hunter College Undergraduate
Long Island City,NY,Cuny Laguardia Community College,HUP104,Ethics And Moral Issues,PHIL 2000,Philosophy Elective,,,,CUNY LaGuardia Community College
Davidson,NC,Davidson College,PHI 220,Political Philosophy,PHIL 2000,Philosophy Elective,,,,Davidson College
Davidson,NC,Davidson College,REL 170,The Sacred Quest In Comparative Perspective,PHIL 2000,Philosophy Elective,,,,Davidson College
Poughkeepsie,NY,Dutchess Community College,PHI203,Major Religions Of The World,PHIL 2000,Philosophy Elective,,,,Dutchess Community College
Poughkeepsie,NY,Dutchess Community College,PHI205,Introduction To Ethics,PHIL 2000,Philosophy Elective,,,,Dutchess Community College
Beverly,MA,Endicott College,SM 218,Philosophy And Sport,PHIL 2000,Philosophy Elective,PHIL 2000 (3cr),09/01/2023,09/01/2026,Endicott College
Fairfield,CT,Fairfield University,RS 10,Introduction To Religious Studies,PHIL 2000,Philosophy Elective,,,,Fairfield University Undergraduate
Los Altos Hills,CA,Foothill College,PHIL 8,Ethics,PHIL 2000,Philosophy Elective,,,,Foothill College
Bronx,NY,Fordham University,THEO 3200,Introduction To New Testament,PHIL 2000,Philosophy Elective,PHIL 2000 (3cr),09/01/2023,09/01/2026,Fordham University
Lancaster,PA,Franklin And Marshall College,PHI 210,Ancient Greek Philosophy,PHIL 2000,Philosophy Elective,,,,Franklin And Marshall College
Lancaster,PA,Franklin And Marshall College,PHI 218,Nietzsche,PHIL 2000,Philosophy Elective,,,,Franklin And Marshall College
Lancaster,PA,Franklin And Marshall College,PHI 270,Special Topics,PHIL 2000,Philosophy Elective,,,,Franklin And Marshall College
Johnstown,NY,Fulton-Montgomery Community College,HU 258,Ethics,PHIL 2000,Philosophy Elective,,,,Fulton-Montgomery Community College
Johnstown,NY,Fulton-Montgomery Community College,HU 271,Comparitive Religions,PHIL 2000,Philosophy Elective,,,,Fulton-Montgomery Community College
Johnstown,NY,Fulton-Montgomery Community College,PHI 258,Ethics,PHIL 2000,Philosophy Elective,,,,Fulton-Montgomery Community College
Washington,DC,Georgetown University,THEO-057,The Hindu Religious Tradition,PHIL 2000,Philosophy Elective,,,,Georgetown University Course Descriptions
Grinnell,IA,Grinnell College,PHI 234,19Th-Century Continental Philosophy,PHIL 2000,Philosophy Elective,,,,Grinnell College
Grinnell,IA,Grinnell College,PHI 235,20Th-Century Continental Philosophy,PHIL 2000,Philosophy Elective,,,,Grinnell College
Hanover,IN,Hanover College,THS 161,Theology And The Human Condition,PHIL 2000,Philosophy Elective,,,,Hanover College
Oneonta,NY,Hartwick College,PHIL 201,Classics Of Philosophy,PHIL 2000,Philosophy Elective,,,,Hartwick College
Tampa,FL,Hillsborough Community College,PHI 1600H,Honors Ethics,PHIL 2000,Philosophy Elective,,,,Hillsborough Community College
Geneva,NY,Hobart William Smith Colleges,PHIL 151,Contemporary Issues: Crime & Punishment,PHIL 2000,Philosophy Elective,,,,Hobart And William Smith Colleges
Houston,TX,Houston Community College System,PHIL 2306,Introduction To Ethics,PHIL 2000,Philosophy Elective,,,,Houston Community College System
Jersey City,NJ,Hudson County Community College,PHL 218,Contemporary Moral Issues,PHIL 2000,Philosophy Elective,,,,Hudson County Community College
Troy,NY,Hudson Valley Community College,HONR 265,"Ideas Past & Present: The Impact Of Thought On Post-Modern Society Hum, Hu",PHIL 2000,Philosophy Elective,,,,Hudson Valley Community College
Troy,NY,Hudson Valley Community College,PHIL 120,Existentialism,PHIL 2000,Philosophy Elective,,,,Hudson Valley Community College
Troy,NY,Hudson Valley Community College,PHIL 111 + PHIL 120,Comparative Religion II + Existentialism,PHIL 2000,Philosophy Elective,,,,Hudson Valley Community College
Gambier,OH,Kenyon College,PHIL 115,Practical Issues In Ethics,PHIL 2000,Philosophy Elective,,,,Kenyon College
Galesburg,IL,Knox College,PHIL 276,Existentialism,PHIL 2000,Philosophy Elective,,,,Knox College
Galesburg,IL,Knox College,PHIL 283,Philosophy Of Religion,PHIL 2000,Philosophy Elective,,,,Knox College
Galesburg,IL,Knox College,RELS 113,"Judaism, Christianity, And Islam",PHIL 2000,Philosophy Elective,,,,Knox College
Syracuse,NY,Le Moyne College,PHL 201,Phil Perspectives On The Human,PHIL 2000,Philosophy Elective,,,,Le Moyne College
Syracuse,NY,Le Moyne College,REL 200,Religious Perspectives,PHIL 2000,Philosophy Elective,,,,Le Moyne College
Schnecksville,PA,Lehigh Carbon Community College,PHI 205,Introduction To Ethics,PHIL 2000,Philosophy Elective,,,,Lehigh Carbon Community College
Bethlehem,PA,Lehigh University,CLSS 213,Ancient Roman Religion,PHIL 2000,Philosophy Elective,,,,Lehigh University
Brooklyn,NY,Liu Brooklyn,HHP 22,Philosophy And Human Values In Perspective,PHIL 2000,Philosophy Elective,,,,LIU Brooklyn Undergraduate
Brooklyn,NY,Liu Brooklyn,PHI 169,Philosophy Of Religion,PHIL 2000,Philosophy Elective,,,,LIU Brooklyn Undergraduate
The Woodlands,TX,Lone Star College System,PHIL2307,Introduction To Social And Political Philosophy,PHIL 2000,Philosophy Elective,,,,Lone Star College
Elyria,OH,Lorain County Community College,PHLY 161,Introduction To Ethics,PHIL 2000,Philosophy Elective,PHIL 2000 (3 cr),05/01/2023,05/01/2026,Lorain County Community College
Elyria,OH,Lorain County Community College,PHLY 165,Bioethics,PHIL 2000,Philosophy Elective,PHIL 2000 (3 cr),05/01/2023,05/01/2026,Lorain County Community College
Purchase,NY,Manhattanville College,PHL 2055,Contemporary Philosophy,PHIL 2000,Philosophy Elective,,,,Manhattanville College Undergraduate
Wellesley Hills,MA,Massachusetts Bay Community College,PH 102,Philosophy: Ethics,PHIL 2000,Philosophy Elective,PHIL 2000 (3cr),05/01/2023,05/01/2026,Massachusetts Bay Community College
Montreal,QC,Mcgill University,PHIL 237,Contemporary Moral Issues,PHIL 2000,Philosophy Elective,,,,Mcgill University Course Descriptions
North Andover,MA,Merrimack College,PHL 2200,History Of Ancient Philosophy,PHIL 2000,Philosophy Elective,,,,Merrimack College Undergraduate
Mechanicsburg,PA,Messiah University,RELI 205,Religions Of The World,PHIL 2000,Philosophy Elective,,,,Messiah University Undergraduate
Edison,NJ,Middlesex College,PHI-123,Ethics,PHIL 2000,Philosophy Elective,,,,Middlesex College
Rockville,MD,Montgomery College,PL 190,Elementary Logic And Semantics,PHIL 2000,Philosophy Elective,,,,Montgomery College
Moorpark,CA,Moorpark College,PHIL M02,Introduction To Ethics,PHIL 2000,Philosophy Elective,,,,Moorpark College Course Descriptions
Gardner,MA,Mount Wachusett Community College,PHL 210,Levels Of Being,PHIL 2000,Philosophy Elective,,,,Mount Wachusett Community College
Nashville,TN,Nashville State Community College,PHIL 1111,Introduction To Ethics,PHIL 2000,Philosophy Elective,,,,Nashville State Community College
Alfred Station,NY,New York State College Of Ceramics At Alfred University,PHIL 281,Ethics,PHIL 2000,Philosophy Elective,,,,Alfred University
Concord,NH,Nhti-Concord's Community College,PI 242,Contemporary Ethical Issues,PHIL 2000,Philosophy Elective,,,,NHTI Concord'S Community College Course Descriptions
Wahpeton,ND,North Dakota State College Of Science,PHIL 210,Ethics,PHIL 2000,Philosophy Elective,,,,North Dakota State College Of Science
Boston,MA,Northeastern University,PHL 1140,Social And Political Philosophy,PHIL 2000,Philosophy Elective,,,,Northeastern University Undergraduate
Boston,MA,Northeastern University,PHL 1225,Ancient Philosophy,PHIL 2000,Philosophy Elective,,,,Northeastern University Undergraduate
Boston,MA,Northeastern University Lifelong Learning Network,PHL 1140,Social And Political Philosophy,PHIL 2000,Philosophy Elective,,,,Northeastern University Undergraduate
Boston,MA,Northeastern University Lifelong Learning Network,PHL 1225,Ancient Philosophy,PHIL 2000,Philosophy Elective,,,,Northeastern University Undergraduate
Oberlin,OH,Oberlin College,PHIL 222,Philosophy Of Science,PHIL 2000,Philosophy Elective,,,,Oberlin College
Oberlin,OH,Oberlin College,RELG 101,Introduction To Religion: Religion As A World Phenomenon,PHIL 2000,Philosophy Elective,,,,Oberlin College
Oberlin,OH,Oberlin College,RELG 102,Introduction To Religion: Roots Of Religion In The Mediterranean World,PHIL 2000,Philosophy Elective,,,,Oberlin College
Oberlin,OH,Oberlin College,RELG 104,Introduction To Religion: Narrative In Asian Traditions,PHIL 2000,Philosophy Elective,,,,Oberlin College Course Descriptions
Columbus,OH,Ohio State University,PHILOS 2450,Philosophical Problems In The Arts,PHIL 2000,Philosophy Elective,,,,Ohio State University Course Offerings
Wooster,OH,Ohio State University Agricultural Technical Inst,PHILOS 2450,Philosophical Problems In The Arts,PHIL 2000,Philosophy Elective,,,,Ohio State University Course Offerings
Lima,OH,Ohio State University-Lima Campus,PHILOS 2450,Philosophical Problems In The Arts,PHIL 2000,Philosophy Elective,,,,Ohio State University Course Offerings
Mansfield,OH,Ohio State University-Mansfield Campus,PHILOS 2450,Philosophical Problems In The Arts,PHIL 2000,Philosophy Elective,,,,Ohio State University Course Offerings
Marion,OH,Ohio State University-Marion Campus,PHILOS 2450,Philosophical Problems In The Arts,PHIL 2000,Philosophy Elective,,,,Ohio State University Course Offerings
Newark,OH,Ohio State University-Newark Campus,PHILOS 2450,Philosophical Problems In The Arts,PHIL 2000,Philosophy Elective,,,,Ohio State University Course Offerings
Middletown,NY,Orange County Community College,PHL 210,Philosophy,PHIL 2000,Philosophy Elective,,,,SUNY Orange County Community College
New York,NY,Pace University-New York,PHI 113,Ancient Philosophy,PHIL 2000,Philosophy Elective,,,,Pace University Course Descriptions
New York,NY,Pace University-New York,PHI 121,Ethics In The Workplace,PHIL 2000,Philosophy Elective,,,,Pace University Course Descriptions
New York,NY,Pace University-New York,RES 106,Religions Of The Globe,PHIL 2000,Philosophy Elective,,,,Pace University Course Descriptions
Pleasantville,NY,Pace University-Pleasantville Briarcliff,PHI 113,Ancient Philosophy,PHIL 2000,Philosophy Elective,,,,Pace University Course Descriptions
Pleasantville,NY,Pace University-Pleasantville Briarcliff,PHI 121,Ethics In The Workplace,PHIL 2000,Philosophy Elective,,,,Pace University Course Descriptions
Pleasantville,NY,Pace University-Pleasantville Briarcliff,RES 106,Religions Of The Globe,PHIL 2000,Philosophy Elective,,,,Pace University Course Descriptions
White Plains,NY,Pace University-White Plains,PHI 113,Ancient Philosophy,PHIL 2000,Philosophy Elective,,,,Pace University Course Descriptions
White Plains,NY,Pace University-White Plains,PHI 121,Ethics In The Workplace,PHIL 2000,Philosophy Elective,,,,Pace University Course Descriptions
White Plains,NY,Pace University-White Plains,RES 106,Religions Of The Globe,PHIL 2000,Philosophy Elective,,,,Pace University Course Descriptions
Pasadena,CA,Pasadena City College,PHILO 3,Ethics,PHIL 2000,Philosophy Elective,,,,Pasadena City College
New Port Richey,FL,Pasco-Hernando State College,PHI 1630,Applied Ethics,PHIL 2000,Philosophy Elective,,,,Pasco-Hernando State College
Knoxville,TN,Pellissippi State Community College,PHIL 2400,Introduction To Ethics,PHIL 2000,Philosophy Elective,,,,Pellissippi State Community College
Portland,OR,Portland Community College,PHL 202,Ethics,PHIL 2000,Philosophy Elective,,,,Portland Community College
West Lafayette,IN,Purdue University-Main Campus,PHIL 206,Philosophy Of Religion,PHIL 2000,Philosophy Elective,,,,Purdue University Courses - West Lafayette
Worcester,MA,Quinsigamond Community College,PHI 250,Special Topics In Philosophy,PHIL 2000,Philosophy Elective,,,,Quinsigamond Community College
Sewell,NJ,Rowan College Of South Jersey,PHI 104,Ethics,PHIL 2000,Philosophy Elective,,,,Rowan College Of South Jersey Gloucester Campus
Troy,NY,Russell Sage College,PHL 211,"Myth, Religion And Art",PHIL 2000,Philosophy Elective,,,,Russell Sage College
New Brunswick,NJ,Rutgers University-New Brunswick,730:201,Introductory Logic,PHIL 2000,Philosophy Elective,,,,Rutgers University Douglass College
Sacramento,CA,Sacramento City College,PHIL 310,Introduction To Ethics,PHIL 2000,Philosophy Elective,,,,Sacramento City College
Fairfield,CT,Sacred Heart University,PH 221,Historical Development Of Philosophy,PHIL 2000,Philosophy Elective,,,,Sacred Heart University Undergraduate
Fairfield,CT,Sacred Heart University,PH 231,Introduction To The Philosophy Of Knowledge,PHIL 2000,Philosophy Elective,,,,Sacred Heart University Undergraduate
Staten Island,NY,Saint John's University - Staten Island Campus,PHI 2200C,Ethics,PHIL 2000,Philosophy Elective,,,,St. Johns University
Staten Island,NY,Saint John's University - Staten Island Campus,PHI 2240C,Ethics And Health Care,PHIL 2000,Philosophy Elective,,,,St. Johns University
Northfield,MN,Saint Olaf College,REL 121,Bible In Culture And Community,PHIL 2000,Philosophy Elective,,,,Saint Olaf College
San Francisco,CA,San Francisco State University,PHIL 130,Political And Social Philosophy,PHIL 2000,Philosophy Elective,,,,San Francisco State University
San Jose,CA,San Jose State University,RELS 70B,Eastern Religions,PHIL 2000,Philosophy Elective,,,,San Jose State University
Santa Clara,CA,Santa Clara University,PHIL 1A,Critical Thinking & Writing I,PHIL 2000,Philosophy Elective,,,,Santa Clara University Undergraduate
Santa Clara,CA,Santa Clara University,TESP 4,The Christian Tradition,PHIL 2000,Philosophy Elective,,,,Santa Clara University Undergraduate
Santa Clara,CA,Santa Clara University,PHIL 1A + TESP 4,Critical Thinking & Writing I + The Christian Tradition,PHIL 2000,Philosophy Elective,,,,Santa Clara University Undergraduate
Gainesville,FL,Santa Fe College,PHI 2600,Introduction To Ethics,PHIL 2000,Philosophy Elective,,,,Santa Fe College
Gainesville,FL,Santa Fe College,REL 2300,Survey Of Contemporary World Religions,PHIL 2000,Philosophy Elective,,,,Santa Fe College
Schenectady,NY,Schenectady County Community College,ETH 221,Professional And Applied Ethics,PHIL 2000,Philosophy Elective,,,,Schenectady County Community College
Seattle,WA,Seattle University,UCOR 2100,Theological Explorations,PHIL 2000,Philosophy Elective,,,,Seattle University Undergraduate
Seattle,WA,Seattle University,UCOR 2500,Philosophy Of The Human Person,PHIL 2000,Philosophy Elective,,,,Seattle University Undergraduate
South Orange,NJ,Seton Hall University,PHIL 1105,Ethics,PHIL 2000,Philosophy Elective,,,,Seton Hall University Undergraduate
South Orange,NJ,Seton Hall University,PLTL 2218,Philosophy Of Being,PHIL 2000,Philosophy Elective,,,,Seton Hall University Undergraduate
South Orange,NJ,Seton Hall University,PLTL 2223,Philosophy Of Nature,PHIL 2000,Philosophy Elective,,,,Seton Hall University Undergraduate
South Orange,NJ,Seton Hall University,PLTL 2241,Philosophical Ethics,PHIL 2000,Philosophy Elective,,,,Seton Hall University Undergraduate
South Orange,NJ,Seton Hall University,PLTL 2243,Theory Of Knowledge,PHIL 2000,Philosophy Elective,,,,Seton Hall University Undergraduate
Loudonville,NY,Siena College,PHIL - 240,Philosophy Of Art,PHIL 2000,Philosophy Elective,,,,Siena College Undergraduate
Loudonville,NY,Siena College,PHIL - 290,Greek And Roman Philosophy,PHIL 2000,Philosophy Elective,,,,Siena College Undergraduate
Loudonville,NY,Siena College,RELG - 101,Religion In Western Culture,PHIL 2000,Philosophy Elective,,,,Siena College Undergraduate
Loudonville,NY,Siena College,RELG - 207,Christianity,PHIL 2000,Philosophy Elective,,,,Siena College Undergraduate
New Haven,CT,Southern Connecticut State University,PHI 211,Asian Philosophy: India,PHIL 2000,Philosophy Elective,,,,Southern Connecticut State University Undergraduate
Canton,NY,St Lawrence University,PHIL 206,Introduction To Political Theory,PHIL 2000,Philosophy Elective,,,,Saint Lawrence University
Rochester,NY,St. John Fisher University,REST-272P,Martin & Malcolm,PHIL 2000,Philosophy Elective,,,,Saint John Fisher College Undergraduate
Queens,NY,St. John's University,PHI 2200C,Ethics,PHIL 2000,Philosophy Elective,,,,St. Johns University
Queens,NY,St. John's University,PHI 2240C,Ethics And Health Care,PHIL 2000,Philosophy Elective,,,,St. Johns University
Galloway,NJ,Stockton University,BASK 1203,Quantitative Reasoning,PHIL 2000,Philosophy Elective,,,,Stockton University Summer Course Descriptions
Stony Brook,NY,Stony Brook University,AAS 260,Buddhism,PHIL 2000,Philosophy Elective,,,,SUNY Stony Brook Undergraduate Bulletin And Course Descriptions Spring
Stony Brook,NY,Stony Brook University,RLS 270,Christianity,PHIL 2000,Philosophy Elective,,,,SUNY Stony Brook Undergraduate Bulletin And Course Descriptions Spring
Vestal,NY,Suny At Binghamton,PHIL 147,"Markets, Ethics And Law",PHIL 2000,Philosophy Elective,,,,SUNY Binghamton University
Fredonia,NY,Suny At Fredonia,PHIL 222,The Greek Way,PHIL 2000,Philosophy Elective,,,,SUNY Fredonia General
Fredonia,NY,Suny At Fredonia,PL 116,Introduction To Deductive Logic,PHIL 2000,Philosophy Elective,,,,SUNY Fredonia Undergraduate
Geneseo,NY,Suny College At Geneseo,PHIL 205,Ancient Philosophy,PHIL 2000,Philosophy Elective,,,,SUNY Geneseo Undergraduate
Geneseo,NY,Suny College At Geneseo,PHIL 207,Modern Philosophy,PHIL 2000,Philosophy Elective,,,,SUNY Geneseo Undergraduate
Geneseo,NY,Suny College At Geneseo,PHIL 215,M/Eastern Philosophy,PHIL 2000,Philosophy Elective,,,,SUNY Geneseo Undergraduate
Oneonta,NY,Suny College At Oneonta,PHIL 230,Environmental Ethics,PHIL 2000,Philosophy Elective,,,,SUNY Oneonta Undergraduate
Suffern,NY,Suny Rockland Community College,PHL 204,Processes Of Thinking,PHIL 2000,Philosophy Elective,,,,SUNY Rockland Community College
Suffern,NY,Suny Rockland Community College,PHL 260,Ethics In Business,PHIL 2000,Philosophy Elective,,,,SUNY Rockland Community College
Stone Ridge,NY,Suny Ulster County Community College,PHI 205,Ethics,PHIL 2000,Philosophy Elective,,,,SUNY Ulster County Community College
Stone Ridge,NY,Suny Ulster County Community College,PHI 210,Professional Ethics,PHIL 2000,Philosophy Elective,,,,SUNY Ulster County Community College
Stone Ridge,NY,Suny Ulster County Community College,PHI 216,Religions Of The East,PHIL 2000,Philosophy Elective,,,,SUNY Ulster County Community College
Stone Ridge,NY,Suny Ulster County Community College,PHI 240,Topics In Science And Philosophy,PHIL 2000,Philosophy Elective,,,,SUNY Ulster County Community College
Selinsgrove,PA,Susquehanna University,HONS-200,Thought And Civilization,PHIL 2000,Philosophy Elective,,,,Susquehanna University
Syracuse,NY,Syracuse University,HST 212,Religion In Medieval And Reformation Europe,PHIL 2000,Philosophy Elective,,,,Syracuse University Undergraduate
Ewing,NJ,The College Of New Jersey,PHL 220,Metalogic,PHIL 2000,Philosophy Elective,,,,The College Of New Jersey Course Catalog
Ewing,NJ,The College Of New Jersey,PHL 275,Philosophy Of Law,PHIL 2000,Philosophy Elective,,,,The College Of New Jersey Course Catalog
Ewing,NJ,The College Of New Jersey,PHL 370,Special Topics In Philosophy,PHIL 2000,Philosophy Elective,,,,The College Of New Jersey Course Catalog
Albany,NY,The College Of Saint Rose,PHI 412,Analytic Philosophy,PHIL 2000,Philosophy Elective,,,,College Of Saint Rose Undergraduate Studies
Albany,NY,The College Of Saint Rose,RLS 102,Ethics And Values,PHIL 2000,Philosophy Elective,,,,College Of Saint Rose Undergraduate Studies
Tuscaloosa,AL,The University Of Alabama,PHL260,Mind And Nature,PHIL 2000,Philosophy Elective,,,,University Of Alabama Undergraduate
