City,State,Institution,Transfer Course ID,Transfer Course Name,RPI Course ID,RPI Course Name,Note,Begin,End,Transfer Catalog
Orlando,FL,University Of Central Florida,PHY2049C,General Physics Using Calculus II Studio,PHYS 1200,Physics II,,,,University Of Central Florida Undergraduate
Boulder,CO,University Of Colorado At Boulder,PHYS 1120,General Physics 2,PHYS 1200,Physics II,,,,University Of Colorado At Boulder
Colorado Springs,CO,University Of Colorado At Colorado Springs,PES 1120,General Physics II,PHYS 1200,Physics II,,,,University Of Colorado At Colorado Springs
Storrs,CT,University Of Connecticut,PHYS 1402Q,General Physics With Calculus II,PHYS 1200,Physics II,,,,University Of Connecticut Undergraduate
Storrs,CT,University Of Connecticut,PHYS 1502Q,Physics For Engineers II,PHYS 1200,Physics II,PHYS 1200 (4cr),05/01/2023,05/01/2026,University Of Connecticut Undergraduate
Groton,CT,University Of Connecticut-Avery Point,PHYS 1402Q,General Physics With Calculus II,PHYS 1200,Physics II,,,,University Of Connecticut Undergraduate
Groton,CT,University Of Connecticut-Avery Point,PHYS 1502Q,Physics For Engineers II,PHYS 1200,Physics II,PHYS 1200 (4cr),05/01/2023,05/01/2026,University Of Connecticut Undergraduate
Hartford,CT,University Of Connecticut-Hartford Campus,PHYS 1402Q,General Physics With Calculus II,PHYS 1200,Physics II,,,,University Of Connecticut Undergraduate
Hartford,CT,University Of Connecticut-Hartford Campus,PHYS 1502Q,Physics For Engineers II,PHYS 1200,Physics II,PHYS 1200 (4cr),05/01/2023,05/01/2026,University Of Connecticut Undergraduate
Stamford,CT,University Of Connecticut-Stamford,PHYS 1402Q,General Physics With Calculus II,PHYS 1200,Physics II,,,,University Of Connecticut Undergraduate
Stamford,CT,University Of Connecticut-Stamford,PHYS 1502Q,Physics For Engineers II,PHYS 1200,Physics II,PHYS 1200 (4cr),05/01/2023,05/01/2026,University Of Connecticut Undergraduate
Waterbury,CT,University Of Connecticut-Waterbury Campus,PHYS 1402Q,General Physics With Calculus II,PHYS 1200,Physics II,,,,University Of Connecticut Undergraduate
Waterbury,CT,University Of Connecticut-Waterbury Campus,PHYS 1502Q,Physics For Engineers II,PHYS 1200,Physics II,PHYS 1200 (4cr),05/01/2023,05/01/2026,University Of Connecticut Undergraduate
Newark,DE,University Of Delaware,PHYS 208,Fundamentals Of Physics II,PHYS 1200,Physics II,,,,University Of Delaware Undergraduate
Denver,CO,University Of Denver,PHYS 1222,University Physics Lab II,PHYS 1200,Physics II,,,,University Of Denver Undergraduate
Athens,GA,University Of Georgia,PHYS 1252,Introductory Studio Physics For Engineers II,PHYS 1200,Physics II,,,,University Of Georgia Course Descriptions
Honolulu,HI,University Of Hawai'i At Manoa,PHYS 272 + PHYS 272L,General Physics II + General Physics II Lab,PHYS 1200,Physics II,,,,University Of Hawaii Manoa
Champaign,IL,University Of Illinois At Urbana - Champaign,PHYS 212,University Physics: Elec & Mag,PHYS 1200,Physics II,,,,University Of Illinois At Urbana-Champaign
Orono,ME,University Of Maine,PHY 122,Physics For Engineers And Physical Scientists II,PHYS 1200,Physics II,,,,University Of Maine Undergraduate
Baltimore,MD,University Of Maryland-Baltimore County,PHYS 122 + PHYS 122L,Introductory Physics II + Introductory Physics Laboratory,PHYS 1200,Physics II,,,,University Of Maryland Baltimore County Undergraduate
College Park,MD,University Of Maryland-College Park,PHYS260 + PHYS261,"General Physics: Vibration, Waves, Heat, Electricity And Magnetism + General Physics: Mechanics, Vibrations, Waves, Heat (Laboratory)",PHYS 1200,Physics II,PHYS 1200 (4cr),09/01/2023,09/01/2026,University Of Maryland College Park Undergraduate
Amherst,MA,University Of Massachusetts-Amherst,PHYSICS 152,General Physics II,PHYS 1200,Physics II,,,,University Of Massachusetts Amherst Course Descriptions
Amherst,MA,University Of Massachusetts-Amherst,PHYSICS 154,General Phys Lab II,PHYS 1200,Physics II,,,,University Of Massachusetts Amherst Course Descriptions
Boston,MA,University Of Massachusetts-Boston,PHYSIC 114 + PHYSIC 182,Fundamentals Of Physics II + Physics Laboratory II,PHYS 1200,Physics II,PHYS 1200 (4cr),05/01/2023,05/01/2026,University Of Massachusetts Boston Undergraduate
Coral Gables,FL,University Of Miami,PHY 206 + PHY 208,University Physics II + University Physics II Lab,PHYS 1200,Physics II,,,,University Of Miami
Ann Arbor,MI,University Of Michigan-Ann Arbor,PHYSICS 240 + PHYSICS 241,General Physics II + Elementary Laboratory II,PHYS 1200,Physics II,,,,"University Of Michigan College Of Literature, Science, And The Arts Fall Courses"
Flint,MI,University Of Michigan-Flint,PHY 245,Principles Of Physics II,PHYS 1200,Physics II,,,,University Of Michigan Flint
Minneapolis,MN,University Of Minnesota Twin Cities,PHYS 1302W,Introductory Physics For Science And Engineering II,PHYS 1200,Physics II,,01/01/2024,01/01/2027,University Of Minnesota Twin Cities Undergraduate
Montevallo,AL,University Of Montevallo,PHYS 242,University Physics II,PHYS 1200,Physics II,,,,University Of Montevallo Undergraduate
Durham,NH,University Of New Hampshire-Main Campus,PHYS 408,General Physics II,PHYS 1200,Physics II,,,,University Of New Hampshire Undergraduate
Durham,NH,University Of New Hampshire-Main Campus,PHYS 408,General Physics II,PHYS 1200,Physics II,,,,University Of New Hampshire Manchester
Manchester,NH,University Of New Hampshire-Manchester,PHYS 408,General Physics II,PHYS 1200,Physics II,,,,University Of New Hampshire Manchester
West Haven,CT,University Of New Haven,PH 205,Electromagnetism/Optic W/Lab,PHYS 1200,Physics II,,,,University Of New Haven Undergraduate
West Haven,CT,University Of New Haven,PHYS 2205,Electromagnetism And Optics With Laboratory,PHYS 1200,Physics II,,,,University Of New Haven Undergraduate
Albuquerque,NM,University Of New Mexico-Main Campus,PHYC 161,General Physics,PHYS 1200,Physics II,,,,University Of New Mexico Albuquerque
Dahlonega,GA,University Of North Georgia,PHYS 2212 + PHYS 2212L,Principles Of Physics II + Principles Of Physics II Lab,PHYS 1200,Physics II,,,,University Of North Georgia Undergraduate
Dahlonega,GA,University Of North Georgia,PHYS 2212L,Principles Of Physics II Lab,PHYS 1200 + PHYS 1200,Physics II + Physics II,,,,University Of North Georgia Undergraduate
Dahlonega,GA,University Of North Georgia,PHYS 2212L,Principles Of Physics II Lab,PHYS 1200 + PHYS 1200,Physics II + Physics II,,,,University Of North Georgia Undergraduate
Norman,OK,University Of Oklahoma,PHYS 2524,General Physics For Engineering And Science Majors,PHYS 1200,Physics II,,,,University Of Oklahoma
Lawton,OK,University Of Oklahoma - Douglass Learning Center,PHYS 2524,General Physics For Engineering And Science Majors,PHYS 1200,Physics II,,,,University Of Oklahoma
Ft Benning,GA,University Of Oklahoma - Ft. Benning Ga - Ap,PHYS 2524,General Physics For Engineering And Science Majors,PHYS 1200,Physics II,,,,University Of Oklahoma
Nellis Afb,NV,University Of Oklahoma - Nellis Air Force Base,PHYS 2524,General Physics For Engineering And Science Majors,PHYS 1200,Physics II,,,,University Of Oklahoma
Bradford,PA,University Of Pittsburgh-Bradford,PHYS 0202,Foundations Of Physics 2,PHYS 1200,Physics II,,,,University Of Pittsburgh Bradford
Pittsburgh,PA,University Of Pittsburgh-Main Campus,PHYS 0175,"Basic Physics, Science And Engineering 2 (Integrated)",PHYS 1200,Physics II,,,,University Of Pittsburgh Undergraduate
San Juan,PR,University Of Puerto Rico-Rio Piedras,FISI 3172 + FISI 3174,FSica II + Laboratorio De FSica II,PHYS 1200,Physics II,,,,University Of Puerto Rico Rio Piedras
Kingston,RI,University Of Rhode Island,PHY204 + PHY274,Elementary Physics II + Elementary Physics Laboratory II,PHYS 1200,Physics II,PHYS 1200 (4cr),05/01/2023,05/01/2026,University Of Rhode Island
Rochester,NY,University Of Rochester,PHY 114,General Physics I,PHYS 1200,Physics II,,,,University Of Rochester Fall Course Descriptions
Rochester,NY,University Of Rochester,PHY 122,122/142 E&M Lab Te/ Lab B,PHYS 1200,Physics II,,,,University Of Rochester Fall Course Descriptions
Rochester,NY,University Of Rochester,PHY 142,122/142 E&M Lab Mn/Lab B,PHYS 1200,Physics II,,,,University Of Rochester Fall Course Descriptions
San Francisco,CA,University Of San Francisco,PHYS 210,General Physics II,PHYS 1200,Physics II,,,,University Of San Francisco
Columbia,SC,University Of South Carolina Columbia,PHYS 212 + PHYS 212L,Essentials Of Physics II + Essentials Of Physics II Lab,PHYS 1200,Physics II,,,,University Of South Carolina At Columbia Undergraduate
Tampa,FL,University Of South Florida,PHY 2049 + PHY 2049L,General Physics II - Calculus Based + General Physics II Laboratory,PHYS 1200,Physics II,,,,University Of South Florida Undergraduate
Sarasota,FL,University Of South Florida Sarasota-Manatee,PHY 2049 + PHY 2049L,General Physics II - Calculus Based + General Physics II Laboratory,PHYS 1200,Physics II,,,,University Of South Florida Undergraduate
St. Petersburg,FL,University Of South Florida-St. Petersburg,PHY 2049 + PHY 2049L,General Physics II - Calculus Based + General Physics II Laboratory,PHYS 1200,Physics II,,,,University Of South Florida Undergraduate
Portland,ME,University Of Southern Maine,PHY 116 + PHY 123,Introductory Physics Laboratory II + General Physics II,PHYS 1200,Physics II,,,,University Of Southern Maine Undergraduate
Knoxville,TN,University Of Tennessee,EF 152,Physics For Engineers II,PHYS 1100 + PHYS 1100 + PHYS 1200 + PHYS 1200,Physics I + Physics I + Physics II + Physics II,,,,University Of Tennessee Knoxville Undergraduate
Knoxville,TN,University Of Tennessee,EF 152,Physics For Engineers II,PHYS 1100 + PHYS 1100 + PHYS 1200 + PHYS 1200,Physics I + Physics I + Physics II + Physics II,,,,University Of Tennessee Knoxville Undergraduate
Knoxville,TN,University Of Tennessee,PHYS 138,Honors: Fundamentals Of Physics For Physics Majors II,PHYS 1200,Physics II,,,,University Of Tennessee Knoxville Undergraduate
Knoxville,TN,University Of Tennessee,EF 152 + PHYS 138,Physics For Engineers II + Honors: Fundamentals Of Physics For Physics Majors II,PHYS 1200,Physics II,,,,University Of Tennessee Knoxville Undergraduate
Washington,DC,University Of The District Of Columbia,1539 + 1539,202 University Physics II + 206 University Physics II Laboratory,PHYS 1200,Physics II,,,,University Of The District Of Columbia
Sewanee,TN,University Of The South,PHYS 104,Electric And Magnetic Interactions (Lab),PHYS 1200,Physics II,,,,University Of The South Sewanee College Arts And Sciences
Burlington,VT,University Of Vermont And State Agricultural College,PHYS 152,Fundamentals Of Physics II,PHYS 1200,Physics II,,,,University Of Vermont Undergraduate
Burlington,VT,University Of Vermont And State Agricultural College,PHYS 125 + PHYS 152,Physics For Engineers II + Fundamentals Of Physics II,PHYS 1200,Physics II,,,,University Of Vermont Undergraduate
Carrollton,GA,University Of West Georgia,PHYS 2212 + PHYS 2212L,Principles Of Physics II + Principles Of Physics II Laboratory,PHYS 1200,Physics II,,,,University Of West Georgia Undergraduate
Madison,WI,University Of Wisconsin-Madison,PHYSICS 202,General Physics,PHYS 1200,Physics II,,,,University Of Wisconsin Madison Course Descriptions
Laramie,WY,University Of Wyoming,PHYS1220,Engineering Physics II,PHYS 1200,Physics II,,,,University Of Wyoming
Utica,NY,Utica University,PHY 262,Physics II,PHYS 1200,Physics II,,,,Utica University Winter/Spring Undergraduate
Orlando,FL,Valencia College,PHY 2049C,General Physics With Calculus II,PHYS 1200,Physics II,,01/01/2024,01/01/2027,Valencia College
Poughkeepsie,NY,Vassar College,PHYS 114,Fundamentals Of Physics II/Lab,PHYS 1200,Physics II,PHYS 1200 (4 cr),05/01/2023,05/01/2026,Vassar College
Randolph Center,VT,Vermont State University,PHY 2042,Fundamentals Of Physics With Calculus II,PHYS 1200,Physics II,,,,Vermont Technical College
Villanova,PA,Villanova University,PHY 2412 + PHY 2413,Univ Physics:Elec & Mag + Lab:Elec & Magnetism,PHYS 1200,Physics II,,,,Villanova University
Hampton,VA,Virginia Peninsula Community College,PHY 242,University Physics II,PHYS 1200,Physics II,PHYS 1200 (4cr),05/01/2023,05/01/2026,Virginia Peninsula Community College
Blacksburg,VA,Virginia Polytechnic Institute And State University,PHYS 2306,Foundations Of Physics,PHYS 1200,Physics II,,,,Virginia Polytechnic Institute And State University
Roanoke,VA,Virginia Western Community College,PHY 242*,University Physics II,PHYS 1200,Physics II,,,,Virginia Western Community College
Raleigh,NC,Wake Technical Community College,PHY-252,General Physics II,PHYS 1200,Physics II,,01/01/2024,01/01/2027,Wake Technical Community College
Aurora,NY,Wells College,PHYS 212L,Fundamentals Of Physics II,PHYS 1200,Physics II,,,,Wells College
Boston,MA,Wentworth Institute Of Technology,PHYS 320,Engineering Physics II,PHYS 1200,Physics II,,,,Wentworth Institute Of Technology Summer Course Descriptions
Boston,MA,Wentworth Institute Of Technology,PHYS 1750,Engineering Physics II,PHYS 1200,Physics II,,,,Wentworth Institute Of Technology Summer Course Descriptions
Dorchester,MA,Wentworth Institute Of Technology,PHYS 320,Engineering Physics II,PHYS 1200,Physics II,,,,Wentworth Institute Of Technology Summer Course Descriptions
Dorchester,MA,Wentworth Institute Of Technology,PHYS 1750,Engineering Physics II,PHYS 1200,Physics II,,,,Wentworth Institute Of Technology Summer Course Descriptions
Fall River,MA,Wentworth Institute Of Technology,PHYS 320,Engineering Physics II,PHYS 1200,Physics II,,,,Wentworth Institute Of Technology Summer Course Descriptions
Fall River,MA,Wentworth Institute Of Technology,PHYS 1750,Engineering Physics II,PHYS 1200,Physics II,,,,Wentworth Institute Of Technology Summer Course Descriptions
Saratoga,CA,West Valley College,PHYS 004B,Engineering Physics - Electricity And Magnetism,PHYS 1200,Physics II,,,,West Valley College
Morgantown,WV,West Virginia University,PHYS 112,General Physics 2,PHYS 1200,Physics II,,,,West Virginia University Undergraduate Course Descriptions
Bowling Green,KY,Western Kentucky University,PHYS 265 + PHYS 266,University Physics II + University Physics II Laboratory,PHYS 1200,Physics II,,,,Western Kentucky University Undergraduate
Kalamazoo,MI,Western Michigan University,PHYS 2070 + PHYS 2080,University Physics II + University Physics II Laboratory,PHYS 1200,Physics II,PHYS 1200 (4cr),05/01/2023,05/01/2026,Western Michigan University Undergraduate
Springfield,MA,Western New England University,PHYS 134,Electricity And Magnetism,PHYS 1200,Physics II,,,,Western New England University
Wheaton,IL,Wheaton College,PHYS 232,Introductory Physics II,PHYS 1200,Physics II,,,,Wheaton College
Norton,MA,Wheaton College,PHYS 181,Enhanced Introductory Physics II,PHYS 1200,Physics II,,,,Wheaton College
Wilmington,DE,Widener University-Delaware Campus,PHYS 162 + PHYS 164,Physics II + Physics II Laboratory,PHYS 1200,Physics II,,,,Widener University Undergraduate
Harrisburg,PA,Widener University-Harrisburg Campus,PHYS 162 + PHYS 164,Physics II + Physics II Laboratory,PHYS 1200,Physics II,,,,Widener University Undergraduate
Chester,PA,Widener University-Main Campus,PHYS 162 + PHYS 164,Physics II + Physics II Laboratory,PHYS 1200,Physics II,,,,Widener University Undergraduate
Wayne,NJ,William Paterson University Of New Jersey,PHYS 2610,General Physics II,PHYS 1200,Physics II,PHYS 1200 (4cr),05/01/2023,05/01/2026,William Paterson University Undergraduate
Williamstown,MA,Williams College,PHYS 201,Electricity And Magnetism,PHYS 1200,Physics II,,,,Williams College
Spartanburg,SC,Wofford College,PHY 142,Physics For Science & Engineering II (With Lab),PHYS 1200,Physics II,,,,Wofford College
Worcester,MA,Worcester Polytechnic Institute,PH 1120,General PhysicsElectricity And Magnetism,PHYS 1200,Physics II,,,,Worcester Polytechnic Institute Undergraduate
Worcester,MA,Worcester Polytechnic Institute,PH 1121,Principles Of PhysicsElectricity And Magnetism,PHYS 1200,Physics II,,,,Worcester Polytechnic Institute Undergraduate
New Orleans,LA,Xavier University Of Louisiana,PHYS 1141,Physics II For Phys And Engr,PHYS 1200,Physics II,,,,Xavier University Of Louisiana
Prescott,AZ,Yavapai College,PHY 151,Physics For Scientists And Engineers II,PHYS 1200,Physics II,,,,Yavapai College
